text,start,duration
I think you&amp;#39;re going to see a lot of meetings,1030.529,1.935
occur like the ones that you did today.,1032.464,2.069
"The business leaders coming in,",1034.533,1.134
these union workers.,1035.667,0.868
And it&amp;#39;s interesting.,1036.535,1.602
I&amp;#39;ve -- we -- the President was asking these,1038.137,2.469
"folks today, &amp;quot;How many of you have been in",1040.606,1.401
the Oval Office?&amp;quot;,1042.007,1.235
Three of them raised their hand.,1043.242,1.968
"We&amp;#39;ve talked to some of these union leaders, and",1045.21,1.835
"we hear, &amp;quot;WE didn&amp;#39;t get a lot of attention.&amp;quot;",1047.045,1.836
"And here we are on working day one, and yoy&amp;#39;ve got",1048.881,2.936
the President reaching out to some of America&amp;#39;s best,1051.817,2.402
"business leaders, and then some of the union workers",1054.219,2.903
and line workers and bringing them in and,1057.122,2.102
"saying, &amp;quot;I want to listen to what&amp;#39;s going on",1059.224,1.835
in your life.,1061.059,1.035
What can we be doing to help you?&amp;quot;,1062.094,2.302
And I think that you&amp;#39;re going to see a lot more of,1064.396,1.802
"that, a listening President who&amp;#39;s engaged in",1066.198,2.603
trying to figure out what policies and actions that,1068.801,2.902
"he can take, that this government can take, that",1071.703,2.369
he can work with Congress to make people&amp;#39;s lives,1074.072,2.703
"better, to make their security better, to make",1076.775,3.137
their economics security better.,1079.912,1.368
But you&amp;#39;re going to see a lot of that.,1081.28,1.701
That&amp;#39;s who he is.,1082.981,1.202
"That&amp;#39;s what he did during the transition, and I",1084.183,1.735
think that&amp;#39;s what he&amp;#39;s going to do going forward.,1085.918,1.835
He appreciates the ideas and opinions that come,1087.753,3.87
through the Oval Office or in small groups where he,1091.623,2.503
gets to share their perspective or their ideas,1094.126,2.636
or their opinions.,1096.762,0.867
I think that&amp;#39;s what he&amp;#39;s going to continue later,1097.629,1.502
this afternoon.,1099.131,0.667
The Press: I&amp;#39;m not finished.,1099.798,1.301
"Mr. Spicer: I&amp;#39;m sorry, April.",1101.099,1.435
The Press: I&amp;#39;m sorry.,1102.534,1.101
I want to go back to what the gentleman said about,1103.635,3.103
"the mandate, the New York Post gentleman.",1106.738,1.969
He said something about the Obamacare --,1108.707,2.002
now and the mandate.,1110.709,1.101
With the numbers that you talked about and has been,1111.81,2.836
in the news from Inauguration Day and the,1114.646,2.77
"numbers Saturday, do you believe that you have the",1117.416,2.502
mandate to be able to force through what you had,1119.918,4.305
talked about replacing Obamacare that really,1124.223,2.602
subsidize the whole piece of it to help low income,1126.825,4.338
people get healthcare?,1131.163,1.301
"Mr. Spicer: Well, I think what we have is a mandate",1132.464,4.038
to make healthcare more accessible in lower cost.,1136.502,4.004
That&amp;#39;s what the American people were promised under,1140.506,1.634
"Obamacare, and I think it&amp;#39;s not a question about",1142.14,2.236
"a mandate, and it&amp;#39;s",1144.376,0.734
also not about forcing anything.,1145.11,1.969
It&amp;#39;s about what&amp;#39;s doing the right thing.,1147.079,1.968
It&amp;#39;s about providing people what they&amp;#39;ve been,1149.047,1.669
"promised, which is, you go around this country, and",1150.716,3.036
"you look market after market, and they&amp;#39;re",1153.752,1.368
at one plan.,1155.12,1.402
That&amp;#39;s not what the American people,1156.522,1.334
were promised.,1157.856,0.668
"Not only that, but in many cases, you&amp;#39;re seeing these",1158.524,2.002
"-- the rates go up ten, 15, 20, 30 percent.",1160.526,4.004
"That&amp;#39;s not what they were promised either, and so I",1164.53,1.901
think what the President is doing - and it&amp;#39;s not,1166.431,1.502
just -- I think he&amp;#39;s gotten bi-partisan support,1167.933,2.369
for this -- to work with Congress and to take,1170.302,2.302
executive action where necessary to implement a,1172.604,2.636
healthcare system that provides more people,1175.24,2.002
"healthcare, truly allows them to keep the doctor",1177.242,2.436
"and plan that they&amp;#39;re signing up for, lowers",1179.678,2.135
"cost, creates more competition.",1181.813,2.837
So do I think he has a mandate? Sure.,1184.65,1.968
But it&amp;#39;s not just -- it&amp;#39;s not about -- it&amp;#39;s not,1186.618,2.136
on this issue.,1188.754,0.7
I think that all leaders have a mandate for the,1189.454,2.036
American people: to fix this system and,1191.49,2.369
make it better.,1193.859,1.735
Julie Pace.,1195.594,0.667
"The Press: Sean, I&amp;#39;ve got two more (inaudible).",1196.261,3.07
There&amp;#39;s some discrepancy between what the Russian,1199.331,1.969
is saying and what the Pentagon is saying in,1201.3,2.502
terms of some potential joint action.,1203.802,1.702
Can you clarify that?,1205.504,1.101
"And, generally, is the President open to joint",1206.605,2.235
action in Syria with the Russians?,1208.84,1.669
"Mr. Spicer: On that instance, I know it&amp;#39;s",1210.509,1.835
"still dveoping, and I would refer you back to",1212.344,1.468
the Department of Defense.,1213.812,1.034
"I know that they&amp;#39;re currently monitoring this,",1214.846,3.137
"and I would refer you back to them on that,",1217.983,1.501
and I think --.,1219.484,1.402
The Press: Generally open?,1220.886,1.568
Mr. Spicer: I think that the President has been,1222.454,2.236
very clear that he&amp;#39;s going to work with any country,1224.69,1.368
"that shares our interest in defeating ISIS, not",1226.058,1.334
just on the national security front but on the,1227.392,1.335
economic front.,1228.727,0.667
If we can work with someone to create greater,1229.394,1.335
market access and spur economic growth,1230.729,1.802
and allow U.S.,1232.531,1.101
small business and companies --,1233.632,1.568
The Press: But just on this idea of doing joint,1235.2,1.769
military action with Russia and Syria --,1236.969,1.901
Mr. Spicer: I think if there&amp;#39;s a way that we can,1238.87,1.836
"combat ISIS with any country, whether it&amp;#39;s",1240.706,2.068
"Russia or anyone else, and we have a shared, national",1242.774,2.436
"interest in that, sure, we&amp;#39;ll take it.",1245.21,1.335
The Press: And then the second thing is that when,1246.545,1.334
"he was at the CIA on Saturday, he was talking",1247.879,2.169
about the U.S.,1250.048,0.768
not taking oil during the Iraq War.,1250.816,1.802
And he said that there could be another,1252.618,2.068
chance for that.,1254.686,0.768
What did he mean by that?,1255.454,1.568
"Mr. Spicer: Well, I think that what the President",1257.022,2.002
has been very clear about in foreign policy is that,1259.024,2.169
too often the United States is going in with a,1261.193,2.602
"lot of money, a lot of manpower, and in many",1263.795,2.069
"cases, losing both loss of life, and we want to make",1265.864,4.371
sure that our interests are protected.,1270.235,1.335
"And so if we&amp;#39;re going into a country for a cause, I",1271.57,3.103
think he wants to make sure that America is,1274.673,1.802
getting something out of that for the commitment,1276.475,1.535
and the sacrifice that we&amp;#39;re making.,1278.01,1.334
The Press: Was he foreshadowing,1279.344,1.001
upcoming action?,1280.345,0.668
Mr. Spicer: No.,1281.013,0.667
I think he&amp;#39;s been very clear from throughout the,1281.68,2.602
campaign that he is committed to making sure,1284.282,2.703
that America -- the American people and the,1286.985,2.536
American taxpayer -- see some benefit and ensure,1289.521,2.87
that our interest overseas are not just to create,1292.391,2.969
sending blank checks.,1295.36,1.168
That we&amp;#39;re doing something that either protects,1296.528,1.435
America or is in our best interest.,1297.963,2.135
John Roberts.,1300.098,0.668
"John Roberts: Sean, a couple of",1300.766,0.667
things if I could.,1301.433,0.801
"Later this week, in his executive actions, does",1302.234,2.602
the President plan to take action to greenlight the,1304.836,3.704
keystone XL and Dakota access pipelines?,1308.54,3.937
"And on TPP, John McCain says it was a serious",1312.477,3.637
mistake to do what the President did for,1316.114,2.036
America&amp;#39;s economy and for our strategic position in,1318.15,2.035
the Asia Pacific.,1320.185,0.734
Why was TPP the right thing to do?,1320.919,2.035
Mr. Spicer: Why was it the right thing?,1322.954,2.036
John Roberts: Why was it the right thing to,1324.99,1.935
do to repeal TPP?,1326.925,1.668
Mr. Spicer: Oh.,1328.593,1.635
I think -- because I think the multiple -- when you,1330.228,3.337
"enter into these multi-national agreements,",1333.565,2.402
"you&amp;#39;re allowing any country, no matter the",1335.967,1.669
"size, any one of those 12 including us, to basically",1337.636,3.003
have the same stature as the United States,1340.639,1.768
in the agreement.,1342.407,1.235
So we&amp;#39;re basically on par with some very small,1343.642,2.669
companies who are getting access to,1346.311,1.335
an amazing market.,1347.646,1.701
The United States.,1349.347,0.801
And in return we&amp;#39;re negotiating at the lowest,1350.148,2.736
"common denominator, and I think that when you look",1352.884,2.269
"at big, multi-national agreements, multi-lateral",1355.153,2.703
"agreements, they&amp;#39;re not always in the best",1357.856,1.835
interest of the United States.,1359.691,1.502
The beautiful thing about bi-lateral agreement is,1361.193,1.935
that if any one of the two parties in the agreement,1363.128,2.402
"decides that, at any time, they want to get out of",1365.53,2.603
"the agreement, or they&amp;#39;re not being treated fairly,",1368.133,1.602
they can negotiate it much easier.,1369.735,1.368
"In a multi-national agreement,",1371.103,1.868
that&amp;#39;s not the case.,1372.971,0.901
"In many cases, all of the other countries have to",1373.872,3.07
agree to an action or to let somebody out.,1376.942,2.435
That&amp;#39;s not putting the US interest first.,1379.377,1.702
John Roberts: And the question about Keystone,1381.079,2.536
and Dakota access?,1383.615,1.101
Mr. Spicer: I&amp;#39;m not going to get in front of the,1384.716,2.803
"President&amp;#39;s executive actions, but I will tell",1387.519,1.335
"you that areas like Dakota and the Keystone pipeline,",1388.854,1.868
"areas that we can increase jobs, increase economic",1390.722,3.47
"growth, and tap into America&amp;#39;s energy supply",1394.192,2.436
"more, that&amp;#39;s something that he has been",1396.628,2.002
very clear about.,1398.63,0.834
"I think he talked about it not only on the campaign,",1399.464,2.136
"but around the Thanksgiving period, he",1401.6,2.035
was talking about that being a big priority.,1403.635,2.169
That&amp;#39;s one of those ones where I think that the,1405.804,3.136
energy sector and our natural resources are an,1408.94,2.77
"area where I think the President is very, very",1411.71,2.135
keen on making sure that we maximize our use of,1413.845,2.937
natural resources to America&amp;#39; benefit.,1416.782,2.302
"It&amp;#39;s good for economic growth, it&amp;#39;s good for",1419.084,1.735
"jobs, and it&amp;#39;s good for American energy.",1420.819,2.502
Jonathan Karl.,1423.321,0.734
"The Press: Sean, thanks for being here, first.",1424.055,1.936
Grateful and great to see you.,1425.991,1.635
Mr. Spicer: Thank you.,1427.626,0.667
"The Press: Before I get to a policy question, just",1428.293,1.335
the question about the nature of your job.,1429.628,2.502
Is it your intention to always tell the truth from,1432.13,3.003
"that podium, and will you pledge never to knowingly",1435.133,3.504
say something that is not factual?,1438.637,2.002
Mr. Spicer: It is.,1440.639,1.368
"It&amp;#39;s an honor to do this, and yes, I believe that we",1442.007,4.437
have to be honest with the American people I think,1446.444,1.702
sometimes we can disagree with the facts.,1448.146,1.902
There are certain things that we may miss -- we may,1450.048,3.804
"not fully understand when we come out, but our",1453.852,1.568
"intention is never to lie to you , Jonathan.",1455.42,2.669
"Our job is to make sure that sometimes, and you&amp;#39;re",1458.089,2.336
in the same boat.,1460.425,0.701
"I mean, there are times when you guys tweet",1461.126,2.502
"something out or write a story, and you",1463.628,2.303
publish a correction.,1465.931,1.268
That doesn&amp;#39;t mean that you were intentionally trying,1467.199,2.135
"to deceive readers and the American people, does it?",1469.334,1.969
And I think that we should be afforded the,1471.303,1.902
same opportunity.,1473.205,1.735
There are times when we believe something to be,1474.94,2.168
"true, or we get something from an agency, or we act",1477.108,2.97
in haste because the information available,1480.078,2.402
"wasn&amp;#39;t complete, but our desire to communicate with",1482.48,2.403
the American people and make sure that you have,1484.883,1.868
"the most complete story at the time, and so we do it.",1486.751,2.803
"But, again, I think that when you look net-net,",1489.554,4.638
we&amp;#39;re going to do our best every time we can.,1494.192,2.269
I&amp;#39;m going to come out here and tell you the facts as,1496.461,1.535
"I know them, and if we make a mistake, we&amp;#39;ll do",1497.996,2.269
our best to correct it.,1500.265,1.602
But I don&amp;#39;t -- I think that it&amp;#39;s -- as I,1501.867,2.268
"mentioned the other day -- it&amp;#39;s a two-way street,",1504.135,2.203
there are many mistakes that the media,1506.338,1.334
makes all the time.,1507.672,1.769
"They misreport something, they don&amp;#39;t report",1509.441,1.835
"something, they get a fact wrong.",1511.276,1.702
"I don&amp;#39;t think that&amp;#39;s always the, you know, to",1512.978,1.835
"turn around and say, &amp;quot;You were intentionally lying.&amp;quot;",1514.813,2.669
"I think we all go and try to do our best job, but",1517.482,3.103
with a degree of integrity,1520.585,2.97
in our respective industries.,1523.555,1.168
The Press: Do you have any corrections or,1524.723,1.902
clarifications you want to make (inaudible)?,1526.625,1.468
"Mr. Spicer: Sure, I mean -- well,",1528.093,1.668
"ask away, Jonathan.",1529.761,0.734
"The Press: Well, you know, just for instance, I don&amp;#39;t",1530.495,2.403
want to get into it and re-litigate it.,1532.898,1.935
Just take one issue of Metro ridership.,1534.833,1.668
Mr. Spicer: We did.,1536.501,0.968
And at the time the information that I was,1537.469,2.169
provided by the Inaugural Committee came from an,1539.638,2.302
outside agency that we reported on.,1541.94,2.269
"And I think knowing what we know now, we can tell",1544.209,2.436
that Ramada&amp;#39;s numbers are different.,1546.645,2.402
But we were trying to provide numbers that,1549.047,1.468
we were provided.,1550.515,1.602
That wasn&amp;#39;t like we made them up out of thin air.,1552.117,1.635
The Press: And do you stand by your statement,1553.752,1.668
that that was the most watched Inaugural Address?,1555.42,2.603
Mr. Spicer: Sure.,1558.023,0.667
It was the most watched Inaugural.,1558.69,1.335
Look -- when you look at just the one network alone,1560.025,3.737
got 16.9 million people online.,1563.762,3.603
Another couple of them that there were tens of,1567.365,1.535
millions that watched that online.,1568.9,1.835
"Never mind that the audience that was there,",1570.735,2.436
31 million people watched it on television.,1573.171,2.536
Combine that with the tens of millions of people that,1575.707,2.369
watched it online on a device.,1578.076,2.469
There&amp;#39;s -- it&amp;#39;s unquestionable.,1580.545,1.802
"I don&amp;#39;t, I don&amp;#39;t, and I don&amp;#39;t see any numbers that",1582.347,2.302
dispute that.,1584.649,0.901
"When you add up attendants, viewership,",1585.55,2.87
"total audience in terms of tablets, phones, on",1588.42,3.27
"television, I&amp;#39;d love to see any information that",1591.69,2.802
proves that otherwise.,1594.492,1.402
The Press: And then one other -- Mr. Spicer: Do,1595.894,2.736
you dispute that?,1598.63,0.801
"The Press: Well, I don&amp;#39;t want to get into numbers.",1599.431,2.769
"I, I --",1602.2,1.001
"Mr. Spicer: Well, I do.",1603.201,0.667
I mean --,1603.868,0.668
The Press: Okay. Okay.,1604.536,0.667
Mr. Spicer: I&amp;#39;m just saying...if you&amp;#39;re asking,1605.203,1.335
"to say, &amp;quot;If you add up the network streaming numbers,",1606.538,1.334
"Facebook, YouTube, all of the various livestreaming",1607.872,1.335
"that we have information on so far, I don&amp;#39;t think",1609.207,1.335
there&amp;#39;s any question that it was the largest watched,1610.542,5.038
Inauguration ever.&amp;quot;,1615.58,3.203
The Press: More than Ronald Regan&amp;#39;s in 1981?,1618.783,5.539
Mr. Spicer: I&amp;#39;m pretty sure that Reagan didn&amp;#39;t,1624.322,1.769
"have YouTube, Facebook, or the Internet.",1626.091,2.669
I think 41 million people watched his.,1628.76,3.503
41 million watched his.,1632.263,1.969
"So let&amp;#39;s just take the Nielson ratings, which are",1634.232,1.635
"31 million, and add it to CNN, 16.9 million.",1635.867,3.537
That&amp;#39;s a little higher.,1641.806,1.669
So I&amp;#39;m just saying - I&amp;#39;m not.,1643.475,1.401
You&amp;#39;re asking me for numbers.,1644.876,1.001
There&amp;#39;s just two entities together.,1645.877,1.735
The Press: And the approach that you took on,1647.612,2.803
"Saturday, any second thoughts on that?",1650.415,2.903
Mr. Spicer: I think.,1653.318,1.468
"Jonathan, look.",1654.786,0.667
I want this --,1655.453,0.668
The Press: The way you answered questions -,1656.121,1.334
"Mr. Spicer: I came out to read a statement,",1657.455,1.335
and I did it.,1658.79,0.667
We&amp;#39;re here today.,1659.457,0.668
"I&amp;#39;m going to stay here as long as you want, so I",1660.125,3.069
want to make sure that --,1663.194,4.705
(laughter),1667.899,0.834
I think you guys might want to leave before I do.,1668.733,1.802
"But, look, I want to make sure that we have a",1670.535,3.17
healthy relationship.,1673.705,0.667
We saw the other day that -- and I&amp;#39;m not trying to,1674.372,2.302
rehash history -- but you&amp;#39;re asking the,1676.674,1.335
"question, so I&amp;#39;m going to answer it.",1678.009,1.435
"You know, we had a Tweet go out about",1679.444,2.069
Martin Luther King.,1681.513,1.601
Think about how racially charged that is.,1683.114,3.337
And someone rushes out and says to the entire press,1686.451,2.803
corp that the President of the United States has,1689.254,3.17
removed the bust from his office.,1692.424,3.47
"Do you -- I mean, think about what this signal --",1695.894,2.502
hold on. Please.,1698.396,0.868
The Press: Did he correct himself and apologize?,1699.264,3.103
"Mr. Spicer: No, no.",1702.367,1.201
He actually prides to quote &amp;quot;my colleagues.&amp;quot;,1703.568,2.169
That&amp;#39;s the exact quote. Okay?,1705.737,1.501
"That quote, that report, got tweeted out around and",1707.238,3.771
to report where was the apology to the President,1711.009,2.669
of the United States?,1713.678,1.201
Where was the apology to millions of people who,1714.879,2.203
read that and thought how,1717.082,1.267
racially insensitive that was?,1718.349,2.336
Where was that apology?,1720.685,1.001
"The Press: You accepted his apology though, Sean.",1721.686,2.302
Mr. Spicer: Okay -- I&amp;#39;m asking where was that,1723.988,2.002
"apology, and so I&amp;#39;m just saying that when you --",1725.99,2.736
"when things like that happen, when John Lewis",1728.726,2.87
"says that he&amp;#39;s never missed an inauguration,",1731.596,4.104
and we find out he did.,1735.7,0.834
"Actually, he did under -- he skipped",1736.534,1.368
George W. Bush&amp;#39;s.,1737.902,1.835
That there are points at which we have a right to,1739.737,1.635
make sure that we correct the record.,1741.372,1.435
"I mean, you&amp;#39;re talking about integrity, and",1742.807,3.037
you&amp;#39;re talking about telling the,1745.844,1.401
truth and facts.,1747.245,1.869
I don&amp;#39;t know that it wasn&amp;#39;t malicious at all.,1749.114,1.801
And I&amp;#39;m not saying -- but there&amp;#39;s a point at which,1750.915,1.702
we have a right to go out there and correct the,1752.617,2.436
"record, and I think that over and over again, there",1755.053,2.769
is this attempt to go after this President and,1757.822,5.339
"say, &amp;quot;Well, that can&amp;#39;t be true, and that&amp;#39;s not",1763.161,1.835
"right, and the numbers wont&amp;#39; there.&amp;quot;",1764.996,1.869
And there&amp;#39;s a rush to judgment every time.,1766.865,2.669
And it&amp;#39;s a two-way straight.,1769.534,1.001
We want to have a healthy and open dialogue with the,1770.535,2.436
press corps and the American people about what,1772.971,2.269
"he&amp;#39;s doing to help this country and to unite it,",1775.24,2.435
"but at a time when he&amp;#39;s trying to unite this, and",1777.675,1.902
"he keeps talking about uniting this nation,",1779.577,2.102
"bringing people together, and then a Tweet goes out",1781.679,2.336
in a pool report to a few thousand people saying,1784.015,2.136
"that he removed the bust of Martin Luther King, how",1786.151,3.436
do you think hat goes over?,1789.587,1.201
"The Press: Sean, did the media invent the feud",1790.788,3.17
between the President,1793.958,1.936
and the intelligence community?,1795.894,1.201
Mr. Spicer: Look.,1797.095,0.667
I &amp;#39;m not -- I think that you saw from the response,1797.762,1.335
"the other day that he walked into the CIA,",1799.097,2.636
people were hooting and hollering.,1801.733,1.334
They gave him a five minute standing ovation.,1803.067,1.769
That doesn&amp;#39;t look alike a relationship that&amp;#39;s -- I,1804.836,2.135
"mean, that&amp;#39;s -- they were excited.",1806.971,2.369
But you --,1809.34,0.668
The Press: But this about media invention -,1810.008,1.368
(inaudible) --,1811.376,0.667
Mr. Spicer: But there&amp;#39;s a difference between having,1812.043,1.335
differences with intelligence leaders and,1813.378,1.568
leaders of that community who had strong differences,1814.946,2.569
with than the people and the men and women who toil,1817.515,3.203
"every single day in our intelligence community,",1820.718,2.803
and it was reflected at the CIA.,1823.521,1.568
"I mean, they came there.",1825.089,1.836
They were so excited.,1826.925,1.268
"There were 1,000 people that applied for 3-0 plus",1828.193,2.902
"seats, and we ended up taking in 400 people.",1831.095,2.97
That doesn&amp;#39;t sound like a huge feud.,1834.065,1.969
"They were excited, they were clapping, they were",1836.034,1.801
cheering when he walked in.,1837.835,1.736
And to see reports that made it sound like there,1839.571,1.701
"was some fence mending that needed to happen,",1841.272,3.003
that sure didn&amp;#39;t look that way when you walked in.,1844.275,1.669
I&amp;#39;m going to move on. Yeah?,1845.944,1.534
"The Press: Sean, can I ask what is the US strategic",1847.478,3.738
interest in moving the MUSM Embassy to Tel Aviv,1851.216,3.536
from Jerusalem?,1854.752,0.801
"And, also, in the chat with President el-Sisi",1855.553,3.137
"today, was the status of",1858.69,1.468
the Muslim Brotherhood discussed?,1860.158,1.868
Mr. Spicer: I think the readout -- I just gave you,1862.026,2.169
"the readout on the call, and I think that speaks",1864.195,2.236
"for itself what was discussed,",1866.431,3.103
"and then, I&amp;#39;m sorry.",1869.534,1.201
The first part?,1870.735,0.701
The Press: The first part -- what is the US,1871.436,1.334
strategic interest in moving the embassy --,1872.77,1.869
"Mr. Spicer: As I noted yesterday, through several",1874.639,2.369
"press inquiries, there&amp;#39;s no decisions.",1877.008,1.902
We&amp;#39;re at the very early stages of that decision,1878.91,2.703
making process. Yeah?,1881.613,1.234
"The Press: Sean, please.",1882.847,1.635
"Will there be a detailed discussion, when Prime",1884.482,3.27
"Minster May comes on Friday, of the potential",1887.752,3.37
parameters of what a trade deal might look like.,1891.122,2.436
"Is there going to be a Joint Conference, and is",1893.558,1.902
Donald Trump going to get a state visit back to the,1895.46,2.302
UK later in the year?,1897.762,1.001
Mr. Spicer: Look.,1898.763,1.201
We&amp;#39;re here on working day one.,1899.964,1.802
We&amp;#39;re excited that Prime Minister May is,1901.766,2.069
coming on Friday.,1903.835,0.834
We look forward to it.,1904.669,1.168
I&amp;#39;m sure there will be a discussion of trade.,1905.837,1.902
"The degree to which, I don&amp;#39;t know yet.",1907.739,3.169
And I&amp;#39;m sure we&amp;#39;ll have an opportunity to,1910.908,2.236
brief you out.,1913.144,0.667
I don&amp;#39;t believe we have any plans right now for a,1913.811,2.036
"joint press conference, but that&amp;#39;s something that",1915.847,1.902
our team will be working out with Prime Minister,1917.749,1.668
"May, and we&amp;#39;ll keep you updated",1919.417,2.035
on that. Yeah?,1921.452,0.701
"The Press: Sean, (inaudible)",1922.153,1.135
for American News.,1923.288,0.767
After the Executive Order was withdrawn in the US,1924.055,3.003
"from the TPP, what specific steps will",1927.058,2.803
President Trump take to expand US trade,1929.861,2.035
opportunities abroad?,1931.896,0.901
"Mr. Spicer: Well, again, I think that when he talks",1932.797,1.869
"to Prime Minister may, he&amp;#39;s going to have a great",1934.666,1.534
conversation about the potential for greater,1936.2,2.47
trade with the UK.,1938.67,1.568
I mentioned earlier that when he met with these,1940.238,3.47
"manufacturers this morning, that was right up",1943.708,2.235
there at the top of that list.,1945.943,1.402
How can we get greater market access?,1947.345,2.102
