text,start,duration
What are the specific challenges that these,1949.447,3.103
manufacturers are facing getting market access into,1952.55,2.87
countries around the globe?,1955.42,1.501
And that&amp;#39;s an important issue.,1956.921,1.135
So it&amp;#39;s not - it&amp;#39;s not just other countries but,1958.056,2.602
"within existing trade deals, we can figure out",1960.658,4.438
is there a trade dispute that can be,1965.096,1.335
"settled, the WTO.",1966.431,1.067
Is there a revision to one of the existing trade,1967.498,2.903
treaties that we have now?,1970.401,1.702
But there&amp;#39;s a lot that can be done.,1972.103,1.501
There are things that Congress can update to,1973.604,3.904
make sure that we&amp;#39;re importing and exporting,1977.508,1.702
more to benefit American businesses.,1979.21,1.335
The Press: Does he plan to talk --,1980.545,4.104
thanks. Thanks.,1984.649,1.034
"Has the President, or will the President, have a chat",1985.683,4.505
-- even an informal chat -- the Prime Minster,1990.188,2.235
before she comes here?,1992.423,1.235
Mr. Spicer: There are no plans for that now.,1993.658,1.735
It&amp;#39;s always possible.,1995.393,1.368
He&amp;#39;s been having a tremendous,1996.761,1.935
number of calls.,1998.696,1.068
I think the number is well over 80 now of people that,1999.764,2.302
"have talked to him, congratulated him.",2002.066,2.369
"Prior to being elected, he&amp;#39;s had -- we read out",2004.435,2.202
that he&amp;#39;s met with both Canada and Mexico.,2006.637,2.436
I think he&amp;#39;s talked to -- Prime Minister Netanyahu,2009.073,2.736
"yesterday, President el-Sisi today.",2011.809,2.036
I think there&amp;#39;s going to continue to be a robust,2013.845,2.002
number of world leaders.,2015.847,1.668
Mr. Spicer: To make sure that we&amp;#39;re importing and,2017.515,4.972
exporting more to benefit American businesses.,2025.089,6.14
The Press: Thanks. Thanks.,2031.229,2.636
John Christopher.,2033.865,0.967
You had (inaudible).,2034.832,0.834
Has the President or will the President have a chat,2035.666,5.473
-- even an informal chat -- with the Prime Minister,2041.139,3.67
"before, in fact, she comes here?",2044.809,1.335
Mr. Spicer: There are no plans for that now.,2046.144,1.334
It&amp;#39;s always possible.,2047.478,0.668
He&amp;#39;s been having a,2048.146,0.667
tremendous number of calls.,2048.813,0.667
I think the number is well over 80 now of people that,2049.48,1.335
"have talked to him, congratulated him prior to",2050.815,1.368
being elected.,2052.183,0.667
He&amp;#39;s had -- we ran out the other day -- he&amp;#39;s met with,2052.85,1.335
both Canada and Mexico.,2054.185,0.667
I think he&amp;#39;s talked -- Prime Minister Netanyahu,2054.852,1.335
"yesterday, President el-Sisi today.",2056.187,1.335
I think there&amp;#39;s going to continue to be a robust,2057.522,1.334
number of world leaders.,2058.856,0.668
"There&amp;#39;s a, you know, a tremendous excitement, I",2059.524,1.368
"think, in the diplomatic core and at the world",2060.892,1.334
leader level of people who are excited that President,2062.226,1.335
Trump and this administration,2063.561,0.667
want to engage.,2064.228,0.668
There&amp;#39;s a lot of times where he&amp;#39;s talking to,2064.896,1.334
"these folks and they&amp;#39;re saying, &amp;quot;I have not heard",2066.23,1.335
from anyone in years.&amp;quot;,2067.565,0.701
And I think that there is a genuine excitement to,2068.266,1.334
"reengage the United States, especially in the",2069.6,1.335
"area of trade and other economic interests, but",2070.935,1.335
also in the area of national security.,2072.27,1.334
The Press: (inaudible),2073.604,0.668
Mr. Spicer: I&amp;#39;m sorry.,2074.272,0.667
The Press: Needless to say this is the big one and,2074.939,1.335
it&amp;#39;s the first special relationship.,2076.274,1.368
The Press: TPP was dead on arrival going to Congress.,2077.642,1.334
So why is this executive order anything more,2078.976,1.335
than symbolic?,2080.311,0.667
And when will President Trump start negotiating,2080.978,1.335
those bilateral deals with the 11 other countries in,2082.313,1.335
the Asia-Pacific?,2083.648,0.667
"Because it takes some time and that could be, some",2084.315,1.368
"would say, giving China, you know, room to",2085.683,1.335
make an in road.,2087.018,0.667
"Mr. Spicer: Well, first I would argue that bilateral",2087.685,1.335
deals are mostly what China&amp;#39;s been engaging in,2089.02,1.334
and that&amp;#39;s something that&amp;#39;s been said that I,2090.354,1.335
"just said that we&amp;#39;re going to -- you know, the",2091.689,1.368
President&amp;#39;s going to look,2093.057,0.667
to countries to engage with.,2093.724,0.668
The Press: (inaudible) TPP countries.,2094.392,1.334
Mr. Spicer: Most of them we have existing trade,2095.726,1.335
agreements with or a good chunk of them we have,2097.061,1.335
existing trade agreements to begin with.,2098.396,1.334
This was an expansion of that and in some areas it,2099.73,1.335
"allowed, whether it was in the service industry,",2101.065,1.368
"financial services, additional market access.",2102.433,1.335
"But, I think that this is -- this is not a deal that",2103.768,1.334
was in our country&amp;#39;s best interest.,2105.102,1.335
The President could have come into office -- a,2106.437,1.335
"president could have come into office, renegotiated",2107.772,1.334
"it, and sent people back to the drawing board.",2109.106,1.369
It hadn&amp;#39;t gone to Congress yet because it,2110.475,1.334
wasn&amp;#39;t finalized.,2111.809,0.668
I think this president pulling out of the,2112.477,1.334
"agreement is not just about this one agreement,",2113.811,1.335
but I think it&amp;#39;s symbolic both here in America and,2115.146,1.335
around the world of a new era of trade policy.,2116.481,2.836
One that&amp;#39;s going to put American workers first and,2119.317,2.002
foremost and one that assures the rest of the,2121.319,3.537
world that the way that we negotiate bilateral,2124.856,2.836
agreements is going to ensure that we get,2127.692,2.302
something out of these deals.,2129.994,1.435
"As I mentioned to John a minute ago, the problem",2131.429,2.502
with multilateral agreements is that often,2133.931,2.169
we -- it becomes the lowest common denominator,2136.1,1.835
on so many things.,2137.935,1.168
For the U.S.,2139.103,0.667
what already has low tariffs and other service,2139.77,2.77
"industry benefits for countries, you know, we&amp;#39;ve",2142.54,2.97
got to make sure we&amp;#39;re going out and fighting for,2145.51,2.369
the American worker. Jennifer?,2147.879,1.134
The Press: You&amp;#39;re not going to renegotiate?,2149.013,1.802
To be clear is that what you&amp;#39;re saying?,2150.815,2.269
Mr. Spicer: We pulled out of the TPP.,2153.084,1.368
"The Press: No, but of all the existing",2154.452,1.334
deals (inaudible) --,2155.786,0.668
Mr. Spicer: We&amp;#39;ll have further updates on trade,2156.454,1.334
issues later this week.,2157.788,1.235
Jennifer?,2159.023,0.667
The Press: Does the administration feel like,2159.69,1.435
you still need an executive order to remove,2161.125,2.236
yourself from NAFTA?,2163.361,1.268
Mr. Spicer: That&amp;#39;s a great question.,2164.629,1.635
I believe there&amp;#39;s an action that has to be,2166.264,1.635
taken under the provision of NAFTA where you send,2167.899,4.27
"notice to the other countries, the other two",2172.169,2.036
countries.,2174.205,1.568
The exact nature of how that&amp;#39;s described I,2175.773,2.87
don&amp;#39;t know.,2178.643,0.667
"But it is -- there is a trigger within NAFTA, one",2179.31,2.502
of the sections allows the President of the United,2181.812,3.204
States to notify them that we intend to do that.,2185.016,2.903
The Press: (inaudible),2187.919,0.767
"Mr. Spicer: Hold on, Jennifer.",2188.686,1.335
The Press: Will there still be a North American,2190.021,2.369
trade block or something different?,2192.39,1.368
"Mr. Spicer: Again, I think part of it is he&amp;#39;s already",2193.758,2.936
spoken to both the President of Mexico and,2196.694,2.803
Prime Minister of Canada about his,2199.497,2.235
desire to renegotiate.,2201.732,2.436
And I think as he meets with both of these,2204.168,1.602
individuals over the next 30 days or so that&amp;#39;s going,2205.77,2.736
to be a topic.,2208.506,0.667
"Now, if they come in and express a willingness to",2209.173,3.637
do that you could negotiate it within the,2212.81,2.002
current parameters and update it through the,2214.812,3.403
existing structure.,2218.215,1.369
If they don&amp;#39;t and he decides to pull out then,2219.584,2.602
we would have to go back to the drawing table in,2222.186,1.635
the future. Mara? Mara.,2223.821,1.001
Mr. Spicer: I want to make sure Mara gets a,2224.822,3.403
question this time.,2228.225,1.635
The Press: Just to follow up on the China question.,2229.86,3.904
China actually has a regional agreement called,2233.764,2.67
the Regional Comprehensive Economic Partnership and,2236.434,1.968
"now Japan and Australia, two of our great allies,",2238.402,2.937
are talking about joining that.,2241.339,1.668
Just does President Trump see a national security,2243.007,2.536
component to these trade deals?,2245.543,1.535
And is he concerned that now China will write the,2247.078,2.669
rules for Asia-Pacific trade?,2249.747,1.702
"Mr. Spicer: Well, I think he has been very, very",2251.449,2.802
clear about China&amp;#39;s place in the -- in the,2254.251,4.438
geopolitical landscape both economically and,2258.689,2.436
national security-wise.,2261.125,2.236
So he understands the need -- that&amp;#39;s part of the,2263.361,2.202
reason that trade is important --,2265.563,1.468
bilateral trade.,2267.031,1.201
It provides a check on a lot of this.,2268.232,1.668
"But again, he&amp;#39;s always going to be fighting for",2269.9,3.104
the interest of the country and the,2273.004,1.334
American worker.,2274.338,0.668
So how we engage and with whom is going to be,2275.006,3.403
decided on whether or whether not we can get a,2278.409,1.335
deal that benefits our country economically and,2279.744,3.103
in terms of national security.,2282.847,1.568
That there are things that we can do economically,2284.415,2.469
that actually end up also benefitting us from a,2286.884,4.371
national security standpoint because of the,2291.255,2.069
economic relationship that exists between,2293.324,2.035
the two countries.,2295.359,0.734
"Yes, sir.",2296.093,0.701
The Press: Can I follow up on another?,2296.794,1.335
"Mr. Spicer: Okay, Mara gets a follow up?",2298.129,1.334
The Press: I&amp;#39;m sorry.,2299.463,0.701
Thank you.,2300.164,0.667
"Mr. Spicer: No, you earned it.",2300.831,0.801
The Press: Just really simple -- what is the,2301.632,2.569
average national unemployment rate?,2304.201,1.335
Mr. Spicer: What&amp;#39;s the average?,2305.536,0.701
"The Press: No, I mean what&amp;#39;s the overall",2306.237,1.835
unemployment rate today?,2308.072,0.701
Mr. Spicer: Are you talking about whether or,2308.773,1.334
not we include the full --,2310.107,1.402
The Press: I&amp;#39;m just asking.,2311.509,0.667
Mr. Spicer: I mean the Bureau of Labor statistics,2312.176,1.602
puts it at --,2313.778,1.001
The Press: You accept the --,2314.779,1.935
"Mr. Spicer: No, it&amp;#39;s not a question of what I accept.",2316.714,2.235
"I mean, there are ways that you can put out",2318.949,1.368
full employment --,2320.317,0.668
The Press: I know the difference.,2320.985,1.334
"Mr. Spicer: Right, but I&amp;#39;m saying -- so there&amp;#39;s a",2322.319,1.335
reason that we put out several versions of that.,2323.654,1.335
One is that it -- the illustrative nature of how,2324.989,2.602
"you count the unemployed, whether or not they&amp;#39;re",2327.591,2.269
"long-term unemployed, or whether or not they&amp;#39;re",2329.86,1.969
still seeking a job.,2331.829,1.501
But there&amp;#39;s a reason that you put out several of,2333.33,1.635
these statistics.,2334.965,0.701
It&amp;#39;s so that economists can view them and decide,2335.666,2.903
-- look at different landscapes on how to make,2338.569,4.004
economic policy.,2342.573,0.868
The Press: (inaudible) during the campaign he had,2343.441,1.568
at one point -- Trump at one point said that it,2345.009,1.668
was 42 percent.,2346.677,0.667
I just want to be clear on where we&amp;#39;re starting.,2347.344,2.336
"Mr. Spicer: But again -- but again, part of it is",2349.68,1.335
his economic team is going to look at a multitude of,2351.015,1.702
statistics and drive economic policies.,2352.717,2.102
His goal is obviously to get as many Americans,2354.819,1.902
working together.,2356.721,0.934
That&amp;#39;s his ultimate goal -- is that when he sees,2357.655,2.202
people that are hurting that haven&amp;#39;t had wages,2359.857,2.069
"lifted up, that are unemployed, that can&amp;#39;t",2361.926,2.469
"save for their kid&amp;#39;s future, that are having",2364.395,2.536
trouble with their healthcare costs -- that&amp;#39;s,2366.931,1.401
what he really cares about.,2368.332,1.268
It&amp;#39;s not just a number to him.,2369.6,1.435
It&amp;#39;s about -- it&amp;#39;s someone getting by.,2371.035,2.469
Are their wages going up?,2373.504,1.301
Can they find a better job?,2374.805,1.602
Do they have access to education whether it&amp;#39;s,2376.407,2.669
"higher education, college, or a voc-technical kind",2379.076,3.27
of school?,2382.346,0.667
So that they can train for the skills of the,2383.013,1.936
next century.,2384.949,0.667
Those are the kind of things the President --,2385.616,2.97
he&amp;#39;s not focused on statistics as much as he,2388.586,2.702
is on whether or not the American people are doing,2391.288,2.369
better as a whole and whether or not a family.,2393.657,1.969
And it was interesting.,2395.626,0.834
I know when we talked about Carrier at one point,2396.46,1.669
"or something -- well, that&amp;#39;s 1,000 jobs.",2398.129,1.501
"When you talk about those 1,000 jobs and their",2399.63,2.102
families -- during the holiday season I would beg,2401.732,2.936
to differ that those people were unbelievably,2404.668,2.336
ecstatic that the President and the Vice,2407.004,1.969
President intervened.,2408.973,1.401
"And so, every one of these meetings that you saw",2410.374,2.269
happen at Trump Tower and then now -- it&amp;#39;s all,2412.643,2.736
"about, you know, whether it&amp;#39;s 2,000 jobs or",2415.379,2.069
"20,000 jobs.",2417.448,1.868
That&amp;#39;s the focus.,2419.316,1.602
It&amp;#39;s making sure that we have -- that small,2420.918,2.169
businesses have greater opportunity to be,2423.087,2.135
"successful, that American workers can have their",2425.222,1.835
"wages lifted up, that the benefits that they receive",2427.057,2.737
in terms of healthcare and education are something,2429.794,2.402
that provide them the support that they need.,2432.196,2.769
Because that&amp;#39;s what this is all about.,2434.965,2.002
I think for too often in Washington we get our,2436.967,1.602
heads wrapped around a number and a statistic and,2438.569,2.803
we look at and we forget the faces and the families,2441.372,2.702
and the businesses that are behind those numbers.,2444.074,2.47
And so I think that&amp;#39;s where his head&amp;#39;s at -- is,2446.544,2.335
trying to look at those people that come to his,2448.879,1.702
"rallies, that have come to his events, that he&amp;#39;s met",2450.581,1.835
"with in person that are struggling and say, &amp;quot;Mr.",2452.416,2.369
"Trump, I&amp;#39;m working as hard as I can.",2454.785,2.603
I&amp;#39;m working two jobs.,2457.388,1.501
I&amp;#39;m doing everything by the rules and I keep,2458.889,2.336
getting screwed.&amp;quot;,2461.225,1.335
That&amp;#39;s what he&amp;#39;s fighting for is that man or woman,2462.56,2.202
"out there that&amp;#39;s doing everything they can right,",2464.762,3.336
but can&amp;#39;t catch a break.,2468.098,1.602
And I think he addressed that in his inaugural,2469.7,1.768
speech when he talked about shifting power,2471.468,2.336
"outside of Washington, D.C. back to",2473.804,2.169
the American people.,2475.973,1.301
"Because for too long it&amp;#39;s been about stats, Mara.",2477.274,2.269
And it&amp;#39;s been about what number are we looking at,2479.543,2.169
as opposed to what face are we looking at.,2481.712,1.902
Yeah. David.,2483.614,0.734
The Press: I have two questions.,2484.348,2.135
"One on -- back on DACA, I was just curious about the",2486.483,2.269
message from this administration from the,2488.752,1.368
White House to young people who may qualify and,2490.12,2.937
not yet have the protection should they,2493.057,1.468
enroll going forward?,2494.525,2.836
And those who are in the program now seek renewal?,2497.361,2.336
"Mr. Spicer: Well, I think -- yeah, what those people",2499.697,3.203
should know is that the President&amp;#39;s laid out a,2502.9,1.835
list of priorities.,2504.735,0.801
And the priorities are focused on making sure,2505.536,3.003
that people who can do harm or have done harm and,2508.539,2.736
have a criminal record are the focus.,2511.275,2.069
"And as he said throughout the campaign, we&amp;#39;ve got a",2513.344,2.502
series of individuals who we&amp;#39;ve got to figure out --,2515.846,2.069
"people who have overstayed their Visas, people who",2517.915,1.635
have committed crime.,2519.55,0.667
And we&amp;#39;re going to go through that in a very,2520.217,1.635
systematic and methodical way.,2521.852,1.835
So for now that&amp;#39;s not -- the focus is going to be,2523.687,2.536
on people who&amp;#39;ve done,2526.223,1.035
harm to our country. Yes.,2527.258,1.001
The Press: (inaudible) 2016 was the hottest year,2528.259,2.936
on record and the last three years have been the,2531.195,3.103
hottest on record.,2534.298,0.934
Scientists are saying that we&amp;#39;re getting dangerously,2535.232,2.169
close to the point where human civilization is,2537.401,2.469
being threatened.,2539.87,0.667
How does President Trump plan to address this?,2540.537,2.436
"Mr. Spicer: Well, I think -- I think he&amp;#39;s going to",2542.973,2.569
meet with his team and figure out what policies,2545.542,2.737
are best for the environment.,2548.279,2.035
But I think that there&amp;#39;s -- one of the things that,2550.314,2.069
he talked about during the campaign is there is a,2552.383,1.935
balance and he&amp;#39;s trying to make sure we use our,2554.318,2.469
"resources appropriately, that we maximize things to",2556.787,3.036
make sure that we don&amp;#39;t do so at the detriment of,2559.823,2.036
economic growth and job creation.,2561.859,2.069
So there&amp;#39;s a balance and I don&amp;#39;t think it&amp;#39;s an either,2563.928,1.701
or situation.,2565.629,1.302
We can ensure that we&amp;#39;re doing things that are,2566.931,1.534
smart for the environment and smart for our,2568.465,2.203
longevity as well as making sure that we&amp;#39;re,2570.668,2.302
doing things that create economic growth and,2572.97,2.436
"job creation. Yes, sir. Yeah.",2575.406,1.034
"The Press: Sean, what is the President&amp;#39;s message to",2576.44,3.103
the millions of people here in Washington and,2579.543,2.202
around the country who were protesting on,2581.745,2.236
Saturday?,2583.981,0.667
And a follow up after that.,2584.648,1.869
Mr. Spicer: Okay.,2586.517,1.134
That is very polite of you.,2587.651,0.934
I think he has a healthy respect for the First,2588.585,3.904
"Amendment and he -- this is, you know, this is what",2592.489,4.338
makes our country so beautiful.,2596.827,1.735
Is that on one day you can inaugurate a President.,2598.562,1.835
On the next day people can occupy the same space to,2600.397,3.07
protest something.,2603.467,0.767
But he&amp;#39;s also cognizant to the fact that a lot of,2604.234,3.504
these people were there to protest an issue of,2607.738,3.503
concern to them and not against anything.,2611.241,1.969
I remember -- this morning Debbie Dingle was on,2613.21,3.103
"television and, you know, she&amp;#39;s talking about -- let",2616.313,2.169
me just -- I don&amp;#39;t want to inaccurately quote her.,2618.482,2.169
I know Jonathan&amp;#39;s a stickler for that.,2620.651,2.002
(laughter),2622.653,0.667
"She said, &amp;quot;Different women were there for different",2623.32,2.736
"reasons, but they were all there to make sure that",2626.056,1.835
their core American values are going to be protected.,2627.891,2.036
And I think many people like me were there for,2629.927,2.769
positive reasons.&amp;quot;,2632.696,0.768
And I think the President shares Debbie Dingle&amp;#39;s,2633.464,2.302
views that there were people that came to the,2635.766,1.835
mall as they do all the time.,2637.601,2.302
Sometimes in smaller numbers and --,2639.903,1.936
(inaudible),2641.839,0.667
I think he reaches out to them in the way that he,2642.506,2.436
"started on the night that he won the election, on",2644.942,2.803
the way that he did on inauguration day by,2647.745,2.669
sending a message that talks about,2650.414,1.501
fighting for them.,2651.915,1.001
But more importantly I think the President&amp;#39;s,2652.916,1.702
going to show through action and through success,2654.618,2.035
that he&amp;#39;s fighting for them and fighting for,2656.653,2.136
every American.,2658.789,1.268
One of the things that we&amp;#39;ve seen so often in,2660.057,2.536
this town is a lot of soaring rhetoric about how,2662.593,2.402
much people care.,2664.995,0.868
And I think the President is going to show through,2665.863,2.402
deed and action and success that he wants to,2668.265,2.97
"fight for people&amp;#39;s healthcare, he wants to",2671.235,2.435
"have a better education system, he wants a",2673.67,2.069
stronger America.,2675.739,0.901
He wants to go in and fix our inner cities.,2676.64,2.569
"He wants to make sure that our infrastructure, our",2679.209,1.936
roads and our bridges -- so I think more than,2681.145,2.202
anything showing people through action and deed,2683.347,2.602
and success is where he&amp;#39;s going to prove to the,2685.949,1.936
American people how much he cares to unite us and,2687.885,3.17
how much he cares to make this America better,2691.055,2.402
and safer. Yeah?,2693.457,0.934
"The Press: On the other side of this, another",2694.391,2.436
group that&amp;#39;s coming to Washington --,2696.827,1.802
"Mr. Spicer: I forgot, you did ask.",2698.629,1.334
"The Press: I did, thank you for remembering.",2699.963,1.502
Another group -- and this is a follow up on CBN&amp;#39;s,2701.465,2.102
question a moment ago.,2703.567,0.734
"You know, when we have the March for Life here in",2704.301,2.569
"Washington, you&amp;#39;ve said that this is",2706.87,1.802
pro-life president.,2708.672,0.667
What concrete promises is he making?,2709.339,2.103
We haven&amp;#39;t heard a lot about what that policy is,2711.442,3.036
going to look like.,2714.478,1.001
Mr. Spicer: It&amp;#39;s day one.,2715.479,1.068
"The Press: Yeah, but you&amp;#39;ve had a lot of time",2716.547,1.334
to make those promises.,2717.881,0.668
"Mr. Spicer: I know, but I think --",2718.549,1.501
The Press: What should their expectations be?,2720.05,1.835
Mr. Spicer: Their expectations should be,2721.885,1.402
that he&amp;#39;s going to stand up and value life,2723.287,2.435
born or unborn.,2725.722,1.302
Same as he said throughout the last year and a half.,2727.024,2.569
"That he&amp;#39;s going to stand up and protect life,",2729.593,1.568
"promote it, and instill policies that promote",2731.161,3.57
"life, that promote adoption, that help",2734.731,1.936
"support young women, that help support funding of",2736.667,3.57
agencies and clinics that support women&amp;#39;s health.,2740.237,3.503
I think that&amp;#39;s what he&amp;#39;s going to talk about is,2743.74,1.669
"supporting all of life -- the born, the unborn.",2745.409,2.969
Throughout life making sure that we have,2748.378,1.569
healthcare that can support the American,2749.947,2.502
people and American families.,2752.449,1.902
That&amp;#39;s what he&amp;#39;s going to fight for and that&amp;#39;s what,2754.351,1.802
he&amp;#39;s going to be clear on. Anita?,2756.153,1.335
The Press: I have two questions.,2757.488,1.635
Mr. Spicer: Okay.,2759.123,0.934
The Press: I&amp;#39;m putting it out there right now.,2760.057,2.836
The first one with the Congressional meeting,2762.893,2.202
"today and also at the retreat, you said talking",2765.095,2.803
about his legislative agenda.,2767.898,1.268
"Besides healthcare, can you give us one, two, or",2769.166,2.836
three legislative things that he wants to get,2772.002,2.002
through right away?,2774.004,0.968
"So not the executive actions, legislation.",2774.972,1.935
Mr. Spicer: Right.,2776.907,0.968
Immigration&amp;#39;s obviously going to be high,2777.875,1.968
on that list.,2779.843,0.968
"Tax reform, regulatory reform is three and four.",2780.811,2.569
The Press: Immigration is not an overhaul though.,2783.38,3.504
"Mr. Spicer: Well, I think he&amp;#39;s going to work with",2786.884,1.334
Congress to get the,2788.218,0.668
appropriations process going.,2788.886,1.568
But it&amp;#39;s not -- it&amp;#39;s not just building the wall.,2790.454,2.169
That&amp;#39;s through the appropriations process.,2792.623,1.368
It&amp;#39;s how do we enact policies to make sure that,2793.991,3.503
what we have now doesn&amp;#39;t happen again?,2797.494,2.036
And so it&amp;#39;s -- it is -- it is working with them.,2799.53,2.202
It&amp;#39;s a comprehensive look at how we&amp;#39;re keeping,2801.732,3.136
"people out of this country that shouldn&amp;#39;t be here,",2804.868,2.403
that people who are coming to visit are leaving when,2807.271,1.635
"they&amp;#39;re supposed to, to make sure that we&amp;#39;re",2808.906,2.068
"tailoring immigration policies, that make sure",2810.974,2.87
"we&amp;#39;re not, you know, an open door for just anyone",2813.844,2.936
"to walk in, that the people who are here to",2816.78,1.335
