text,start,duration
and desist in terms of social media --,1011.143,1.602
"Mr. Spicer: No, no, just to be clear,",1012.745,1.668
I&amp;#39;m not saying that --,1014.413,1.001
The Press: -- forces then --,1015.414,1.234
"Mr. Spicer: No, no, hold on. Zero --",1016.648,1.669
The Press: I have one more question.,1018.317,1.435
"Mr. Spicer: Okay, but I think I need to make sure",1019.752,2.268
that were clear on this John.,1022.02,1.335
They haven&amp;#39;t been directed by us to do anything.,1023.355,2.836
I think from what I understand is that they&amp;#39;ve,1026.191,3.17
been told within their agencies to adhere to,1029.361,2.069
their own policies.,1031.43,1.301
But that directive did not come from here.,1032.731,1.602
The Press: But the question is does this,1034.333,1.501
President believe that these agencies and some of,1035.834,2.903
the federal work force has become politicized?,1038.737,2.036
Mr. Spicer: I honestly don&amp;#39;t know that we spent a,1040.773,2.268
ton of time thinking of that.,1043.041,1.268
That we&amp;#39;ve been fairly busy on other things.,1044.309,3.637
"It&amp;#39;s a good question, I have not asked",1047.946,2.036
him that question.,1049.982,1.001
I think our focus has pretty much been getting,1050.983,2.602
"the job done, as you&amp;#39;ve seen through the meetings",1053.585,2.203
"that he&amp;#39;s had, the work that he&amp;#39;s had with members",1055.788,1.501
"of Congress, union workers, the auto heads,",1057.289,2.536
the other business leaders.,1059.825,1.234
I mean his focus has been much more focused on,1061.059,3.771
getting the job done then various tweets that are,1064.83,2.736
getting deleted and un-deleted.,1067.566,1.468
"Hold on, sorry, Lynn Sweet.",1069.034,3.003
Not that I want to encourage anyone,1072.037,1.502
else to yell.,1073.539,0.767
(laughter),1074.306,0.667
"The Press: This is so important to Chicago, so",1074.973,2.369
thank you so much.,1077.342,1.235
Mr. Spicer: I&amp;#39;m sure.,1078.577,1.235
The Press: And President Trump has talked a lot,1079.812,2.769
about Chicago.,1082.581,0.667
"So, my question is, he said if Chicago doesn&amp;#39;t",1083.248,2.703
fix the horrible carnage I will send in the feds.,1085.951,3.036
Can you perhaps share with me a little bit about what,1088.987,3.37
is the nature of the federal help that the,1092.357,2.77
"President has in mind, agents, law enforcement",1095.127,2.135
"agents, or National Guard?",1097.262,1.235
And what factors will determine if he acts --,1098.497,2.769
Rahm&amp;#39;s people told us after the meeting in Trump,1101.266,2.736
"Tower on December 7, he did tell them things that",1104.002,3.07
"would help Chicago that he could use, such as summer",1107.072,3.07
"jobs, more prosecutions, and gun laws.",1110.142,1.835
Mr. Spicer: I think what the President is upset,1111.977,2.836
about is turning on the television and seeing,1114.813,2.302
Americans get killed by shootings.,1117.115,2.403
Seeing people walking down the street and,1119.518,1.368
getting shot down.,1120.886,0.667
The President of the United States giving his,1121.553,1.335
farewell address and two people being,1122.888,1.335
killed that day.,1124.223,0.667
And when you look at a city like that he&amp;#39;s had,1124.89,5.005
conversations with police officers in Chicago and,1132.865,2.769
asked them you know what is preventing you from,1135.634,2.269
solving this.,1137.903,0.701
And I think in many cases there are some issues that,1138.604,2.168
can be resolved that will help them do their job,1140.772,2.737
better to keep the people of Chicago safer.,1143.509,2.335
And what he wants to do is provide the resources of,1145.844,3.037
the federal government and it can span a bunch of,1148.881,1.835
things.,1150.716,0.667
There&amp;#39;s no one thing it can be -- you know there,1151.383,2.269
"can be aid, there can be if was requested up",1153.652,2.502
"through the governor, through the proper",1156.154,1.502
"channels, that the federal government can provide on",1157.656,2.035
a law enforcement basis.,1159.691,1.368
But there&amp;#39;s other aid that can be extended as well,1161.059,2.136
either through the U.S.,1163.195,0.801
Attorney&amp;#39;s Office or other means that will ensure,1163.996,2.869
that the people of Chicago,1166.865,1.635
have the resources to feel safe.,1168.5,1.735
That&amp;#39;s what he means Lynn.,1170.235,1.268
"And part of it is that no American, whether or not",1171.503,2.903
you live in Chicago or Nebraska shouldn&amp;#39;t feel,1174.406,2.836
like you can walk down the streets of a city or the,1177.242,3.704
streets of a city in this country and fear,1180.946,2.269
for your life.,1183.215,1.268
And I think too often that&amp;#39;s happening,1184.483,1.001
in Chicago.,1185.484,1.101
The Press: What will happen next just so we,1186.585,1.268
know the time table?,1187.853,1.001
Mr. Spicer: I think next is we&amp;#39;ll get hopefully get,1188.854,3.336
a dialog started with Mayor Emanuel.,1192.19,2.136
Try to figure out what a path forward can be so,1194.326,2.769
that we get -- we come up with a plan that can keep,1197.095,3.204
the people of Chicago safe and help ease the,1200.299,2.969
problem there. Yes.,1203.268,3.47
The Press: Did Mexico&amp;#39;s government have any,1206.738,1.068
knowledge that this new executive order would be,1207.806,1.802
signed today?,1209.608,1.501
And do you feel President Trump and President Pena,1211.109,2.102
Nieto will be on the same page after they meet next,1213.211,2.703
week in terms of who is paying for the wall?,1215.914,2.369
Mr. Spicer: I hope so.,1218.283,1.402
I think that they&amp;#39;re definitely going to,1219.685,1.301
discuss not only NAFTA but the wall.,1220.986,1.868
There&amp;#39;s a lot of stuff that are going to come up.,1222.854,1.335
We&amp;#39;ve got a lot of trade that goes between the two,1224.189,1.668
"countries, there&amp;#39;s some security -- obviously,",1225.857,2.403
homeland security issues but there&amp;#39;s no question I,1228.26,1.935
think that NAFTA is going to be big on that list and,1230.195,2.136
trade overall.,1232.331,0.734
But and with respect to your first question I,1234.633,2.636
don&amp;#39;t think we generally telegraph to people who,1237.269,3.236
are coming to visit what executive orders were,1240.505,1.435
going to send. Kristen.,1241.94,1.735
"The Press: Sean, thank you.",1243.675,1.201
A couple of questions.,1244.876,1.035
I want to go back to that draft executive order that,1245.911,2.436
would undo some of the restrictions,1248.347,1.534
for detainees.,1249.881,1.302
Has the President seen that draft EO?,1251.183,3.103
Mr. Spicer: I&amp;#39;m sorry the one that he&amp;#39;s signing?,1254.286,1.101
The Press: Has he seen it?,1255.387,0.767
"No, no the draft executive order that would undo the",1256.154,3.337
restrictions on how to handle detainees.,1259.491,2.336
Mr. Spicer: I guess I&amp;#39;m having a hard time you&amp;#39;re,1261.827,2.702
asking me if a document that&amp;#39;s not a White House,1264.529,2.369
document he&amp;#39;s seen.,1266.898,1.535
I don&amp;#39;t believe to the best of my knowledge and,1268.433,1.235
so I would ask -- this is the second day in a row,1269.668,4.004
we&amp;#39;re getting asked about documents that are,1273.672,1.935
floating around and people saying -- and frankly,1275.607,2.87
reports being published attributing documents to,1278.477,3.603
the White House that are not White House documents.,1282.08,1.602
The Press: Sean I haven&amp;#39;t attributed --,1283.682,0.801
"Mr. Spicer: No, no, I&amp;#39;m not saying you.",1284.75,0.567
The Press: I&amp;#39;m asking do you know if he&amp;#39;s seen it?,1285.617,1.268
Mr. Spicer: To the best of my knowledge he,1287.285,0.935
hasn&amp;#39;t seen it.,1288.487,0.6
I think he&amp;#39;s got a lot of other things --,1289.087,0.901
The Press: Since it is floating around Sean --,1290.222,1.468
"Mr. Spicer: You get one more, let&amp;#39;s not be greedy.",1291.99,2.336
The Press: I have two more.,1294.593,0.867
Since it is floating around --,1295.761,0.901
Mr. Spicer: Okay.,1296.928,1.135
The Press: -- is he considering --,1298.063,0.233
Mr. Spicer: Kristin don&amp;#39;t this is a --,1298.697,0.4
The Press: -- black sites and other orders --,1299.331,2.269
Mr. Spicer: I&amp;#39;m not going to start answering,1301.833,1.168
hypothetical about documents that are,1303.235,0.767
floating around.,1304.002,0.901
You&amp;#39;re basically --,1304.903,0.434
The Press: -- is he considering --,1305.337,1.034
"Mr. Spicer: Okay, Kristen we&amp;#39;re going to end",1306.605,0.767
this right now.,1307.639,0.434
"Hunter, Hunter, no, Hunter Walker thank you. Hunter.",1308.073,2.302
"The Press: Thank you, Sean.",1310.642,0.601
The President is reportedly going to limit,1311.51,2.169
access to the country for visa holders and refugees,1313.679,2.569
"from Iraq, Iran, Libya, Somalia, Sudan,",1316.248,1.802
"Syria, and Yemen.",1318.05,1.801
Will he be taking any steps that will affect,1319.851,1.902
people from those countries who,1321.753,1.135
are already here?,1322.888,1.401
Including perhaps registering them or,1324.289,1.702
beginning deportations?,1325.991,1.268
Mr. Spicer: I think we&amp;#39;re going to have something --,1327.259,0.934
I mean look the President has talked extensively,1328.193,1.635
"about extreme vetting, today and you&amp;#39;ll see more",1330.062,3.77
action this week on keeping America safe.,1334.166,1.034
This has been something he&amp;#39;s talked about in the,1335.6,1.001
"inaugural address, he talked about",1336.835,0.934
in the campaign.,1337.769,1.435
As we get into that implementation of that,1339.204,1.635
executive order we&amp;#39;ll have further details.,1340.839,2.102
But I think the guiding principal for the,1342.941,1.502
President is keeping this country safe and allowing,1344.443,2.302
people who are from a country that has a,1346.745,3.103
propensity to do us harm.,1349.848,2.436
To make sure that we take the necessary steps to,1352.284,2.169
ensure that the people who come to this country,1354.453,1.668
especially where areas that have a predisposition,1356.121,4.938
if you will or a higher degree of concern.,1361.059,4.271
That we take the appropriate steps to make,1365.33,1.301
sure that they&amp;#39;re coming to this country for all,1366.631,1.869
the right reasons.,1368.5,1.068
And I think we&amp;#39;ll have further and further,1369.568,1.168
information on that fact later this week.,1370.736,2.235
The Press: What about the fraud investigation?,1372.971,2.069
What&amp;#39;s the ultimate goal here?,1375.04,1.702
And essentially isn&amp;#39;t the President questioning the,1376.742,2.569
legitimacy of his own election?,1379.311,1.635
"Mr. Spicer: No, I think that the question -- look",1380.946,2.536
voting is the most sacred right that we,1383.482,1.568
have as Americans.,1385.05,1.702
This is what is the hallmark and the,1386.752,1.701
foundation of our democracy.,1388.453,2.136
And to ensure that we know that every person&amp;#39;s vote,1390.589,2.702
counts equally as the next citizen is probably one of,1393.592,3.637
the greatest things that we can do.,1397.496,1.668
The Press: But aren&amp;#39;t those checks and balances,1399.164,0.968
already in place?,1400.132,1.201
Mr. Spicer: I -- part of the reason we need to do a,1401.333,1.868
study is to make sure.,1403.201,0.701
Look there&amp;#39;s -- I don&amp;#39;t want to start throwing out,1403.902,2.736
"numbers, but there&amp;#39;s a lot of people that are dead",1406.638,2.136
"that are on roles, there are people that are voting",1408.774,1.968
"in two places, or that on",1410.742,3.27
the roles in two different states.,1414.012,0.567
Sometimes in three different states.,1414.579,1.135
I think taking the necessary steps to study,1415.714,1.435
and to track what we can do to both understand the,1418.95,3.07
scope of the problem and then secondly how to stop,1422.02,3.337
the problem going forward is something that is very,1425.357,2.269
clearly in the best interest.,1427.626,1.067
John Gizzi.,1428.693,1.302
"The Press: Thank you, Sean.",1429.995,2.235
Two brief questions.,1432.23,1.168
"First, Congressman Todd Rokita, from the Vice",1433.398,2.669
"President&amp;#39;s home state of Indiana, himself a former",1436.067,3.27
"Secretary of State, is the father of that state&amp;#39;s",1439.337,3.537
voter ID law which went to the Supreme Court.,1442.874,3.57
He has long advocated other states following the,1446.444,2.87
Indiana example all states adopting voter ID.,1449.314,4.137
Mr. Spicer: Right.,1453.451,0.468
The Press: Is that something the President,1453.919,1.101
would get behind to achieve?,1455.02,2.602
Mr. Spicer: I think the President&amp;#39;s number one,1457.622,1.302
goal is to make sure that we -- I mean Georgia is,1458.924,2.102
another great example of a state that implemented a,1461.026,2.435
very successful voter ID program.,1463.461,4.739
And I think that&amp;#39;s what the President&amp;#39;s -- you,1468.2,1.635
know one of several things.,1469.835,0.867
"But, lets -- the first step is for him to get",1470.702,2.669
this you know I don&amp;#39;t want to call it a task force,1473.371,4.038
yet because it&amp;#39;s not there yet.,1477.409,1.468
But this effort underway that can look at the scope,1478.877,2.736
of the problem and then John maybe make,1481.613,2.069
some recommendations.,1483.682,1.001
And maybe it is voter ID in states.,1484.683,2.169
"But right now, we&amp;#39;ve got 50 states and the",1486.852,1.801
territories that all have various different ID&amp;#39;s and,1488.653,3.537
I know that there&amp;#39;s some,1492.19,0.801
compliance issues to make sure.,1492.991,1.235
But part of that is to figure out the extent,1494.226,3.403
of the problem.,1497.629,1.235
"In some states, what it takes to get a driver&amp;#39;s",1498.864,2.168
license might be an issue and I&amp;#39;m just -- but I,1501.032,2.503
think we have to understand where the,1503.535,1.702
"problem exists, how deep it goes, and then suggest",1505.237,3.87
some remedies to it.,1509.107,1.135
"But right now, to sort of pre-judge the process",1510.242,2.369
would sort of get in front of the whole,1512.611,1.334
need to have it.,1513.945,0.734
Paul Bernard.,1514.679,0.601
The Press: I have a second question.,1515.28,1.969
Next week is the National Prayer Breakfast --,1517.249,1.801
Mr. Spicer: It is.,1519.05,0.434
The Press: -- Sean.,1519.484,0.768
And Presidents from Eisenhower to President,1520.252,2.702
Obama spoke about their faith.,1522.954,2.803
Will the President attend?,1525.757,1.502
Mr. Spicer: I&amp;#39;m going to have to get back to you.,1527.259,1.134
I&amp;#39;d be glad to check on that I just don&amp;#39;t have the,1528.393,2.169
President&amp;#39;s schedule for the next week.,1530.562,1.435
"So, I will get -- hold on a second, Paul Bernard.",1531.997,3.036
The Press: Sean what will the White House presence,1535.033,5.472
do on immigration to sanctuary cites and,1540.505,2.87
sanctuary counties that say go ahead keep your,1543.375,2.135
"money, we don&amp;#39;t care.",1545.51,0.934
We&amp;#39;re going to harbor these illegal criminals.,1546.444,3.571
"And also, what do you do about countries that",1550.015,2.769
"pretty much say the same thing, who won&amp;#39;t allow",1552.784,1.668
those people to come back into their country?,1554.452,2.703
"Mr. Spicer: Well, I think the first step Paul is the",1557.155,2.169
funding piece.,1559.324,0.867
"And again, this is a mulit-step problem.",1560.191,2.103
And that&amp;#39;s why you&amp;#39;ve started to see different,1562.294,1.468
executive orders get rolled out and there&amp;#39;s you,1563.762,1.701
know a Congressional piece that we have,1565.463,1.936
to do legislatively.,1567.399,1.268
But to the extent of the President can continue to,1568.667,1.901
identify areas that he can handle with an executive,1570.568,2.87
actions and orders and memorandums to start,1573.438,4.538
curbing the problem of illegal immigration.,1577.976,3.637
But also again it&amp;#39;s about -- we talked a little bit,1581.613,3.136
"about it yesterday in terms of funding, there&amp;#39;s",1584.749,1.235
a tax payer issue here.,1585.984,1.601
You know you&amp;#39;ve got the American people out there,1587.585,1.736
working and then having their money sent to places,1589.321,2.936
where folks that aren&amp;#39;t in this country legally are,1592.257,2.669
getting sent to cities that are therefore using,1594.926,2.202
their tax dollars.,1597.128,0.868
That&amp;#39;s a part of it.,1597.996,1.101
"So, it&amp;#39;s not a one-step solution I think that&amp;#39;s",1599.097,2.169
"why you&amp;#39;ve got the wall, you&amp;#39;ve got some funding",1601.266,1.902
"issues, you&amp;#39;ve got the vetting, but it is not a",1603.168,3.637
one step process.,1606.805,1.735
"It&amp;#39;s going to be a multi-tier,",1608.54,1.001
multi-step problem. Yeah.,1609.541,2.669
"The Press: Sean, on the Supreme Court, what is the",1612.21,4.571
President&amp;#39;s use of Judge Gorsuch?,1616.781,2.937
He&amp;#39;s a name that&amp;#39;s been circulated.,1619.718,1.901
And then more broadly does the President feel like,1621.619,3.437
the choice should be someone who is in their,1625.056,2.169
"late 40&amp;#39;s, early 50&amp;#39;s as a way of leaving his",1627.225,2.903
imprint on the Court?,1630.128,1.435
Mr. Spicer: I think that there have been several,1631.563,1.201
names that have been floated out there.,1632.764,3.136
He put out the list a while ago of 20 or so.,1635.9,3.003
That&amp;#39;s where I would look.,1638.903,1.001
I&amp;#39;m definitely not getting ahead of,1639.904,2.269
the President on this.,1642.173,1.969
But I would suggest to you that the people that are,1644.142,1.768
on that list that he put out during the campaign,1645.91,2.636
represent the kind of people that he&amp;#39;s not just,1648.546,2.536
going to nominate for the Supreme Court but we have,1651.082,3.137
"well over a 100, I think it&amp;#39;s a 103 vacancies at",1654.219,3.603
the federal level and at the appellate level.,1657.822,2.803
And I think that&amp;#39;s going,1660.625,0.968
to continue to guide him. Margaret.,1661.593,1.868
"The Press: Sean, one point of personal privilege can",1663.461,2.269
we get the text of the executive orders when the,1665.73,2.169
President makes the announcement?,1667.899,1.502
Mr. Spicer: Yes.,1669.401,0.467
The Press: That would help.,1669.868,0.6
Mr. Spicer: I will tell you this Margaret I was,1670.468,1.669
just told the President is about to speak.,1672.137,2.068
I will get back you the executive orders ASAP.,1674.205,1.802
Thank you guys very much.,1676.007,1.735
"Real quick -- hold on, hold on, guys,",1677.742,0.968
guys hold on.,1678.71,2.035
Just for guidance purposes we will be gaggling,1680.745,5.306
tomorrow on Air Force I.,1686.051,1.601
Thank you very much we look forward to seeing you,1687.652,1.301
in Philadelphia.,1688.953,1.402
Bye guys.,1690.355,0.567
