text,start,duration
"military, whether it&amp;#39;s the age of our ships or our",1887.385,1.668
planes or some of the other hardware that,1889.053,2.436
"exists, you recognize that we need to rebuild a lot",1891.489,4.638
of these things.,1896.127,0.934
The size of our Navy has gone down significantly.,1897.061,3.47
And there are new needs and new -- and when you,1900.531,2.369
look at the commitment that you have to make not,1902.9,2.937
"just in one year but in several years, for a lot",1905.837,2.936
"of these programs -- ships and tanks, even weapons",1908.773,3.403
systems -- they don&amp;#39;t get built in a month or a day.,1912.176,3.771
You have to make a commitment early on to,1915.947,2.836
make the investment because of the time that,1918.783,1.802
"it takes to procure them, to build them, the",1920.585,2.536
research and development that goes into it.,1923.121,1.334
And so I would just suggest to you that this,1924.455,2.269
is the first step in making sure we make the,1926.724,3.003
"commitment to a military that through, especially",1929.727,2.503
"through the sequester the last few years, has not",1932.23,2.335
gotten the funding it needs to get,1934.565,1.702
off life support.,1936.267,0.667
There are a lot of things that are being taken care,1936.934,2.403
of for the military where they&amp;#39;re just continuing to,1939.337,2.636
-- they&amp;#39;re not putting the systems and the projects,1941.973,4.338
in place to allow the military to keep up with,1946.311,2.702
"the times, and that&amp;#39;s a problem. Major.",1949.013,1.368
"The Press: Sean, one investigation question and",1950.381,1.902
one budget question.,1952.283,0.768
"As you may be aware, Bill Owens, the father of",1953.051,2.602
"William &amp;quot;Ryan&amp;quot; Owens, gave an interview with the",1955.653,2.102
"Miami Herald over the weekend and he said, &amp;quot;The",1957.755,2.236
government owes my son an investigation.&amp;quot; On behalf,1959.991,2.536
"of the President of the United States, is the",1962.527,2.536
President open to an investigation to the,1965.063,1.968
raid in Yemen?,1967.031,0.834
And the father of Ryan Owens called that a,1967.865,2.536
&amp;quot;stupid&amp;quot; mission.,1970.401,0.668
Is there something that you&amp;#39;d like to communicate,1971.069,2.135
to him about that mission that might,1973.204,1.969
persuade him otherwise?,1975.173,0.834
"Mr Spicer: Yeah, thank you.",1976.007,1.401
"That&amp;#39;s multi-part, so let me kind of walk",1977.408,2.403
through it slowly.,1979.811,1.434
"First of all, I can&amp;#39;t possibly imagine what he&amp;#39;s",1981.245,4.939
going through in terms of the loss of his son.,1986.184,3.57
"I can tell him that on behalf of the President,",1989.754,2.769
his son died a hero and the information that he,1992.523,6.473
"was able to help obtain through that raid, as I&amp;#39;ve",1998.996,5.272
"said before, is going to safe American lives.",2004.268,1.702
It&amp;#39;s going to protect our country more.,2005.97,1.902
So he made a sacrifice to this country.,2007.872,2.436
He was on his 12th deployment.,2010.308,2.402
"And I know that his wife, when she spoke to the",2012.71,2.403
"President, knows that he did this because he loved",2015.113,3.503
"it, he cared about our nation.",2018.616,2.669
And the mission was successful in helping,2021.285,3.17
prevent a future attack or attacks on this nation.,2024.455,2.736
It obtained a lot of information that will,2027.191,3.971
help us keep safe.,2031.162,2.302
"With respect to his request, it is standard",2033.464,3.871
operating procedure for the Department of Defense,2037.335,2.402
to undergo what they call a 15-6 review.,2039.737,3.037
"That review, in this case, is three-pronged.",2042.774,4.004
Because there was a fatality and a loss of,2046.778,1.701
"life, there&amp;#39;s that.",2048.479,2.269
"Because there were civilians involved,",2050.748,1.602
that&amp;#39;s another.,2052.35,0.667
And then third is because there was hardware -- a,2053.017,3.67
helicopter that was damaged.,2056.687,1.068
That is a separate.,2057.755,1.669
"So, in fact, there will be three reviews done by the",2059.424,4.537
Department of Defense because of the,2063.961,1.802
nature of this.,2065.763,0.901
"But, again, I can&amp;#39;t stress enough that on behalf of",2066.664,6.44
"the President, on behalf of this nation, we express",2073.104,4.471
"our condolences, extend our prayers to him",2077.575,4.371
during this time.,2081.946,1.001
"The Press: As you said, that is",2082.947,0.934
standard procedure.,2083.881,0.801
Is there anything the President is particularly,2084.682,1.668
"curious about with this mission, in that it was",2086.35,3.971
"brought to him, he authorized it quickly?",2090.321,2.236
Does he believe in the main it was carried out,2092.557,2.335
well and there&amp;#39;s nothing that he&amp;#39;s particularly,2094.892,3.137
curious about in the way either the helicopter was,2098.029,3.57
"damaged, fatality, the civilian casualties --",2101.599,2.336
anything of the like?,2103.935,1.568
"Mr Spicer: Well, number one, I&amp;#39;ve walked through",2105.503,2.402
the timetable previously in terms of how long this,2107.905,3.504
"had been planned for, dating well back into the",2111.409,3.503
previous administration.,2114.912,1.135
"And as you know, their recommendation at the time",2116.047,3.67
was to wait for a moonless night.,2119.717,1.735
That night wasn&amp;#39;t going to occur during President,2121.452,2.703
Obama&amp;#39;s administration.,2124.155,1.201
And so when General Mattis got into the Department of,2125.356,3.17
"Defense, he was briefed up on the status of the",2128.526,2.769
"thing, made aware of when the next time was go.",2131.295,2.369
We went through the process to ensure that we,2133.664,3.537
continued to believe that the mission -- the way it,2137.201,2.503
was going to be conducted and the results of the,2139.704,2.235
mission would be worthy of action.,2141.939,4.371
"The conclusion continued to be, as it was prior,",2146.31,2.469
that we should move forward.,2148.779,2.603
"As I mentioned before, I think you can&amp;#39;t ever say",2151.382,4.304
"that, when there&amp;#39;s most importantly loss of life",2155.686,3.571
"and people injured, that it&amp;#39;s",2159.257,2.802
100 percent successful.,2162.059,1.268
But I think when you look at what the stated goal of,2163.327,3.871
that mission was -- it was an information- and,2167.198,2.336
intelligence-gathering mission.,2169.534,2.202
And it achieved its objectives.,2171.736,1.034
"So, again, I would express our thoughts and our",2172.77,1.368
prayers and our condolences to all of the,2174.138,5.005
"people in Chief Owens&amp;#39;s family and his friends,",2182.947,4.404
his shipmates.,2187.351,2.002
"But it&amp;#39;s something that, as a SEAL and as somebody",2191.155,3.771
"who deployed 12 times, he knew that this was part of",2194.926,4.604
the job and he knew what he was doing.,2199.53,1.635
And so we&amp;#39;re very comfortable with how the,2201.165,3.804
"mission was executed, and we&amp;#39;ll let the Department",2204.969,4.504
of Defense go through that review process and then,2209.473,4.438
see where that leads us.,2213.911,0.834
But I think to get ahead of the three separate,2214.745,2.536
reviews that are being done by the Department of,2217.281,2.536
Defense would be probably a little,2219.817,1.869
irresponsible at this time.,2221.686,1.234
The Press: Sean --,2222.92,1.235
"Mr Spicer: Major gets two, too.",2224.155,1.835
The Press: Just real quick on the budget.,2225.99,2.469
"As you&amp;#39;re aware, to undo the defense sequester, you",2228.459,2.803
have to get 60 votes in the Senate because you,2231.262,3.07
have a separate domestic sequester number,2234.332,1.868
and defense.,2236.2,0.667
Are you confident with these numbers and with,2236.867,2.403
this kind of heavy discretionary spending cut,2239.27,2.169
"proposed, you can get the 60 votes to",2241.439,2.469
change the law?,2243.908,0.901
"Because without that change in law, the",2244.809,2.169
proposal is just that -- it doesn&amp;#39;t,2246.978,2.168
become operational.,2249.146,0.668
Mr Spicer: I think that when it comes to our,2249.814,3.036
"nation&amp;#39;s security, specifically our nation&amp;#39;s",2252.85,1.535
"military, I don&amp;#39;t think that it&amp;#39;s a",2254.385,2.169
partisan issue.,2256.554,0.667
I think that senators from across the country --,2257.221,2.603
whether you&amp;#39;re talking about Florida or whether,2259.824,2.869
you&amp;#39;ve got an Army installation or a Navy,2262.693,3.103
"base, you understand the state of repair that many",2265.796,5.306
"of our planes, ships and other hardware is in.",2271.102,5.138
And I think that there is a bipartisan commitment to,2276.24,3.37
give the military and its members the equipment and,2279.61,4.872
the tools it needs to succeed and,2284.482,2.235
protect this country.,2286.717,0.701
So I do feel confident.,2287.418,1.101
April.,2288.519,0.667
"The Press: Sean, I have a couple of budgetary",2289.186,2.703
questions for you.,2291.889,1.268
"One, at the press conference, President",2293.157,2.536
Trump talked about the fix for inner cities.,2295.693,3.37
What is the investment in this budget when it comes,2299.063,4.204
to a fix for inner cities?,2303.267,2.503
Mr Spicer: It&amp;#39;s a good try.,2305.77,1.635
I think the Director was very clear -- The Press:,2307.405,3.103
"That&amp;#39;s one -- Mr Spicer: mean, part of the process",2310.508,1.368
today was to start that passback process that he,2311.876,2.335
"talked about, where we&amp;#39;re going to the various",2314.211,2.503
"departments, whether it&amp;#39;s HUD or DOT, and giving",2316.714,2.069
them that topline number and then hearing back.,2318.783,2.269
So I don&amp;#39;t want to get into a specific number,2321.052,3.069
with you before we get too far down the process.,2324.121,2.57
I think that&amp;#39;s a conversation that we&amp;#39;re,2326.691,1.935
going to have with the agencies and then we will,2328.626,2.903
have subsequently with Congress when they start,2331.529,2.569
drafting their resolutions.,2334.098,1.535
"The Press: Okay, a follow-up on this, but I",2335.633,2.936
do have a question on HBCUs.,2338.569,1.568
"See, he talked about healthcare.",2340.137,1.335
He talked about education and he talked about crime.,2341.472,2.336
He needs to talk about Chicago and,2343.808,1.801
law enforcement.,2345.609,0.701
So you don&amp;#39;t have any kind of budgetary numbers when,2346.31,2.436
it comes to it?,2348.746,1.168
And healthcare is a piece that is one of the line,2349.914,1.768
items for this budget.,2351.682,0.868
Mr Spicer: That&amp;#39;s right.,2352.55,0.867
And I&amp;#39;m not saying that we don&amp;#39;t have numbers.,2353.417,1.802
I&amp;#39;m saying that we&amp;#39;re not giving them out.,2355.219,2.002
That&amp;#39;s a big difference.,2357.221,1.735
The Press: (Inaudible.),2358.956,0.667
Mr Spicer: I know.,2359.623,0.901
(Laughter.),2360.524,0.668
You&amp;#39;re going to do a good job trying.,2361.192,1.334
(Laughter.),2362.526,0.701
"But as the Director noted on this,",2363.227,1.835
that they have come up with topline numbers based,2365.062,3.604
on their going through each of these agencies&amp;#39;,2368.666,2.769
"budget, and saying, hey, there&amp;#39;s a duplicative",2371.435,2.836
program here.,2374.271,0.668
"In some cases, maybe they give them more, maybe they",2374.939,2.235
give them less.,2377.174,0.734
"Part of it is to begin that conversation, that",2377.908,1.969
"process, with the departments and agencies",2379.877,3.871
to figure out what those investments are.,2383.748,1.601
Maybe it&amp;#39;s repurposing existing funds in a,2385.349,1.969
different way.,2387.318,2.002
So it&amp;#39;s not necessarily a zero-sum game.,2389.32,3.069
There is a way that a department can reallocate,2392.389,2.703
money to a program that might end up benefitting,2395.092,4.038
because there is a duplicative or out-of-date,2399.13,4.17
program or office that that savings could be,2403.3,3.704
applied to something.,2407.004,0.667
But I don&amp;#39;t want to get ahead of the process right,2407.671,2.103
"now, only to say that we are at the very",2409.774,1.801
beginning of it.,2411.575,0.668
The Press: And one on HBCUs.,2412.243,1.301
Mr Spicer: Yes.,2413.544,0.901
The Press: The President is going to see the,2414.445,2.169
80-plus presence of HBCUs with the,2416.614,2.369
Vice President today.,2418.983,1.134
Some of them are very concerned as to what this,2420.117,3.17
"executive order looks like, and they are waiting",2423.287,2.703
"to hear the commitment before they say, &amp;quot;I&amp;#39;m all",2425.99,2.302
in.&amp;quot; What is the commitment that this,2428.292,2.436
President is trying to make when it comes to,2430.728,2.235
"HBCUs to ensure, I guess, their future, or deal with",2432.963,4.738
"funding for research projects, what have you,",2437.701,2.203
or moving it out of the Department of Education to,2439.904,2.469
the purview of the White House?,2442.373,1.568
What is the commitment that he&amp;#39;s going to,2443.941,2.102
give to them?,2446.043,0.801
"Mr Spicer: So, look, I don&amp;#39;t generally speak",2446.844,2.102
about executive orders until they&amp;#39;re finalized.,2448.946,1.602
I will just say that one of the things that I think,2450.548,3.703
there&amp;#39;s commitment from this White House to do is,2454.251,2.703
to look at the various resources throughout the,2456.954,1.869
federal government that support HBCUs.,2458.823,2.669
"So, for example, the Department of Defense has",2461.492,4.137
ROTC and NROTC programs.,2465.629,3.237
Are they being properly -- is that funding being,2468.866,3.07
properly executed and spent.,2471.936,2.002
There&amp;#39;s programs within each of the departments --,2473.938,2.702
"the Department of Education, the Department",2476.64,2.169
of Housing and Urban Development -- that affect,2478.809,2.87
grants or programs or direct funding that go to,2481.679,5.939
"HBCUs for various different things, whether",2487.618,2.069
"it&amp;#39;s construction projects, or teaching",2489.687,2.602
"programs, or mentorship programs.",2492.289,1.802
"Whatever it is, they span throughout the",2494.091,2.269
entire government.,2496.36,1.568
And I think that what we are committed to doing is,2497.928,3.137
ensuring that there is a high level of,2501.065,4.671
"understanding and commitment, that goes",2505.736,2.269
"straight to the President, of how we harness those",2508.005,2.502
"resource within the government, and make sure",2510.507,2.837
that they&amp;#39;re doing what they&amp;#39;re supposed,2513.344,1.334
to be doing.,2514.678,0.668
"So it&amp;#39;s one thing to have them, right, spread",2515.346,3.803
throughout the different departments.,2519.149,1.469
It&amp;#39;s another thing to make sure that there&amp;#39;s a direct,2520.618,2.302
pipeline to the President of the United States that,2522.92,2.202
those programs are being executed in a way that&amp;#39;s,2525.122,1.969
benefitting the future of HBCUs and the various,2527.091,4.037
projects and teaching that goes on there.,2531.128,2.336
The Press: And so what are you saying -- there&amp;#39;s,2533.464,3.003
going to be a piece that is going to basically go,2536.467,2.803
throughout all the agencies to make sure that,2539.27,2.235
there is some kind of commitment to HBCUs and,2541.505,3.103
"contract of like, let&amp;#39;s say engineering for some",2544.608,2.536
"schools, or in research for other schools?",2547.144,2.703
"Mr Spicer: Yeah, I would say -- I think I&amp;#39;m going",2549.847,3.737
to stick to waiting until we announce it to get,2553.584,2.336
out a lot more.,2555.92,0.767
The Press: Is that today or tomorrow?,2556.687,2.236
Mr Spicer: I anticipate it very soon.,2558.923,1.334
How is that?,2560.257,0.668
I want to give myself a little wiggle room.,2560.925,1.334
Phil Rucker.,2562.259,0.668
"The Press: Yeah, Sean, thanks.",2562.927,0.867
"A budget-related question, but on infrastructure.",2563.794,2.102
"The President has repeatedly, including",2565.896,2.102
"today, again, called for a major infrastructure plan",2567.998,3.37
"to the tune a trillion dollars -- roads, bridges,",2571.368,2.703
"tunnels, you name it.",2574.071,2.002
Can you explain where that money is going to come,2576.073,2.302
"from, how it fits into the budget that&amp;#39;s under review",2578.375,2.069
"right now, and what the timeline for that",2580.444,2.069
project would be?,2582.513,0.801
Mr Spicer: So I think that would be part of a,2583.314,3.803
longer-term discussion that we&amp;#39;re,2587.117,1.635
having with Congress.,2588.752,1.602
"As you know, the President got in",2590.354,1.568
office 30-some-odd days ago.,2591.922,1.468
"The idea of getting a budget is -- you know,",2593.39,2.369
it&amp;#39;s commonly referred to as a skinny budget -- is,2595.759,2.002
to get the government to continue to be funding and,2597.761,3.337
it will be something that we&amp;#39;ll work with Congress.,2601.098,1.368
I understand your point.,2602.466,0.667
The President continues to talk about the status --,2603.133,1.936
The Press: -- a priority for him.,2605.069,1.334
Mr Spicer: It is.,2606.403,0.901
Absolutely.,2607.304,0.668
But I think that we&amp;#39;ve got to make sure that it&amp;#39;s,2607.972,1.401
done right and that we work with Congress.,2609.373,1.368
"I think, as you correctly mention, there&amp;#39;s obviously",2610.741,2.369
a funding mechanism to this.,2613.11,1.301
And we&amp;#39;ve already talked about things like,2614.411,2.202
comprehensive tax reform that could add to that,2616.613,4.839
discussion.,2621.452,0.967
And so I just -- I understand what you&amp;#39;re,2622.419,1.969
asking in terms of how this would be funded and,2624.388,2.102
"when it will be coming, and the pay-fors, but",2626.49,2.703
we&amp;#39;re working with Congress to have,2629.193,1.601
that discussion.,2630.794,0.668
I think that comes probably outside of the,2631.462,1.635
budget discussion.,2633.097,0.734
The Press: And so how does he square that with the,2633.831,2.169
"need to tighten the belt, which he also talked about",2636,2.302
today -- we&amp;#39;ve been spending too much as a,2638.302,1.702
government and we need to cut our spending?,2640.004,1.801
"Mr Spicer: Right, but I think -- but in the same",2641.805,1.335
manner that we&amp;#39;re presenting the budget.,2643.14,1.335
So we&amp;#39;re talking about adding $54 million -- $54,2644.475,2.202
"trillion, rather -- a billion dollars to --",2646.677,1.601
thank you.,2648.278,0.668
Appreciate the help here.,2648.946,2.602
(Laughter.),2651.548,0.835
But we&amp;#39;re looking to add,2652.383,2.669
that to defense.,2655.052,0.701
And so what it means is that we have to look,2655.753,1.434
through other programs to find reductions,2657.187,2.002
in savings.,2659.189,0.868
I think that same kind of discussion would happen,2660.057,2.235
"with respect to infrastructure, not",2662.292,1.335
"necessarily the savings piece, but the funding",2663.627,1.335
piece; that there&amp;#39;s several ways -- and I know,2664.962,1.334
"that there&amp;#39;s a lot of discussion, private-public",2666.296,1.335
partnerships that he is started to have a,2667.631,1.368
discussion with in terms of the funding mechanism.,2668.999,1.335
And so all I&amp;#39;m trying to get at is that there are,2670.334,1.334
various ways to do this funding without just,2671.668,1.335
relying on the American taxpayer in terms of,2673.003,1.335
additional taxes.,2674.338,0.667
"There are spending reductions, there are",2675.005,1.335
"other funding mechanisms, and I think, in due",2676.34,1.368
"course, we will get around to that discussion.",2677.708,1.335
"The Press: And just related to that, he",2679.043,1.334
mentioned in his remarks about infrastructure today,2680.377,2.169
that as he drives through the Queens-Midtown tunnel,2682.546,2.469
"and the Lincoln tunnel, he worries about",2685.015,1.335
ceiling tiles falling.,2686.35,1.568
Is there a specific incident he was talking,2687.918,2.936
"about where people have been injured, or is that",2690.854,4.972
just a fear of his?,2699.396,4.738
Mr Spicer: I don&amp;#39;t know.,2704.134,4.738
I&amp;#39;ll ask.,2708.872,1.902
(Laughter.),2710.774,0.934
But I&amp;#39;m sure Secret Service will take,2711.708,2.37
care of the -- alleviating the medium concerns.,2714.078,2.869
Hold on.,2716.947,0.667
Alexis.,2717.614,0.668
"The Press: Sean, I have two questions.",2718.282,1.401
"First, one on healthcare.",2719.683,1.034
Because the OMB director was signaling that the,2720.717,3.404
"complete budget would be made ready early May, and",2724.121,3.804
the President today described how complicated,2727.925,2.569
he had discovered that the healthcare repeal and,2730.494,3.37
"replace has become, can you describe when it is",2733.864,3.837
that the President would present his framework for,2737.701,3.57
an overhaul of healthcare?,2741.271,1.602
Is it going to be included in the budget so we would,2742.873,2.336
see it before May?,2745.209,0.8
Mr Spicer: I don&amp;#39;t think you&amp;#39;re going to see it in,2746.009,2.203
"the budget, no.",2748.212,0.667
That&amp;#39;s not the appropriate vehicle for it.,2748.879,1.635
I think I&amp;#39;ve mentioned it before.,2750.514,2.002
I think you would drive -- or at least the leading,2752.516,2.803
"option, before I get locked into something, is",2755.319,2.836
to add Obamacare to the FY17 budget process and,2758.155,4.404
put it through reconciliation.,2762.559,1.735
So that would happen outside of the current,2764.294,1.769
budget structure.,2766.063,0.7
But I think he has also been very clear that he,2766.763,3.204
"wants this outline within a matter of weeks, and",2769.967,2.435
that we continue to have these discussions with,2772.402,2.103
"House and Senate leadership, with Ways and",2774.505,1.534
"Means, and Energy and Commerce, and then similar",2776.039,2.97
on Senate finance on the Senate side.,2779.009,2.136
So when he talks to Speaker Ryan and Leader,2781.145,4.304
"McConnell today, I&amp;#39;m sure that conversation",2785.449,2.636
will continue.,2788.085,0.667
"The Press: Just to follow up on healthcare, because",2788.752,2.069
not every ingredient in the Affordable Care Act,2790.821,2.202
can be handled in reconciliation.,2793.023,1.368
That&amp;#39;s why I was asking about the elements of it,2794.391,2.77
that we see in the budget.,2797.161,1.634
Mr Spicer: That&amp;#39;s right.,2798.795,1.102
The Press: So we will see some of those?,2799.897,2.469
"Mr Spicer: Well, there&amp;#39;s several pieces",2802.366,2.235
of Obamacare.,2804.601,0.768
"Some can be done by executive order, some get",2805.369,2.135
"done with 50 votes, some have to be done",2807.504,1.802
specifically in reconciliation.,2809.306,1.368
I think counter to Major&amp;#39;s point on a previous,2810.674,1.702
"question, that there are certain things that have",2812.376,2.135
"to be done in certain ways legislatively, and to",2814.511,2.936
create a comprehensive and holistic approach to both,2817.447,2.937
repealing it and replacing it.,2820.384,1.034
And we&amp;#39;re aware of that.,2821.418,1.435
We&amp;#39;re working with the House and the Senate to,2822.853,1.768
make that happen.,2824.621,0.701
The Press: And my second topic.,2825.322,2.002
Mr Spicer: Of course.,2827.324,1.368
The Press: All right.,2828.692,1.368
"The immigration executive order, the travel ban --",2830.06,2.703
is the President going to address the American,2832.763,2.702
people and Congress in his speech tomorrow night and,2835.465,3.037
specifically describe and defend the,2838.502,1.702
immigration ban?,2840.204,0.667
And when will we see the revised executive order?,2840.871,3.036
Mr Spicer: So we&amp;#39;re not going to -- I would not,2843.907,3.103
anticipate the speech being a defense of,2847.01,3.47
legislation and executive orders.,2850.48,1.635
I don&amp;#39;t think many previous Presidents have,2852.115,2.87
gotten through and used that as a,2854.985,2.703
legislative walkthrough.,2857.688,2.068
But you will hear about his commitment to,2859.756,3.804
"immigration and his desire for border security, and",2863.56,2.569
what it means not just about keeping the nation,2866.129,2.736
"safe, but what impact it&amp;#39;s having on the economy.",2868.865,2.837
So you will hear a lot about immigration tomorrow,2871.702,3.67
"night, and he will talk about why it matters and",2875.372,3.737
the goal that we have and why we should come,2879.109,1.902
together on areas like this.,2881.011,1.034
"The Press: Can I follow up on that, Sean?",2882.045,1.769
Mr Spicer: Hold on.,2883.814,0.667
Katelyn.,2884.481,0.667
The Press: Where&amp;#39;s the next order?,2885.148,1.335
"Mr Spicer: Oh, I&amp;#39;m sorry.",2886.483,0.667
The next order I think we should have it out,2887.15,1.335
probably middle of this week.,2888.485,0.667
Looking towards the middle of the week.,2889.152,1.335
And we&amp;#39;ll have further updates as we get through,2890.487,1.368
the schedule.,2891.855,0.667
I think obviously our priority right now today,2892.522,1.335
"was the really get the budget process kicked off,",2893.857,1.335
and then continue to prepare for the,2895.192,6.473
joint session.,2901.665,0.667
Katelyn.,2902.332,0.668
The Press: Thank you.,2903,0.767
"The Press: Sean, can I follow on that?",2903.767,2.503
Mr Spicer: You will in a second.,2906.27,2.202
The Press: An internal report in 2015 identified,2908.472,2.502
$125 billion in wasteful Pentagon spending.,2910.974,1.869
So how can you justify adding $54 billion to the,2912.843,3.136
defense budget?,2915.979,0.668
Is that going to go to hiring soldiers or,2916.647,2.769
bureaucrats or contractors?,2919.416,0.934
And is the President concerned with wasteful,2920.35,2.202
spending at the DOD?,2922.552,1.235
Mr Spicer: Of course he&amp;#39;s concerned.,2923.787,1.902
