text,start,duration
"Mr Spicer: Wow, that&amp;#39;s a crowd.",1.534,3.137
I hope everyone had a great weekend.,4.671,3.704
Good afternoon.,8.375,0.7
"Before I begin, I wanted to introduce the Director",9.075,2.436
"of the Office of Management and Budget,",11.511,2.069
"Mick Mulvaney, to talk to you a bit about the",13.58,1.835
President&amp;#39;s budget.,15.415,1.401
"When Director Mulvaney is finished, we will allow",16.816,4.538
him to take a few questions and then resume,21.354,4.204
the briefing and all the fun that goes with it.,25.558,0.701
"So without any further ado, Director Mulvaney.",26.259,4.671
Direcotr Mulvaney: Thanks very much.,30.93,0.501
I want to talk for a few minutes about the budget,31.431,1.435
blueprint that most of you know the President,32.866,2.836
started speaking about this morning with,35.702,1.401
the governors.,37.103,0.701
I&amp;#39;ll talk a little bit about what it is and what,37.804,2.669
"it isn&amp;#39;t, and then talk about where we are in the",40.473,2.102
budget process and what it looks like from here.,42.575,2.57
"First of all, what this isn&amp;#39;t: This is not a",45.145,1.801
full-blown budget.,46.946,1.635
That will not come until May.,48.581,1.268
So you&amp;#39;re not going to see anything in here that has,49.849,2.236
"to do with mandatory spending, entitlement",52.085,1.935
"reforms, tax policies, revenue projections, or",54.02,3.103
the infrastructure plan.,57.123,1.268
"This blueprint was never going to be that, as I",58.391,1.702
made clear during my Senate confirmation.,60.093,1.668
It is a topline number only.,61.761,2.703
"As for what it is, these are the President&amp;#39;s",64.464,3.17
"policies, as reflected in topline",67.634,2.903
discretionary spending.,70.537,1.234
"To that end, it is a true America-first budget.",71.771,2.336
It will show the President is keeping his promises,74.107,1.968
and doing exactly what he said he was going to do,76.075,1.736
when he ran for office.,77.811,1.768
"It prioritizes rebuilding the military, including",79.579,2.502
restoring our nuclear capabilities; protecting,82.081,2.536
the nation and securing the border; enforcing the,84.617,2.469
laws currently on the books; taking care of,87.086,2.436
vets; and increasing school choice.,89.522,1.735
And it does all of that without adding to the,91.257,2.503
currently projected FY 2018 deficit.,93.76,4.604
The top line defense discretionary number is,98.364,2.236
$603 billion.,100.6,1.335
That&amp;#39;s a $54-billion increase -- it&amp;#39;s one of,101.935,2.969
the largest increases in history.,104.904,2.102
It&amp;#39;s also the number that allows the President to,107.006,1.969
keep his promise to undo the military sequester.,108.975,3.27
The topline nondefense number will be,112.245,1.635
$462 billion.,113.88,1.535
That&amp;#39;s a $54-billion savings.,115.415,2.969
It&amp;#39;s the largest-proposed reduction since the early,118.384,2.236
years of the Reagan administration.,120.62,2.202
The reductions in nondefense spending follow,122.822,2.102
the same model -- it&amp;#39;s the President keeping his,124.924,1.802
promises and doing exactly what he said he,126.726,2.035
was going to do.,128.761,1.535
"It reduces money that we give to other nations, it",130.296,2.236
"reduces duplicative programs, and it",132.532,2.135
eliminates programs that simply don&amp;#39;t work.,134.667,2.503
The bottom line is this: The President is going to,137.17,1.435
protect the country and do so in exactly the same way,138.605,2.969
that every American family has had to do over the,141.574,2.303
"last couple years, and that&amp;#39;s",143.877,0.867
prioritize spending.,144.744,1.802
The schedule from here -- these numbers will go out,146.546,2.202
to the agencies today in a process that we,148.748,1.869
describe as passback.,150.617,2.035
Review from agencies are due back to OMB over the,152.652,2.169
"course of the next couple days, and we&amp;#39;ll spend the",154.821,1.635
next week or so working on a final budget blueprint.,156.456,3.87
We expect to have that number to Congress,160.326,3.904
by March 16th.,164.23,1.702
That puts us on schedule for a full budget --,165.932,2.569
"including all the things I mentioned, this one does",168.501,1.335
not include -- with all the larger policy issues,169.836,3.503
in the first part of May.,173.339,2.403
"So with that, I&amp;#39;ll take a couple questions.",175.742,1.501
"Yes, sir.",177.243,0.701
"The Press: Mr. Director, in order to get to your",177.944,1.535
topline on the rest of the nondiscretionary -- or,179.479,2.803
"rest of the discretionary budget, if you&amp;#39;re not",182.282,1.735
"going to touch veterans benefits, you need to",184.017,2.536
slice about 12 percent off of the rest of government.,186.553,2.669
Can&amp;#39;t you do that without affecting the services the,189.222,3.203
government provides for --,192.425,1.101
DIrector Mulvaney: And that&amp;#39;s part of what this,193.526,1.335
process is this week.,194.861,1.568
"The numbers go out, and the numbers -- each agency",196.429,2.636
will get its topline number along with,199.065,1.969
recommendations from OMB as to how we think they,201.034,2.035
can hit that number.,203.069,0.701
"And they may come back to us and say, yeah, we think",203.77,1.535
"that&amp;#39;s a good way to reach that number, or they may",205.305,1.768
come back to us with other suggestions.,207.073,2.669
That&amp;#39;s what this process is.,209.742,1.135
I think it&amp;#39;s fairly unusual for us to be,210.877,1.802
"coming to you this early in the process, but we",212.679,2.302
wanted to let everybody know exactly,214.981,1.335
where we were.,216.316,0.667
The Press: But we&amp;#39;re not talking about 2 or 3,216.983,1.735
percent -- we&amp;#39;re talking about double-digit,218.718,1.335
"reductions, and that&amp;#39;s a lot.",220.053,0.734
Director Mulvaney: There&amp;#39;s going to be a lot of,220.787,1.368
"programs that -- again, you can expect to see",222.155,2.302
exactly what the President said he was going to do.,224.457,2.569
"Foreign aid, for example -- the President said",227.026,1.735
we&amp;#39;re going to spend less money overseas and spend,228.761,1.669
more of it here.,230.43,0.667
That&amp;#39;s going to be reflected in the number we,231.097,1.668
send to the State Department.,232.765,0.801
The Press: Thank you very much.,233.566,1.235
One quick follow on foreign aid.,234.801,1.902
That accounts for less than 1 percent of,236.703,2.535
overall spending.,239.238,0.668
And I just spoke with an analyst who said even if,239.906,3.036
"you zero that out, it wouldn&amp;#39;t pay for one year",242.942,2.936
of the budget increases that are being,245.878,2.002
proposed right now.,247.88,0.835
So how do you square that amount?,248.715,2.002
"So why not tackle entitlements, which are",250.717,2.002
"the biggest driver, especially when a lot of",252.719,1.635
Republicans over the years have said that they need,254.354,1.968
to be taxed?,256.322,0.668
Director Mulvaney: Sure.,256.99,0.667
"On your foreign aid, it&amp;#39;s the same answer I just",257.657,1.868
"gave, which is, yes, it&amp;#39;s a fairly part of the",259.525,2.737
"discretionary budget, but it&amp;#39;s still consistent with",262.262,2.402
what the President said.,264.664,0.834
"When you see these reductions, you&amp;#39;ll be able",265.498,2.169
to tie it back to a speech the President gave or,267.667,1.668
something the President has said previously.,269.335,1.869
He&amp;#39;s simply going to -- we are taking his words and,271.204,2.402
turning them into policies and dollars.,273.606,3.27
So we will be spending less overseas and spending,276.876,2.069
more back home.,278.945,1.768
I forgot your second question.,280.713,1.101
"The Press: O entitlements, why not",281.814,1.702
"address entitlements, which is the biggest",283.516,1.802
driver of spending?,285.318,0.701
Director Mulvaney: It&amp;#39;s very unusual to -- this is,286.019,2.035
a budget blueprint -- what some folks used to call a,288.054,2.502
skinny budget -- and it would not be at all,290.556,1.635
"unusual for larger policy decisions, including tax",292.191,3.471
"reform, revenue projections not to be",295.662,1.835
included in this budget.,297.497,0.867
That will come in -- The Press: Down the line?,298.364,1.935
The Press: Sir -- The Press: Hold on.,300.299,1.335
"So down the line, could we see some type of budget",301.634,1.335
that deals with entitlements?,302.969,0.667
Director Mulvaney: The full budget will contain,303.636,1.368
the entire spectrum of the President&amp;#39;s proposed,305.004,2.836
policy changes.,307.84,0.701
"The Press: Director, on rebuilding the military,",308.541,1.668
can you talk a little bit about more of the,310.209,1.769
breakdown of that?,311.978,1.168
Can you go into a little bit more detail?,313.146,3.236
"Director Mulvaney: No, I can&amp;#39;t -- because, again,",316.382,2.77
where we are in this process is that the,319.152,1.334
numbers going to the DOD today and over the course,320.486,1.635
"of the next 10 days to two weeks, we&amp;#39;ll be coming up",322.121,1.335
with those types of details.,323.456,0.667
I&amp;#39;ve got time for one more.,324.123,1.135
The Press: Will you be asking the military --,325.258,2.836
"you&amp;#39;re going to increase the military budget, but",328.094,1.635
are you going to at least ask the people in the,329.729,2.502
Defense Department to take a look at their budget and,332.231,1.602
"say, hey, where can we at least cut or at least look",333.833,2.803
and make sure that we&amp;#39;re spending the right amount,336.636,1.368
of money?,338.004,0.667
Is part of that is going to be part of the process?,338.671,1.335
"Director Mulvaney: Well, absolutely.",340.006,1.334
That&amp;#39;s part of what Secretary Mattis and I,341.34,1.335
have already talked.,342.675,0.667
He&amp;#39;s interested in driving more efficiencies into the,343.342,1.335
Defense Department.,344.677,0.667
OMB is also going to be involved with him on the,345.344,1.369
procurement process.,346.713,0.667
All of that will be incorporated in our larger,347.38,1.335
budget in May.,348.715,0.667
The Press: So it&amp;#39;s not just like a blanket --,349.382,1.335
"&amp;quot;Here, we&amp;#39;re going to throw money at you, do",350.717,1.334
what you want&amp;quot;?,352.051,1.235
"Director Mulvaney: No, sir.",353.286,1.635
"No, sir.",354.921,0.834
Last one.,355.755,0.801
The Press: Does this account for spending for,356.556,3.436
"the President&amp;#39;s wall, either in the $30 billion",359.992,2.269
we&amp;#39;ve heard you&amp;#39;re going to request for this year,362.261,2.303
or the $54 billion increase?,364.564,1.168
"Does that include money for the wall, how to pay",365.732,2.369
for the wall?,368.101,0.734
Director Mulvaney: I would be more likely --,368.835,1.902
"excuse me, a little bit of both.",370.737,1.735
We do expect to include some money in a future,372.472,2.335
"supplemental for 2017 for the wall, and a 2018",374.807,3.137
budget will also contain some longer-term dollars,377.944,2.235
for that.,380.179,2.002
The Press: So it will be split up between the two.,382.181,1.335
Director Mulvaney: I believe that to,383.516,1.335
be the case.,384.851,0.667
Thank you all very much.,385.518,0.667
"Mr Spicer: Thank you, Director.",386.185,1.068
So let me get back to -- I&amp;#39;ll be right there in,387.253,3.37
"a second, April.",390.623,2.002
"This morning, the President dropped by the",392.625,2.236
"National Governors Association meeting, where",394.861,2.235
49 governors from both states and territories,397.096,2.636
joined Cabinet members and senior White House staff,399.732,2.169
to discuss where they can work together to rebuild,401.901,2.236
the country and restart the economy.,404.137,2.268
"While at the meeting, the President delivered a",406.405,1.335
statement on his forthcoming budget,407.74,1.368
"proposal, which he&amp;#39;ll submit March 16th, as you",409.108,2.87
just heard the Director mention.,411.978,1.568
"The President&amp;#39;s budget will, first and foremost,",413.546,1.702
keep Americans safe.,415.248,1.334
That means investing in both our nation&amp;#39;s physical,416.582,2.57
and financial security.,419.152,1.635
We will rebuild the nation&amp;#39;s military.,420.787,2.569
"An increase in defense spending, including",423.356,1.802
"increased funding for our veterans and our border,",425.158,2.135
will be matched by equal reductions in,427.293,2.336
nondefense programs.,429.629,1.101
The savings in our budget will come from looking at,430.73,2.135
outdated and duplicative programs.,432.865,2.136
The reductions spending will be sensible and,435.001,2.536
"rational, but they will also be tough.",437.537,2.902
"With our nation&amp;#39;s debt spiraling out of control,",440.439,2.937
we simply must take a look at the way we&amp;#39;re spending,443.376,1.968
taxpayers&amp;#39; dollars.,445.344,1.502
Families across the country are being forced,446.846,1.568
"to make difficult choices, because for too long the",448.414,2.202
federal government has not treated their money with,450.616,2.136
the respect they deserve.,452.752,1.868
The national debt exploded under the last,454.62,1.802
administration from $10.6 billion [trillion] on,456.422,3.237
"January 20th, 2009 to $19.9 trillion the day",459.659,4.771
"before -- sorry, those are both trillions -- the day",464.43,2.636
before the President&amp;#39;s -- President,467.066,1.769
Trump&amp;#39;s inaugural.,468.835,1.201
Every child born in America this year will,470.036,1.868
"inherit an average of over $60,000 in debt.",471.904,3.103
"And that, frankly, is too much.",475.007,1.969
Our budget will restore respect for taxpayers&amp;#39;,476.976,2.402
dollars while funding all the necessary programs to,479.378,3.037
keep our country safe and prospering.,482.415,2.636
This meeting with the governors was a,485.051,1.334
continuation of a weekend of engagement and,486.385,2.002
discussion between the governors and,488.387,1.869
the administration.,490.256,1.234
The President and the First Lady welcomed the,491.49,1.435
governors last night to the White House for the,492.925,2.002
Annual Governors Ball.,494.927,1.368
"And yesterday, the Vice President had a very",496.295,1.669
productive meeting with several governors.,497.964,1.902
The administration is proud to be working with,499.866,1.701
the governors on rebuilding our nation&amp;#39;s,501.567,1.769
"infrastructure, reforming our healthcare system, and",503.336,2.969
putting Americans back to work.,506.305,1.835
"I know that Obamacare, in particular, was put into",508.14,1.802
place without a lot of input from governors.,509.942,1.869
We&amp;#39;re committed to consulting and including,511.811,1.968
them on this and so many other subjects as we solve,513.779,3.003
the nation&amp;#39;s biggest issues together.,516.782,2.069
"Later this morning, the President had a listening",518.851,1.735
session with some of our country&amp;#39;s leading,520.586,1.902
healthcare insurance companies.,522.488,2.169
"Interestingly, on yesterday&amp;#39;s ABC &amp;quot;This",524.657,2.069
"Week,&amp;quot; Minority Leader Pelosi actually laid out a",526.726,2.369
great outline of how to judge Obamacare&amp;#39;s success,529.095,3.069
based on what it was supposed to achieve.,532.164,1.869
"She said, &amp;quot;It had three goals: One, to lower the",534.033,2.936
"cost, the other to expand benefits, and the third to",536.969,3.437
improve and increase access.&amp;quot; So let&amp;#39;s go,540.406,3.437
through her criteria.,543.843,1.468
Lowering costs: While this year all four tiers of,545.311,3.37
Obamacare insurance plans are facing double-digit,548.681,2.603
increases in average premiums.,551.284,1.968
"Just to take a look at one set of premiums, for",553.252,2.636
"standard silver plans in the states, 63 percent",555.888,2.603
"increase in Tennessee, 69 percent increase in",558.491,2.736
"Oklahoma, and a staggering 116 percent",561.227,3.27
increase in Arizona.,564.497,1.802
"On expanding benefits: In reality, the new law&amp;#39;s",566.299,2.435
"mandates have led to max cancellations of coverage,",568.734,3.17
"soaring out-of-pocket costs, and declining",571.904,2.536
enrollment figures.,574.44,0.834
Millions are choosing to pay a tax over buying the,575.274,3.07
government-mandate insurance.,578.344,2.035
Increased access: With insurance fleeing the,580.379,2.136
"marketplace, Americans are facing a dwindling number",582.515,2.903
of insurance choices with 17 percent of Americans,585.418,2.836
left with only one insurer option available,588.254,2.569
in their exchange.,590.823,1.535
Insurers will be indispensable partners in,592.358,2.102
the transition period out of Obamacare into the,594.46,2.636
Patients First plan the President will be working,597.096,2.069
with Congress to put in its place.,599.165,1.868
"The President&amp;#39;s plan will encourage innovation,",601.033,2.169
"modernize our healthcare system, and provide",603.202,1.869
"immediate relief, and ensure access to quality,",605.071,2.435
truly affordable care.,607.506,1.936
"This afternoon, the President had lunch with",609.442,1.434
Vice President Pence and Ambassador Haley.,610.876,2.536
"Afterwards, he&amp;#39;s having a meeting with Speaker Ryan",613.412,1.902
and Majority Leader McConnell.,615.314,2.67
"And then following that, he&amp;#39;s going to be meeting",617.984,1.501
with Secretary of State Tillerson.,619.485,1.768
The Secretary is coming off a very successful trip,621.253,1.969
to Mexico that -- he was joined by Secretary of,623.222,2.97
Homeland Security Kelly.,626.192,1.001
I&amp;#39;m sure the President is looking forward to,627.193,2.869
discussing that trip with the Secretary.,630.062,1.602
"Also this afternoon, the Vice President will be",631.664,1.535
speaking to an extraordinary group of 60,633.199,1.701
presidents of Historically Black Colleges,634.9,1.735
and Universities.,636.635,0.668
"There will be a pool spray at the top of the event,",637.303,2.102
and the Vice President&amp;#39;s office will release his,639.405,2.135
remarks and photos following the event.,641.54,2.136
We can also expect a meeting with the President,643.676,3.27
with them as well.,646.946,1.168
"This evening, the President will have dinner",648.114,2.102
with regional press affiliates that are going,650.216,1.334
to be in town for the joint session of Congress.,651.55,2.436
While it&amp;#39;s tradition for representatives from the,653.986,1.802
networks to meet with the President before his joint,655.788,1.635
"address, this is the first time, to my knowledge at",657.423,3.17
"least, that the opportunity has been",660.593,1.935
expanded to include representation from 18,662.528,1.902
regional outlets from around the country.,664.43,2.002
"Tomorrow, the President will also have the",666.432,1.535
traditional lunch with the network anchors.,667.967,2.002
"Beyond the so-called &amp;quot;big five&amp;quot; networks, we&amp;#39;ve also",669.969,2.235
opened it up and invited outlets including,672.204,1.669
"Telemundo, Univision, CBN, EWTN, OANN, PBS, C-SPAN,",673.873,5.272
and TV1.,679.145,1.434
"Tonight, the President looks forward to seeing",680.579,1.602
"his nominee for the Secretary of Commerce,",682.181,2.169
"Wilbur Ross, confirmed by the Senate.",684.35,1.968
Secretary-designate Ross has been an important,686.318,2.169
champion for U.S.-struggling industries,688.487,1.835
in the private sectors.,690.322,1.302
"And pending his confirmation this evening,",691.624,1.835
he&amp;#39;ll now do in the same post on behalf of the,693.459,1.768
American people what he has done in,695.227,1.936
private sector.,697.163,1.134
Assuming everything goes according to the plan in,698.297,2.002
"the Senate tonight, we expect to have his",700.299,1.802
swearing-in tomorrow here at the White House.,702.101,2.703
"Also tomorrow, the President will deliver his",704.804,1.568
first address to both houses of Congress.,706.372,2.402
"In his speech, the President will lay out an",708.774,1.535
"optimistic vision for the country, crossing",710.309,2.302
"traditional lines of party, race,",712.611,1.602
socioeconomic status.,714.213,1.969
"As I said before, the theme will be the renewal",716.182,2.002
of the American spirit.,718.184,1.701
He will invite Americans of all backgrounds to come,719.885,2.002
together in the service of a stronger and brighter,721.887,2.002
future for our nation.,723.889,2.203
In addition to laying out the concrete steps the,726.092,2.335
President has already taken to make the American,728.427,1.669
"Dream possible for all of our people, he will talk",730.096,3.003
about the bold agenda -- he wants to,733.099,1.334
work with Congress.,734.433,1.235
This includes tax and regulatory reform to,735.668,2.803
provide relief to hardworking Americans and,738.471,2.335
"their businesses, making the workplace better for",740.806,2.77
"working parents, ensuring the families who have",743.576,2.736
suffered under Obamacare&amp;#39;s skyrocketing rates see it,746.312,2.969
replaced with a patient-centered,749.281,1.435
"alternative, making sure every child in America has",750.716,2.703
"access to a good education, a rebuilding of",753.419,2.502
our military and fulfilling of our,755.921,1.602
commitments to veterans to whom we obviously owe a,757.523,2.703
great deal of gratitude.,760.226,1.568
You can expect to see a speech grounded firmly in,761.794,2.502
solving real problems for every American -- how can,764.296,3.037
we make sure that every American who needs a,767.333,1.368
"better job get one, how can we get kids who are",768.701,2.402
"trapped in failing schools into better ones, how we",771.103,2.436
can keep gangs and drug violence out of our,773.539,2.336
neighborhoods and communities.,775.875,1.534
The President will address the Americans who have,777.409,1.769
been waiting for help from their leaders for too,779.178,1.601
"long, and let them know that help is",780.779,1.769
finally on the way.,782.548,1.468
"With respect to the speech, we will be having",784.016,1.568
a background briefing sometime this evening here,785.584,2.136
in the briefing room.,787.72,0.734
We will provide additional details later,788.454,2.769
in the afternoon.,791.223,1.035
"As you might already know, the Department of Defense",792.258,1.801
presented its preliminary plan to the White House,794.059,2.236
today to defeat ISIS.,796.295,1.134
This plan has been delivered by Secretary,797.429,2.47
"Mattis, who is currently briefing the principals on",799.899,2.769
the option presented today in seeking their,802.668,2.302
input and feedback.,804.97,1.835
"Finally, I wanted to note the President continues to",806.805,1.736
be deeply disappointed and concerned by the reports,808.541,2.936
of further vandalism at Jewish community -- Jewish,811.477,3.37
"cemeteries, rather.",814.847,0.867
The cowardly destruction in Philadelphia this,815.714,2.536
weekend comes on top of similar accounts from,818.25,2.136
Missouri and threats made to Jewish community,820.386,2.169
centers around the country.,822.555,1.401
The President continues to condemn these and any,823.956,2.502
other form of anti-Semitic and hateful acts in the,826.458,2.737
strongest terms.,829.195,1.401
"From our country&amp;#39;s founding, we&amp;#39;ve been",830.596,1.768
dedicated to protecting the freedom of our,832.364,1.569
citizens&amp;#39; rights to worship.,833.933,1.801
No one in America should feel afraid to follow the,835.734,2.169
religion of their choosing freely and openly.,837.903,3.17
The President is dedicated to preserving this,841.073,1.702
originating principle of our nation.,842.775,2.135
"And while we&amp;#39;re at it, I don&amp;#39;t want to get ahead of",844.91,1.335
"the law enforcement, but I was asked the other day",846.245,2.202
about the story in Kansas -- the shooting in Kansas.,848.447,3.403
"And while the story is evolving, early reports",851.85,2.636
out of Kansas are equally disturbing.,854.486,2.236
"So with that, I&amp;#39;ll be glad to take your questions. Jon.",856.722,2.369
"The Press: Sean, there&amp;#39;s a report this morning that",859.091,3.237
you reached out directly to CIA Director Pompeo.,862.328,5.272
Did you directly contact Director Pompeo and ask,867.6,2.602
him to knock down the New York Times story on the,870.202,2.403
Russia connection?,872.605,0.667
"Mr Spicer: Thanks, Jon.",873.272,0.701
"Let me kind of, if I may, walk through the",873.973,2.669
entire timeline.,876.642,0.667
I think it&amp;#39;s important.,877.309,0.768
"As I mentioned I think a week ago, the New York",878.077,2.869
Times published a story about what they called,880.946,1.902
&amp;quot;contacts&amp;quot; between members of the Trump campaign and,882.848,3.404
Russian officials.,886.252,2.002
The FBI deputy director was at a meeting here at,888.254,2.268
the White House that morning.,890.522,1.535
"After the meeting concluded, he asked the",892.057,2.636
"chief of staff to stand back a second, he wanted",894.693,1.702
to tell him that the report in the New York,896.395,2.803
Times was &amp;quot;BS.&amp;quot;,899.198,2.169
"For viewers at home, I think you can pretty much",901.367,1.902
"figure what that means, but I&amp;#39;ll leave it at that.",903.269,2.602
"At that time, the chief of staff said, thank you for",905.871,2.202
"sharing that with me, can we let other people know",908.073,2.67
that the story is not accurate.,910.743,1.868
"Throughout the day, they went back and forth to see",912.611,1.702
what they thought was appropriate.,914.313,1.435
"Finally, came to the conclusion that they did",915.748,3.436
not want to get in the process of knocking down,919.184,2.169
every story that they had issues with.,921.353,2.636
They then -- we then were informed that other people,923.989,2.569
"had come to the same conclusions, including --",926.558,2.169
