text,start,duration
"at that time, Chairman Devin Nunes had told us,",928.727,2.403
"hey, I&amp;#39;ve been knocking this down,",931.13,1.334
telling reporters.,932.464,1.435
We shared a number with him of a reporter that had,933.899,3.771
contacted us.,937.67,1.334
"And again, when the reporters contact us and",939.004,1.935
"we said, no, that&amp;#39;s not -- to the best of our",940.939,1.335
"knowledge that&amp;#39;s not true, they were asking us, can",942.274,2.269
you point to -anybody else that can,944.543,2.169
substantiate this?,946.712,1.535
"And I think we did a good job of saying, sure, we",948.247,2.969
will share with reporters other people who have come,951.216,2.403
to the same conclusion.,953.619,1.435
So I won&amp;#39;t go into the specifics.,955.054,1.568
I will say that I think we did our job very,956.622,2.803
effectively by making sure that reporters who had had,959.425,2.869
questions about the accuracy and the claims,962.294,2.87
"made in The New York Times, that we were",965.164,1.902
pointing them to subject-matter experts who,967.066,2.502
understood whether or not that story was,969.568,2.236
accurate or not.,971.804,1.201
"And I think just to continue to be very, very",973.005,1.868
clear on this -- it was about the accuracy of the,974.873,4.271
"reporting and the claims that were made in there,",979.144,2.236
plain and simple -- about whether or not a story,981.38,1.835
that appeared in The New York Times was accurate.,983.215,2.069
And individual after individual continued to,985.284,1.868
"say that, as far as they knew, they weren&amp;#39;t.",987.152,2.136
I think most of you probably saw Chairman,989.288,2.102
Nunes&amp;#39;s comments this morning.,991.39,1.802
"He was very clear, number one, that he reached out",993.192,2.836
"to us to say, I&amp;#39;ve been telling people, reporters,",996.028,4.071
that these allegations and descriptions in The New,1000.099,2.836
York Times are not accurate.,1002.935,1.735
And then we shared that information with him.,1004.67,1.935
But he came to us to share that he equally had that,1006.605,3.604
"issue brought up to him, he was briefed and saw &amp;quot;no",1010.209,3.136
evidence&amp;quot; that the story was accurate.,1013.345,1.802
"So the answer is, we have continued to give",1015.147,5.839
reporters information and sources that went to the,1020.986,4.238
"accuracy, or lack thereof, of a report that",1025.224,2.469
was in a newspaper.,1027.693,0.701
And I think Chairman Nunes also equally said it&amp;#39;s,1028.394,4.237
interesting how we literally were engaging,1032.631,2.736
"with the press, saying, if you have a question about",1035.367,2.036
"the sourcing on this -- obviously, when brought to",1037.403,2.369
"our attention, we said, it&amp;#39;s not accurate as we",1039.772,2.702
"know, but then most of you and your colleagues who",1042.474,2.77
"had inquired would say, well, that&amp;#39;s great, I&amp;#39;m",1045.244,2.002
"sure you&amp;#39;re saying this, but who else can",1047.246,1.334
corroborate this?,1048.58,1.268
So our job was to continue to -- when informed --,1049.848,3.337
share sources who had equally come to the same,1053.185,3.07
conclusion that the Times story was not accurate.,1056.255,2.169
The Press: You don&amp;#39;t think there&amp;#39;s something strange,1058.424,2.836
about -- something odd about the White House,1061.26,1.535
Press Secretary getting the CIA director on the,1062.795,2.068
phone to knock down a story about an,1064.863,2.536
investigation?,1067.399,0.868
"Mr Spicer: No, no, but see, respectfully, you&amp;#39;re",1068.267,1.768
using words like &amp;quot;knock down.&amp;quot; There was a story,1070.035,2.87
in a newspaper -- The Press: Was it disputed?,1072.905,2.068
Mr Spicer: Hold on.,1074.973,0.668
"No, no -- there was reporters coming to us",1075.641,2.502
"saying, there is a story out there, what&amp;#39;s your",1078.143,2.603
take on it?,1080.746,0.667
"And our answer was, we don&amp;#39;t believe it&amp;#39;s",1081.413,1.502
"accurate, we don&amp;#39;t* [do] believe it&amp;#39;s false.",1082.915,1.635
But obviously that&amp;#39;s our take on it.,1084.55,1.968
"And reporters were saying to us, well, is there",1086.518,2.636
anybody that you can point to to substantiate,1089.154,2.936
this claim?,1092.09,0.768
"Now, remember, this all started with the FBI",1092.858,2.669
"coming to us, bringing to our attention, saying that",1095.527,3.871
"the story in the Times was not accurate -- in fact,",1099.398,3.036
"it was BS -- and all we did was simply say, that&amp;#39;s",1102.434,3.17
"great, could you tell other reporters the same",1105.604,2.669
thing you&amp;#39;re telling us?,1108.273,1.635
"And I would think that other reporters, yourself",1109.908,2.069
"included, would think that that would be a helpful",1111.977,2.069
thing to get the story straight.,1114.046,2.202
All we sought to do was to actually get an,1116.248,2.736
accurate report out.,1118.984,1.401
"And again, I think Chairman Nunes this",1120.385,1.735
"morning, over and over and over and over again, made",1122.12,4.038
it very clear that no evidence that has been,1126.158,1.935
brought to his attention suggests that that,1128.093,1.969
reporting was accurate.,1130.062,1.401
"So, respectfully, I think it&amp;#39;s interesting that I&amp;#39;m",1131.463,4.638
being asked what&amp;#39;s appropriate when what,1136.101,2.002
we&amp;#39;re doing is actually urging reporters to engage,1138.103,3.137
with subject-matter experts who can,1141.24,1.901
corroborate whether or not,1143.141,1.836
something is accurate or not.,1144.977,1.067
The Press: Should there be a special prosecutor?,1146.044,1.869
Darrell Issa has called for a special prosecutor,1147.913,1.802
to look into this.,1149.715,0.667
"Mr Spicer: And I guess my question would be, a",1150.382,1.435
special prosecutor for what?,1151.817,1.368
The Press: To look into the whole Russia,1153.185,1.335
"connection, the whole Russia influencing -- Mr",1154.52,1.334
Spicer: And here&amp;#39;s my -- right.,1155.854,0.834
"And I guess my -- The Press: I mean, he was part",1156.688,1.669
"of the campaign, so -- I mean, Sessions was part of",1158.357,1.968
"the campaign, the Attorney General.",1160.325,2.069
Mr Spicer: I understand.,1162.394,0.701
"But here&amp;#39;s my question, Jonathan: We have now for",1163.095,1.368
six months heard story after story come out about,1164.463,3.537
unnamed sources say the same thing over and over,1168,2.802
"again, and nothing has come of it, right?",1170.802,3.804
"We&amp;#39;ve heard the same people, the same",1174.606,1.568
"anecdotes, and we&amp;#39;ve heard",1176.174,1.602
reports over and over again.,1177.776,1.535
"And as Chairman Nunes made very clear today, he has",1179.311,3.036
seen nothing that corroborates that.,1182.347,1.936
"So at what point -- you got to ask yourself, what",1184.283,1.935
are you investigating?,1186.218,1.802
"The Press: Well, Russian interference -- I mean,",1188.02,1.334
beyond the context.,1189.354,0.668
"Mr Spicer: No, and I think that both the House and",1190.022,1.468
the Senate have looked at it.,1191.49,1.001
You know as well as I do that the intelligence,1192.491,1.735
community has looked at it as well.,1194.226,1.735
There&amp;#39;s a big difference.,1195.961,0.667
I think that Russia&amp;#39;s involvement in activity,1196.628,3.304
has been investigated up and down.,1199.932,2.168
"So the question becomes at some point, if there&amp;#39;s",1202.1,2.036
"nothing to further investigate, what are you",1204.136,1.835
asking people to investigate?,1205.971,2.035
"I mean, Chairman Nunes spoke very clearly today",1208.006,2.503
when asked over and over and over again about all,1210.509,3.403
"of this, and said that he has seen nothing that",1213.912,2.536
leads him to believe that there&amp;#39;s there.,1216.448,1.969
The President has spoken forcefully time and time,1218.417,2.536
"again that he has no interests in Russia, he",1220.953,1.434
"hasn&amp;#39;t talked to people in Russia in years, and yet",1222.387,3.37
"you keep asking -- and when I say &amp;quot;you,&amp;quot;",1225.757,1.802
collectively -- to try to find something that,1227.559,2.836
"seemingly, at least the reporting that I&amp;#39;m seeing",1230.395,3.47
"in different organizations, suggests",1233.865,3.704
that there&amp;#39;s nothing new that&amp;#39;s being reported.,1237.569,3.17
It&amp;#39;s the same stuff over and over again that we&amp;#39;ve,1240.739,1.802
heard for literally six months.,1242.541,1.835
"And so the question becomes at some point,",1244.376,1.902
what do you need to further investigate if,1246.278,1.702
there is nothing that has come out?,1247.98,1.401
The Press: Can you not categorically deny there,1249.381,2.336
were no contacts between the Russians and anybody,1251.717,2.068
on the campaign?,1253.785,0.734
Mr Spicer: I can&amp;#39;t deny -- I can&amp;#39;t -- I guess my,1254.519,1.335
question is -- The Press: That&amp;#39;s what the,1255.854,1.335
investigation would look at.,1257.189,0.667
Mr Spicer: Right.,1257.856,0.834
"And I guess my point is, is that you&amp;#39;ve had the",1258.69,3.304
intelligence community look at Russia&amp;#39;s,1261.994,2.335
involvement in the election.,1264.329,1.735
You had the House and Senate both do the same.,1266.064,2.97
And so what I&amp;#39;m trying to ascertain is that at what,1269.034,2.736
point -- how many people have to say that there&amp;#39;s,1271.77,2.536
nothing there before you,1274.306,1.001
realize there&amp;#39;s nothing there?,1275.307,2.069
"I can&amp;#39;t say unequivocally -- all I&amp;#39;m saying is, the",1277.376,2.269
people who have done the investigating about Russia,1279.645,3.303
"overall and its activities in the United States,",1282.948,2.235
"specifically now with respect to our election,",1285.183,3.07
haven&amp;#39;t provided anything that leads me to believe,1288.253,3.103
or should lead you to believe -- and I continue,1291.356,1.969
to see reports coming from -- there were media,1293.325,1.902
sources saying when they checked in with law,1295.227,1.668
"enforcement, or intelligence community",1296.895,1.468
"sources, there&amp;#39;s nothing more than has been",1298.363,2.936
previously reported over and over again.,1301.299,2.57
"So, at some point, you do have to ask yourself, what",1303.869,2.435
are you actually looking for?,1306.304,1.769
How many times do you have to come to the same,1308.073,1.535
conclusion before you take the answer?,1309.608,2.969
And that&amp;#39;s where I -- Mara.,1312.577,1.402
"The Press: Just to be clear, did you -- just to",1313.979,2.469
"follow up on that, did you personally reach",1316.448,1.768
out to Pompeo?,1318.216,0.668
Mr Spicer: I&amp;#39;m not going to discuss what,1318.884,1.535
we did internally.,1320.419,0.734
I&amp;#39;m just going to say that when we shared -- we did,1321.153,3.036
our job about making sure that when people had --,1324.189,2.836
"reporters had questions, we let them know what",1327.025,2.403
subject-matter experts were available to discuss,1329.428,3.703
the accuracy of the newspaper story. Mara.,1333.131,1.502
"The Press: Yeah, I&amp;#39;m sure people will come back to",1334.633,1.768
"this, but I actually have a budget question, which",1336.401,2.67
"is: During the campaign, the President said he was",1339.071,3.236
not going to touch Medicare or Social Security.,1342.307,2.903
His Treasury Secretary repeated that.,1345.21,1.802
It sounded like the OMB Director was leaving that,1347.012,2.502
"as an open question, TBD.",1349.514,1.602
"I&amp;#39;m just wondering, what&amp;#39;s the state of the promise?",1351.116,2.97
That we won&amp;#39;t touch it for current retirees -- Mr,1354.086,3.403
Spicer: What the OMB Director made clear,1357.489,2.302
is how it works.,1359.791,0.834
The budget is dealing with the topline,1360.625,1.635
discretionary numbers.,1362.26,1.202
Policy decisions are not part of the budget.,1363.462,2.936
That was what he was being asked and what he -- so I,1366.398,2.736
just want to be clear in terms of what it was.,1369.134,1.668
"And again, I think --",1370.802,0.701
The Press: -- the state of the promise.,1371.503,1.335
In other words what is the promise.,1372.838,1.334
Mr Spicer: Right.,1374.172,0.668
And I think the state of the promise is clear.,1374.84,1.334
"And I think, as you point out, he had made the",1376.174,1.402
"promise, he stands by the promise.",1377.576,1.768
The Treasury Secretary -- The Press: But what,1379.344,1.602
is the promise?,1380.946,0.667
Current retirees?,1381.613,1.301
People near retirement? Anybody paying into --,1382.914,0.568
Mr Spicer: I will follow up,1383.482,0.634
specifically on that.,1384.116,0.967
But I think the President has made very clear that,1385.083,2.336
it&amp;#39;s not his intent to do -- he wants to focus on,1387.419,2.969
the discretionary side; that entitlement reform is,1390.388,2.837
"not -- that, with respect to those programs that he",1393.225,2.068
"mentioned, he stands by his word. Fred.",1395.293,2.269
The Press: I wanted to ask a couple issues.,1397.562,6.24
An executive order on religious freedom had,1403.802,2.536
previously been in the works.,1406.338,2.068
Will that still come?,1408.406,1.736
"And if it does, will it extend beyond",1410.142,2.335
religious freedom?,1412.477,0.734
"Mr Spicer: I&amp;#39;m sorry, Fred, what?",1413.211,2.236
The Press: Will it extend beyond the,1415.447,2.569
Johnson Amendment?,1418.016,0.734
Mr Spicer: I think we&amp;#39;ve discussed executive orders,1418.75,2.97
"in the past, and for the most part we&amp;#39;re not going",1421.72,2.302
to get into discussing what may or may not come,1424.022,2.703
until we&amp;#39;re ready to announce it.,1426.725,1.334
So I&amp;#39;m sure as we move forward,1428.059,2.136
we&amp;#39;ll have something.,1430.195,1.101
Olivier.,1431.296,0.667
"The Press: Thanks, Sean.",1431.963,1.168
"The Press: I&amp;#39;m sorry, just one more.",1433.131,2.536
The issue of types of reforms.,1435.667,2.202
Will there be -- how committed is the,1437.869,2.903
administration to a border adjustment tax?,1440.772,2.202
And is there any concern that there won&amp;#39;t be enough,1442.974,3.637
conservative support for that; that it could block,1446.611,2.937
any meaningful tax reform long-term?,1449.548,1.801
"Mr Spicer: Well, I&amp;#39;m not going to get into the",1451.349,2.036
specifics of tax reform today.,1453.385,1.868
The President has made clear that we&amp;#39;ll have an,1455.253,2.536
outline of the plan very soon.,1457.789,1.735
But what I will say is that I think he has talked,1459.524,2.069
about the concerns that he has with current,1461.593,3.303
regulatory and tax policy that benefit people from,1464.896,3.37
moving out of the country and shipping jobs -- or,1468.266,2.069
products back in while shedding American workers.,1470.335,3.036
He will continue to fight for policies that promote,1473.371,3.337
manufacturing and job creation in the United,1476.708,2.202
"States, and supports American workers.",1478.91,2.336
So I don&amp;#39;t want to get ahead of the exact,1481.246,2.169
nature of the policy.,1483.415,0.767
He has been seeking a lot of input.,1484.182,1.802
"As I mentioned earlier, he&amp;#39;s going to talk today",1485.984,2.269
with Speaker Ryan and Senator McConnell.,1488.253,2.803
"I know that both the joint session, the status of",1491.056,3.47
"repeal and replace, and I&amp;#39;m sure some discussion",1494.526,2.202
of tax reform will probably come up.,1496.728,1.568
But there&amp;#39;s a lot -- we&amp;#39;re continuing to move forward,1498.296,2.469
and work with them.,1500.765,0.668
Olivier.,1501.433,0.667
The Press: Thanks.,1502.1,0.667
A couple on the ISIS strategy.,1502.767,0.701
"Can you just get to the timetable from now, now",1503.468,2.803
that you received it -- what happens?,1506.271,1.635
And there&amp;#39;s a report that you&amp;#39;re asking for $30,1507.906,1.969
billion in emergency defense spending on top of,1509.875,2.369
the $54 [billion] in the budget.,1512.244,1.768
Is that true?,1514.012,0.901
Does that cover the new ISIS strategy?,1514.913,2.069
Can you explain what&amp;#39;s different between the two?,1516.982,2.369
Mr Spicer: Thank you.,1519.351,1.201
"Right now, literally, that principals meeting -- or",1520.552,2.069
principals meeting that I mentioned at the beginning,1522.621,2.402
is happening as we speak.,1525.023,1.134
So Secretary Mattis was coming over to brief the,1526.157,2.903
principals as far as the ISIS plan.,1529.06,2.937
"And again, part of it was to make sure that he fully",1531.997,3.803
discusses the recommendations that he&amp;#39;s,1535.8,1.635
making and seek the input and feedback of the other,1537.435,2.903
principals downstairs.,1540.338,1.468
"That can help guide where we go from here,",1541.806,2.536
how we go.,1544.342,1.135
"With respect to the funding, I think Director",1545.477,2.436
Mulvaney noted that there will be a supplemental,1547.913,1.801
at some point.,1549.714,0.935
"Right now the focus is on the budget, and then",1550.649,1.601
we&amp;#39;ll go from there.,1552.25,0.934
John Gizzi.,1553.184,0.668
"The Press: Thank you, Sean.",1553.852,1.735
Two brief questions.,1555.587,1.101
"First, I read your statement at the Thursday",1556.688,3.003
briefing to Governor Malloy of Connecticut,1559.691,2.236
during the NGA meeting.,1561.927,1.501
And he responded -- and I quote -- &amp;quot;Sean didn&amp;#39;t read,1563.428,3.57
a thing that I said.&amp;quot; He said that he -- in,1566.998,3.304
"Connecticut, they are already working to get",1570.302,2.602
criminals who are in the country illegally out.,1572.904,3.003
His objection was to going into warming centers or,1575.907,3.337
schools where officials might frighten children.,1579.244,2.235
Your response to the Governor on that?,1581.479,2.603
"Mr Spicer: Well, again, I was asked specifically",1584.082,2.736
what his stance -- what the comments were with,1586.818,2.136
respect to sanctuary cities.,1588.954,1.201
"And again, I would reiterate, with all due",1590.155,2.536
"respect to the Governor, I&amp;#39;m not here to pick a",1592.691,2.168
fight with the Governor.,1594.859,1.035
I enjoyed my time going to school in the,1595.894,1.701
state of Connecticut.,1597.595,0.901
I have a kind affection of the Nutmeg State.,1598.496,2.903
"But the reality is, I think that there&amp;#39;s",1601.399,3.003
a difference.,1604.402,0.734
Whether or not what he wants to do is state,1605.136,2.169
"funds, maybe -- without knowing the exact nature",1607.305,3.237
"of how he&amp;#39;s funding, what he&amp;#39;s funding,",1610.542,2.769
it&amp;#39;s difficult.,1613.311,0.834
The question I was asked at the time was on how we,1614.145,2.87
would be handling it.,1617.015,1.001
"And I think the answer, whether it&amp;#39;s Connecticut",1618.016,1.735
"or California, is that the President&amp;#39;s executive",1619.751,2.736
order and the President&amp;#39;s commitment is to make sure,1622.487,3.203
that tax dollars are not used to support programs,1625.69,3.47
that are helping people who are not in the country,1629.16,1.535
legally and who are not citizens entitled to them.,1630.695,2.603
"The Press: One more question, Sean.",1633.298,2.436
Mr Spicer: Okay.,1635.734,1.167
Starting early.,1636.901,0.801
(Laughter.),1637.702,0.668
"The Press: For 58 years, when",1638.37,2.068
"Presidents have gone to Rome, they&amp;#39;ve always met",1640.438,3.137
"the Pope, going back to when President Eisenhower",1643.575,3.136
met Pope John XXIII.,1646.711,1.535
"Now, one year ago this week, candidate Trump had",1648.246,3.537
a disagreement with this Pope and an,1651.783,2.736
exchange of words.,1654.519,1.068
When he goes to Rome in May for his first European,1655.587,2.502
"trip, will he meet with this Pope?",1658.089,2.202
Mr Spicer: That&amp;#39;s a great question.,1660.291,1.736
"Obviously, I would be a huge fan of that.",1662.027,3.169
But I&amp;#39;m not going to -- I don&amp;#39;t think we&amp;#39;re at that,1665.196,3.437
place in the planning process to make an,1668.633,2.035
announcement on any visits with the Pope. Blake.,1670.668,2.536
"The Press: Sean, thank you.",1673.204,2.036
"Two budget questions, if you don&amp;#39;t mind.",1675.24,2.869
"Mr. Mulvaney, I believe, just said that what the",1678.109,3.07
administration plans on putting forward doesn&amp;#39;t,1681.179,1.835
"add to the current deficit projection, which the CBO",1683.014,2.903
says is about $560 billion.,1685.917,1.702
But he didn&amp;#39;t say that it would significantly draw,1687.619,3.069
from that either.,1690.688,1.001
"So my first question is, is the administration",1691.689,2.737
comfortable putting something forward that,1694.426,1.701
might rack up deficits of potentially hundreds of,1696.127,2.703
billions of dollars?,1698.83,1.034
"Mr Spicer: Well, I think -- I&amp;#39;m trying to",1699.864,2.536
"understand the question a little, if you can help me",1702.4,1.435
with this. Because he --,1703.835,0.901
The Press: He said it wasn&amp;#39;t going,1704.736,1.601
to add to it.,1706.337,0.768
Mr Spicer: Right.,1707.105,0.667
"The Press: So my question is, he didn&amp;#39;t necessarily",1707.772,1.669
"say it was going to cut from it, either.",1709.441,1.735
"If it doesn&amp;#39;t cut from it, potentially it could be",1711.176,1.968
hundreds of billions in deficit.,1713.144,1.335
"And I&amp;#39;m curious -- Mr Spicer: Right, no, but I",1714.479,1.568
"think -- correct me if I&amp;#39;m wrong -- I mean, he",1716.047,1.335
basically made it very clear it doesn&amp;#39;t add to,1717.382,2.335
the projected baseline deficit.,1719.717,2.069
So that continues to be the goal.,1721.786,2.903
And I think as we continue to work through this,1724.689,1.402
"process, the passback, you know, it can",1726.091,2.135
work both ways.,1728.226,0.701
We could identify further savings and reductions,1728.927,2.903
"through working with the agencies and departments,",1731.83,2.469
but we&amp;#39;re going to make sure that the topline,1734.299,1.802
number we maintain is as close to that as possible.,1736.101,3.803
"And as we go through this -- I mean, this is the",1739.904,2.002
beginning of the process as the director noted.,1741.906,2.002
"We send the number to the department or the agency,",1743.908,2.803
"give them some ideas, how we came up with this, and",1746.711,1.902
then they come back to us and either justify why a,1748.613,4.204
"particular program or office, or what have you,",1752.817,3.637
needs to stay in existence or why maybe not the,1756.454,2.97
reduction that is offered.,1759.424,1.368
But it&amp;#39;s a back-and-forth process that will occur,1760.792,1.968
over the next few weeks.,1762.76,0.935
So to get ahead of it is the problem.,1763.695,2.269
The Press: Let me ask you what Nancy Pelosi -- to,1765.964,1.902
just get a quick reaction to Nancy Pelosi.,1767.866,2.202
She put out a statement and said the following:,1770.068,2.736
"&amp;quot;Five weeks into his administration, President",1772.804,1.501
Trump has not introduced a single jobs bill.&amp;quot; Your,1774.305,3.103
reaction to that would be what?,1777.408,2.069
Mr Spicer: He&amp;#39;s created a lot of jobs.,1779.477,2.736
I think that&amp;#39;s -- he&amp;#39;s continuing to work with,1782.213,2.236
"Congress on both repealing and replacing Obamacare,",1784.449,3.37
tax reform.,1787.819,0.667
"And, fundamentally, both of those two items alone I",1788.486,2.87
think can help spur a lot of economic growth.,1791.356,2.035
"The meetings that we&amp;#39;ve had with the CEOs, the",1793.391,4.505
health insurers -- there are so many things that,1797.896,4.237
are both job-killing and that can be done to help,1802.133,2.97
promote a better regulatory and tax climate,1805.103,2.936
that lead to job creation.,1808.039,1.735
I think that&amp;#39;s one of the biggest problems right now,1809.774,2.336
is that people in Washington aren&amp;#39;t,1812.11,1.835
"necessarily talking to job creators and saying, what",1813.945,2.703
is the impediment that you have to hiring more,1816.648,2.536
American workers?,1819.184,0.734
What are the impediments that you have to,1819.918,1.668
"manufacturing more, to building here?",1821.586,1.768
The meetings and the actions that the President,1823.354,3.204
has taken on both regulatory and other,1826.558,3.169
matters have helped spur job creation.,1829.727,4.638
You&amp;#39;ve heard these companies come in over and,1834.365,1.769
"over again -- the automakers, airlines,",1836.134,3.503
"Sprint -- I mean, the list goes on and on and on of",1839.637,2.77
"people saying to the President, because of your",1842.407,1.668
"agenda, because of your vision, we&amp;#39;re willing to",1844.075,2.202
commit to hiring additional people to,1846.277,1.769
manufacturing more.,1848.046,1.868
That&amp;#39;s how jobs are created -- it&amp;#39;s not,1849.914,1.802
through the government.,1851.716,1.368
"And too often, it&amp;#39;s the government regulations",1853.084,2.102
that stifle and prevent job creation.,1855.186,2.736
"And I think the President, as a businessman, fully",1857.922,2.436
appreciates and understands how this works,1860.358,2.569
and what some of those impediments do to creating,1862.927,3.137
jobs and to growing the economy.,1866.064,2.369
And so I would just say that you haven&amp;#39;t seen,1868.433,3.403
anything yet.,1871.836,0.667
It&amp;#39;s going to continue to be the case. Trey.,1872.503,1.335
"The Press: Thanks, Sean.",1873.838,0.834
Is there concern in the administration that a,1874.672,1.835
large-scale military buildup will appear,1876.507,2.002
threatening to other countries around the world,1878.509,1.635
and lead to some sort of arms race with other,1880.144,2.336
countries?,1882.48,0.667
"Mr Spicer: No, I think when you look at the state",1883.147,2.336
of some of the infrastructure in our,1885.483,1.902
