text,start,duration
I think we learned a lot through this process.,1200.899,3.837
I think we&amp;#39;re obviously looking at ways that we,1204.736,2.536
"can improve not only how we handle healthcare, but",1207.272,1.802
other things -- how we do everything.,1209.074,2.469
And I mentioned it to some of you in the,1211.543,1.802
course of things.,1213.345,0.667
I think one of the traits of a successful,1214.012,2.169
"organization is to always examine how you do things,",1216.181,3.003
but I think that there&amp;#39;s been a lot of outreach,1219.184,1.869
"from members of both sides with ideas, and the",1221.053,1.701
President is willing to listen to,1222.754,1.802
these individuals.,1224.556,0.834
And if they can come to a resolution on a way,1225.39,1.902
"forward, obviously we&amp;#39;re willing to listen",1227.292,2.903
and to move forward.,1230.195,0.734
But there are a lot of folks that came forward,1230.929,3.203
with these ideas.,1234.132,0.701
"And with all due respect, to the beginning of your",1234.833,1.735
"question, I don&amp;#39;t think it&amp;#39;s a one-way street some",1236.568,2.269
of the comments that have been made.,1238.837,1.335
I think some of the Democrats.,1240.172,1.835
"who now say they weren&amp;#39;t involved, early on in the",1242.007,2.336
process said that they wanted nothing to do with,1244.343,2.369
"this process, there was no way that they would engage",1246.712,3.536
in any discussion to repeal.,1250.248,1.836
"So I think it&amp;#39;s a two-way street, and I think that",1252.084,1.935
we have been willing to listen to folks,1254.019,1.335
and their ideas.,1255.354,1.067
And the President&amp;#39;s advice is that if we can come up,1256.421,2.169
"with resolution on a way to move forward, we&amp;#39;ll",1258.59,2.169
certainly entertain that.,1260.759,1.468
The Press: Where does the buck stop,1262.227,0.768
for this failure?,1262.995,0.8
Does the buck stop --,1263.795,0.868
Mr. Spicer: Just so we&amp;#39;re,1264.663,0.934
"clear, look, we&amp;#39;re at the beginning of a process.",1265.597,2.803
I don&amp;#39;t think we&amp;#39;ve seen the end of healthcare.,1268.4,2.869
"As most people have noted, I think the Obama",1271.269,1.869
"administration, from beginning to end, it",1273.138,3.203
ultimately took about 17 months and went through a,1276.341,2.036
series of fits and starts.,1278.377,1.701
"And it wasn&amp;#39;t until Scott Brown was elected, denying",1280.078,3.27
"them the 60th vote in the Senate, that they finally",1283.348,2.336
jammed something through.,1285.684,1.268
"And, frankly, a lot of the reason that the Secretary",1286.952,3.904
of Health and Human Services has some of the,1290.856,1.802
powers that they do is because they had to,1292.658,2.168
jam it through.,1294.826,0.668
"But there were several failures, when Obamacare",1295.494,3.603
"went through, during the process.",1299.097,2.336
"And ultimately, they tried to go through a",1301.433,1.635
"single-payer process, and they got rebuffed on that",1303.068,2.202
by some of their own members.,1305.27,2.503
"So, look, we&amp;#39;re not saying it&amp;#39;s the",1307.773,2.602
end of healthcare.,1310.375,0.901
But I think that we are looking to look for a way,1311.276,2.669
"forward, and I think that a lot of the members --",1313.945,3.104
"and again, on both sides of the aisle -- have",1317.049,1.267
"reached out not just to the President, but to",1318.316,1.469
"members of the team, willing to share some",1319.785,2.502
ideas both that will make -- that they think would,1322.287,3.937
make the bill stronger.,1326.224,1.368
"But ultimately, the goal is to get to 216 and",1327.592,3.037
"potentially 218, depending on where we are with",1330.629,1.768
special elections.,1332.397,2.236
And so we&amp;#39;re going to look to see where we can get,1334.633,2.202
those 218 votes.,1336.835,1.368
And there may be other opportunities to work with,1338.203,2.169
people across the aisle that get us to 218.,1340.372,2.602
"But that&amp;#39;s the name of the game, and we&amp;#39;re going to",1342.974,1.902
continue to pursue that.,1344.876,1.635
Jim.,1346.511,0.668
"The Press: Sean, the last Congress passed",1347.179,2.335
"significant tax reform, it took about five years, and",1349.514,2.97
"that was 30 years ago, in 1986.",1352.484,1.868
After the failure or defeat of the American,1354.352,2.036
Health Care Act on an issue where there was,1356.388,2.202
"broad GOP consensus, what makes the President think",1358.59,2.936
he can pass significant tax reform this year?,1361.526,3.437
"Mr. Spicer: Well, I think it&amp;#39;s been 30 years.",1364.963,1.401
I think people -- we have a series of -- we have an,1366.364,2.169
"economy that&amp;#39;s evolved, especially in the",1368.533,2.57
technology area; they just made a lot,1371.103,1.534
of things change.,1372.637,1.068
And I think our tax code is outdated.,1373.705,2.069
"And, frankly, on the business side,",1375.774,2.002
we&amp;#39;re uncompetitive.,1377.776,1.401
There&amp;#39;s a reason that companies are leaving,1379.177,2.169
"America to go to other places, because the same",1381.346,2.503
reason sometimes companies move from state to state.,1383.849,2.435
Our corporate and regulatory system has,1386.284,1.936
become unattractive for a lot of companies that want,1388.22,2.736
"to either manufacture here, grow here, or begin",1390.956,2.602
"here, or want to return jobs here.",1393.558,2.736
"I think the President recognized that, and",1396.294,1.702
business leaders from around the country.,1397.996,2.202
It&amp;#39;s not a partisan issue.,1400.198,1.101
"I mean, you go out to the tech sector, out in",1401.299,3.37
"Silicon Valley in particular, there&amp;#39;s a lot",1404.669,2.103
of these companies out there that admittedly,1406.772,1.868
"weren&amp;#39;t with the President during the election, or",1408.64,2.803
"continued not to be, and I think recognized that we",1411.443,4.204
are not as competitive as we can be when you,1415.647,3.237
consider the tax and regulatory climate of,1418.884,2.769
other countries around the world.,1421.653,1.535
And we need to be more competitive.,1423.188,1.435
And then I think you look at the individual side of,1424.623,2.169
"the House, and I think especially when you talk",1426.792,2.235
"to middle-income Americans, especially in",1429.027,4.438
"the context of health premiums skyrocketing up,",1433.465,2.769
they recognize that they need some relief.,1436.234,2.169
And so we&amp;#39;ve got to do what we can,1438.403,2.269
to address that.,1440.672,0.667
Jon-Christopher.,1441.339,0.668
The Press: Thank you.,1442.007,0.667
"Historically, since healthcare has beguiled",1442.674,5.339
"many Presidents, all the way to Harry Truman, and",1448.013,2.869
certainly when Hillary Clinton came to,1450.882,2.169
"Washington, she went to the Hill and thought that",1453.051,2.202
she could get it done.,1455.253,1.635
I&amp;#39;m sure there are many lessons you can learn from,1456.888,2.269
previous Presidents and,1459.157,1.168
perhaps previous First Ladies.,1460.325,1.969
Has the President thought about reaching out to,1462.294,2.502
Hillary and finding out how she maneuvered and,1464.796,2.369
some of the best practices or some of the pitfalls,1467.165,3.804
that she came to?,1470.969,1.201
"Mr. Spicer: And I think that you know -- I mean,",1472.17,1.602
he&amp;#39;s met with Dr. Zeke Emanuel and others -- it&amp;#39;s,1473.772,2.302
not been a -- he&amp;#39;s reached out to several people,1476.074,3.07
throughout this process to gauge both their policy,1479.144,2.903
ideas and strategy ideas.,1482.047,1.568
And I think the President noted on Friday afternoon,1483.615,2.703
"that we learned a lot, on several fronts, about",1486.318,3.47
"strategically how to handle this, as well as",1489.788,1.668
some of the members that we thought we,1491.456,3.137
would have with us.,1494.593,1.434
And we&amp;#39;re reexamining that on a variety of bases.,1496.027,2.303
Margaret.,1498.33,1.268
The Press: Thank you.,1499.598,1.868
We got some guidance from the White House earlier,1501.466,3.07
about Chairman Nunes&amp;#39;s meeting on the White House,1504.536,3.537
"grounds, involving (inaudible) any idea that",1508.073,4.237
questions about the meeting should be referred,1512.31,2.069
to the Committee Chairman.,1514.379,2.436
But I wanted to ask a slightly different,1516.815,1.835
"question, which is, does the White House know now",1518.65,3.437
what absolutely happened?,1522.087,3.069
"Do you have issues with the idea that someone,",1525.156,4.238
"perhaps in the executive branch, shared information",1529.394,3.57
from the White House grounds without you,1532.964,1.769
knowing about it?,1534.733,1.067
Or are you investigating this?,1535.8,1.469
Do you believe there was a leak?,1537.269,1.267
"Or was it, in fact, someone on the White House",1538.536,3.304
"staff or NSC staff, or on loan to either, who",1541.84,3.303
provided the information and therefore,1545.143,1.635
it&amp;#39;s not leaked?,1546.778,2.302
"Mr. Spicer: So, obviously, all of what I know has",1549.08,2.036
been available through public comments.,1551.116,2.235
I know that Chairman Nunes confirmed that he was on,1553.351,3.337
White House grounds Tuesday.,1556.688,2.269
"And, frankly, any questions regarding who he",1558.957,2.002
met with or why he was here should be,1560.959,1.802
referred to him.,1562.761,0.667
I&amp;#39;ve seen some of the comments that he&amp;#39;s made to,1563.428,2.503
your outlet in particular about who he met with.,1565.931,3.236
And I would refer you to his comments,1569.167,3.504
that he&amp;#39;s made.,1572.671,0.667
I&amp;#39;m not going to get into who he met with or why he,1573.338,2.803
met with them.,1576.141,0.667
I think that&amp;#39;s something that he had made very,1576.808,1.602
"clear, and I&amp;#39;ll let him answer it.",1578.41,2.435
He is the one who has discussed what,1580.845,3.737
he is reviewing.,1584.582,2.37
And so I will leave it up to him and not try to get,1586.952,2.202
in the middle of that.,1589.154,1.301
"The Press: Can I just follow up, just to close",1590.455,1.001
the circle on it?,1591.456,0.667
"I&amp;#39;m asking a slightly different question, or at",1592.123,2.002
least I&amp;#39;m trying to ask a slightly different,1594.125,1.335
"question, which is, does the White House know what",1595.46,3.47
"happened now, beyond public accounts?",1598.93,2.002
And are you satisfied that you don&amp;#39;t have an,1600.932,2.269
inappropriate leak in the executive branch?,1603.201,1.935
"Mr. Spicer: No, we&amp;#39;re not concerned about that.",1605.136,2.403
"I know that he is -- again, everything that I",1607.539,2.436
know about what he has done is through public,1609.975,4.104
reports that he has made on the record to different,1614.079,1.935
"folks when he said he has multiple sources, he had",1616.014,2.469
met with different folks to gather things as part,1618.483,3.403
of his review of the situation.,1621.886,1.602
"And so all I know, and what I&amp;#39;m willing to",1623.488,2.836
"communicate, is what has been made available",1626.324,2.569
through on-the-record comments that he has made.,1628.893,2.57
The Press: But to come to White House grounds you,1631.463,1.134
have to be cleared --,1632.597,0.367
"Mr. Spicer: No, not necessarily.",1632.964,1.335
I don&amp;#39;t know that members of Congress need,1634.299,1.101
to be cleared.,1635.4,1.335
The Press: Wouldn&amp;#39;t the White House want to know?,1636.735,1.368
"Mr. Spicer: Again, I think there&amp;#39;s a difference.",1638.103,2.068
"He&amp;#39;s doing a review, and it&amp;#39;s not something that",1640.171,2.503
we&amp;#39;re going to necessarily get in the middle of or,1642.674,1.702
get in the way of.,1644.376,1.001
Part of it is to let him review and have,1645.377,3.37
conversations and look at things that he,1648.747,1.501
thinks are relevant.,1650.248,0.868
"The Press: Sean, a clarification on your",1651.116,2.335
answer to Margaret.,1653.451,0.668
"You said, I don&amp;#39;t know that members of Congress",1654.119,1.735
have to get cleared in.,1655.854,0.934
There was some question about that.,1656.788,1.335
"Who in the White House signed him in,",1658.123,1.768
"essentially, to be able to --",1659.891,0.734
Mr. Spicer: I don&amp;#39;t know that you have to.,1660.625,0.901
I&amp;#39;ll be glad to check on that.,1661.526,1.435
I&amp;#39;m not sure that that&amp;#39;s how that works.,1662.961,1.568
But I will follow up on that point.,1664.529,3.303
"The Press: Okay, and my second question is -- and",1667.832,1.202
it&amp;#39;s related to this -- I understand that you&amp;#39;re not,1669.034,1.167
going to speak about some of the swirl surrounding,1670.201,4.305
this issue with Chairman Nunes.,1674.506,1.434
Does the White House believe that he can still,1675.94,2.67
lead an impartial investigation?,1678.61,2.169
Or would the administration support,1680.779,1.501
some of these calls now for an independent,1682.28,1.602
committee to investigate this?,1683.882,2.669
"Mr. Spicer: First of all, I would question",1686.551,1.702
what &amp;quot;this&amp;quot; is.,1688.253,0.634
Because as I&amp;#39;ve mentioned countless times from this,1688.887,2.636
"podium, there&amp;#39;s two issues at hand --",1691.523,2.202
there&amp;#39;s multiple.,1693.725,1.368
"Number one, there&amp;#39;s any action with respect",1695.093,2.035
to Russia itself.,1697.128,0.768
And every single person that&amp;#39;s been briefed by,1697.896,3.003
"Director Comey in particular, and the FBI,",1700.899,1.835
has said there&amp;#39;s nothing there.,1702.734,1.568
What he is looking into are two things that we are,1704.302,3.103
aware of because of the pleas that we have made.,1707.405,2.469
One is the leaks of classified and other,1709.874,2.97
information that have come out.,1712.844,1.268
And two is whether or not there has been people that,1714.112,6.406
"have been unmasked, and whether or not there was",1720.518,1.769
surveillance -- I don&amp;#39;t know why -- we stand by,1722.287,2.836
the original request that was made.,1725.123,1.902
"And I think Director Comey, in open testimony",1727.025,2.335
"the other day, talked about what the FBI",1729.36,1.535
is looking into.,1730.895,0.668
So I think we have a lot of people looking into,1731.563,3.236
this whole situation.,1734.799,0.934
"The Press: Will the administration pursue,",1735.733,3.871
will the White House pursue a leak,1739.604,0.701
investigation into whoever is giving Chairman Nunes,1740.305,2.235
"this information, if it&amp;#39;s in the executive branch?",1742.54,2.036
"Mr. Spicer: At this point, we&amp;#39;re letting his -- the",1744.576,2.602
review of this situation proceed.,1747.178,2.77
And we can address that after he decides to be,1749.948,1.968
clear about that.,1751.916,1.569
"The Press: Why is this leak okay, but other",1753.485,1.434
leaks are not?,1754.919,0.834
Mr. Spicer: I think there&amp;#39;s a difference,1755.753,1.068
between a leak and someone pursuing a review of a,1756.821,2.703
situation that they have determined.,1759.524,1.835
There&amp;#39;s a difference between a leak -- someone,1761.359,2.269
leaking out to reporters for nefarious -- to take,1763.628,2.803
classified information and share it with people,1766.431,2.035
who aren&amp;#39;t cleared.,1768.466,0.968
Chairman Nunes is cleared; he&amp;#39;s the Chairman of the,1769.434,3.07
Intelligence Committee.,1772.504,1.001
Someone who is cleared to shared classified,1773.505,2.102
information with somebody else cleared,1775.607,1.701
is not a leak.,1777.308,0.668
Zeke.,1777.976,0.667
The Press: I have two for you.,1778.643,0.901
Just a quick housekeeping note.,1779.544,1.034
"At the beginning of the briefing, you read out",1780.578,1.802
that the State Department stated on the protests,1782.38,2.669
and arrests in Russia.,1785.049,1.001
Does that reflect the White House&amp;#39;s views?,1786.05,1.168
Mr. Spicer: That reflects the view of the United,1787.218,2.436
States government.,1789.654,0.901
"The Press: Okay, just wanted to clarify that.",1790.555,1.101
"And secondly, back on -- you mentioned there were",1791.656,2.035
"lessons learned off of what went down last week,",1793.691,3.704
"the last several weeks, around healthcare.",1797.395,1.168
Can you give us some specifics on what some of,1798.563,2.035
those lessons are in terms of the President talked a,1800.598,2.202
"lot about he learned a lot about loyalty, I think is",1802.8,1.736
one of the lines he stated on Friday?,1804.536,1.501
Does he believe that some members of his party are,1806.037,2.569
no longer loyal to him?,1808.606,1.168
Will you go through what are some of,1809.774,1.368
the lessons that --,1811.142,0.601
"Mr. Spicer: No, I&amp;#39;m not going to detail,",1811.743,2.135
"go through -- I mean, obviously this is",1813.878,1.101
an internal thing.,1814.979,1.135
But I will say that we look at things like --,1816.114,3.737
everything from who we met with and when we met with,1819.851,2.502
"them, to whether or not we should have -- how",1822.353,3.671
everything was rolled out and what organizations,1826.024,2.002
"were met with, what commitments were",1828.026,2.169
met and when.,1830.195,0.767
But there&amp;#39;s a lot that goes into this.,1830.962,1.468
And you look at whether or not that&amp;#39;s applicable to,1832.43,2.035
"another situation, whether that&amp;#39;s unique.",1834.465,2.503
"But obviously, yeah, you do look at some of the",1836.968,1.902
"individuals that you met with, both in terms of",1838.87,2.469
"timing, in terms of commitment, in terms of",1841.339,1.935
"substance, and evaluate just the process itself,",1843.274,5.439
"but then also, to some degree, the individuals",1848.713,2.736
and whether or not that is someone that --,1851.449,3.537
The Press: Who&amp;#39;s leading that review?,1854.986,1.101
Mr. Spicer: There&amp;#39;s several folks.,1856.087,1.034
"Again, it depends on the aspect of it.",1857.121,1.836
"There&amp;#39;s a legislative affairs team, there&amp;#39;s a",1858.957,1.468
"public policy team, there&amp;#39;s a comms",1860.425,2.169
aspect to this.,1862.594,0.8
"But we all internally talk about what went well,",1863.394,2.636
what didn&amp;#39;t.,1866.03,0.668
"And we do that not just with the bad,",1866.698,1.334
but the good.,1868.032,0.668
"I mean, I think Jonathan asked it somewhere at the",1868.7,2.102
"beginning, but I think most organizations --",1870.802,3.904
whether or not you do something really well or,1874.706,1.768
not as well -- it&amp;#39;s usually incumbent upon you,1876.474,2.436
"to think, what did we do well so that for things",1878.91,2.235
"that we did really well, we sustain those kinds of",1881.145,2.369
aspects of something -- because there&amp;#39;s always,1883.514,2.169
something to improve -- and even when you,1885.683,1.335
don&amp;#39;t do as well.,1887.018,0.667
But there&amp;#39;s part of things that you did that you did,1887.685,3.837
well and you don&amp;#39;t want to throw the baby out,1891.522,1.335
with the bath water.,1892.857,0.667
So there&amp;#39;s an ongoing piece to this.,1893.524,1.435
Major.,1894.959,1.235
The Press: Just a quick follow-up on Chairman,1896.194,1.535
"Nunes, and then I have a question about",1897.729,1.434
Jared in a second.,1899.163,1.035
"So, yes, members of Congress may not need to",1900.198,3.036
"be cleared in, but to get access to a SCIF, I do",1903.234,2.269
believe that requires some cooperation from the,1905.503,2.703
"executive branch, because there are intelligence",1908.206,1.968
"places on Capitol Hill that are secure, that his",1910.174,2.236
meeting could have taken place.,1912.41,1.501
So it creates the impression that Chairman,1913.911,2.57
"Nunes came over here and, with some degree of",1916.481,2.903
"cooperation with this White House, was able to",1919.384,2.602
carry out this meeting and then make the announcement,1921.986,2.836
"that he did, which is perceived by some -- most",1924.822,2.77
"of them Democrats, I&amp;#39;ll grant you that -- that it",1927.592,1.968
was trying to be helpful to this President and,1929.56,2.603
this administration.,1932.163,0.567
So it appears there was some degree of cooperation,1932.73,2.67
in this process that the White House granted,1935.4,2.736
"Chairman Nunes, making it not just an investigative",1938.136,3.303
"action, but a cooperative one.",1941.439,1.535
Mr. Spicer: Right.,1942.974,0.767
So I would refer you to two things.,1943.741,1.201
"Number one, we&amp;#39;ve asked both of these entities,",1944.942,2.47
both the House and the Senate Intelligence,1947.412,1.334
"Committees, to undertake this review.",1948.746,1.702
So it is partially at our request that they&amp;#39;re,1950.448,2.502
looking into this.,1952.95,1.035
"Number two, based on the public comments that he",1953.985,4.037
"made to Margaret&amp;#39;s organization, he has said,",1958.022,3.737
"from my understanding, on the record, that he did",1961.759,2.269
not meet with White House staff.,1964.028,2.469
"So, again, I think you&amp;#39;re trying to making something",1966.497,3.204
"that he -- is himself, from what I&amp;#39;ve read, not",1969.701,2.802
actually been the case.,1972.503,1.202
The Press: That&amp;#39;s not what I asked you.,1973.705,0.467
I asked you about cooperation to have access,1974.172,1.735
"to a SCIF, which is something that has to be",1975.907,1.401
carried out with your -- Mr. Spicer: I understand.,1977.308,2.369
I will be glad to take a look at that and figure,1979.677,1.301
out whether or not that is an accurate,1980.978,1.569
statement or not.,1982.547,1.067
The Press: Okay.,1983.614,0.468
Let me ask you about Jared.,1984.082,1.067
There is an understanding that&amp;#39;s trying to be worked,1985.149,3.07
"out, as we understand it, between Jared and",1988.219,1.969
the Senate Intelligence Committee.,1990.188,1.868
Is that a testimony?,1992.957,0.901
Is that something that the committee has requested?,1993.858,2.102
Has he volunteered?,1995.96,1.335
Does he believe he has something to explain to,1997.295,1.701
"that committee and, more broadly, the American",1998.996,2.036
public about what he did on behalf of the,2001.032,1.768
"transition with whom he met with, and some of the",2002.8,2.503
meetings that he took that are raising questions,2005.303,2.869
about Russia and folks that he met with that are,2008.172,3.17
outside of diplomatic channels but have other,2011.342,2.369
aspects to their Russian business deals that,2013.711,3.37
may cause some stir?,2017.081,1.869
"Mr. Spicer: So, throughout the campaign and the",2018.95,1.601
"transition, Jared served as the official primary",2020.551,3.571
point of contact with foreign governments and,2024.122,1.968
officials until we had State,2026.09,1.735
Department officials up.,2027.825,1.368
Once we assumed --,2029.193,1.602
The Press: (Inaudible) req uest?,2030.795,0.467
Mr. Spicer: That&amp;#39;s correct.,2031.262,0.567
"And so given this role, he volunteered to speak with",2031.829,3.771
"Chairman Burr&amp;#39;s committee, but has not received any",2035.6,2.536
confirmation regarding a time for a,2038.136,2.736
meeting or anything.,2040.872,1.067
The Press: And is this going to be a private,2041.939,0.968
"meeting, or is this going to be --",2042.907,0.801
Mr. Spicer: I don&amp;#39;t know.,2043.708,0.6
Again -- The Press: What is he trying to,2044.308,1.902
accomplish with that?,2046.21,1.135
Mr. Spicer: I think based on the questions that,2047.345,2.202
"surround this, he volunteered to go in and",2049.547,1.768
"sit down with them and say, hey, I&amp;#39;m glad to talk",2051.315,1.669
about the role that I played and the individuals,2052.984,2.369
I met with.,2055.353,0.667
"But again, remember, given the role that he played",2056.02,2.002
"both during the campaign and during the transition,",2058.022,2.403
he met with countless individuals.,2060.425,2.702
That was part of his job.,2063.127,1.235
That was part of his role.,2064.362,2.102
And he executed it completely as he was,2066.464,2.502
supposed to.,2068.966,0.668
The Press: And so he doesn&amp;#39;t believe he owes,2069.634,2.369
the American public an explanation?,2072.003,1.334
Mr. Spicer: For what?,2073.337,0.668
Doing his job?,2074.005,0.667
The Press: I&amp;#39;m just asking.,2074.672,0.934
Mr. Spicer: But you&amp;#39;re acting as though there&amp;#39;s,2075.606,1.335
something nefarious about doing what he was,2076.941,1.535
actually tasked to do.,2078.476,2.035
"The Press: Well, it&amp;#39;s not every day that someone in",2080.511,1.001
a senior position like Jared&amp;#39;s volunteers to go,2081.512,1.635
talk to the Senate Intelligence Committee,2083.147,1.402
about an investigation dealing with meddling by a,2084.549,2.469
foreign power in an American election.,2087.018,3.069
Mr. Spicer: And I think based on the media frenzy,2090.087,0.534
"around this, he --",2090.621,0.668
The Press: I&amp;#39;m just asking.,2091.289,0.634
Mr. Spicer: And I&amp;#39;m answering it.,2091.923,1.801
And I&amp;#39;m just saying to you that based on the media,2093.724,1.969
"frenzy that existed around this, he volunteered to",2095.693,2.636
"make sure that they -- he said, hey, we&amp;#39;ve made some",2098.329,2.102
"contacts, I&amp;#39;d be glad to explain them, let me know",2100.431,2.302
if you&amp;#39;d like to talk.,2102.733,1.469
Plain and simple.,2104.202,0.667
"The Press: Just to be clear, just to kind of",2104.869,3.47
follow up on what everyone has been asking about,2108.339,3.203
Chairman Nunes -- so the White House does not --,2111.542,2.069
does the White House have knowledge of the,2113.611,2.302
information that Chairman Nunes received when he,2115.913,3.404
came to the White House the first time?,2119.317,0.834
"And if that&amp;#39;s the case, or if that&amp;#39;s not the case, is",2120.151,5.105
your position that the White House is not going,2125.256,3.67
