text,start,duration
Mr. Spicer: Good afternoon.,0,0.834
"I hope everyone had a great weekend, seriously.",0.834,2.669
"It&amp;#39;s Monday, so I brought a special guest.",3.503,4.671
"First, I&amp;#39;d like to have the Attorney General come",8.174,4.705
up to the podium to make an announcement regarding,12.879,1.702
immigration enforcement with respect,14.581,2.068
to sanctuary cities.,16.649,1.435
"When the Attorney General is done speaking, we&amp;#39;ll",18.084,1.802
have time for a couple questions and then I&amp;#39;ll,19.886,2.97
continue with the briefing.,22.856,1.234
So if your question is not germane to sanctuary,24.09,2.736
"cities, keep your hand down and we&amp;#39;ll get to it",26.826,2.57
after we go through the events of the day.,29.396,3.003
"So, with that, Attorney General Sessions, come on up.",32.399,1.768
"Attorney General Sessions: Thank you, Sean.",34.167,2.169
The Department of Justice has a view to enforce our,42.742,2.469
"nation&amp;#39;s laws, including our immigration laws.",45.645,3.67
Those laws require us to promptly remove aliens,49.315,2.937
when they are convicted or detained of certain crimes.,52.252,3.603
The vast majority of American people support,55.855,3.237
this commonsense requirement.,59.092,2.402
"According to one recent poll, 80 percent of",61.494,2.803
Americans believe that cities that arrest illegal,64.297,5.205
immigrants for crimes should be required to turn,69.502,2.937
them over to immigration authorities.,72.439,2.702
"Unfortunately, some states and cities have adopted",75.141,3.103
policies designed to frustrate this enforcement,78.244,3.204
of immigration laws.,81.448,1.935
This includes refusing to detain known felons on the,83.383,3.937
"federal detainer request, or otherwise failing to",87.32,3.237
comply with these laws.,90.557,2.535
"For example, the Department of Homeland",93.092,1.769
Security recently issued a report showing that in a,94.861,3.704
"single week, there were more than 200 instances of",98.565,4.804
jurisdictions refusing to honor ICE detainer,103.369,3.204
requests with respect to individuals charged,106.573,3.303
or convicted of a serious crime.,109.876,2.669
The charges and convictions against these,112.545,2.536
"aliens included drug-trafficking,",115.081,3.47
"hit-and-run, rape, sex offenses against a child,",118.551,3.304
and even murder.,121.855,1.434
Such policies cannot continue.,123.289,3.204
They make our nation less safe by putting dangerous,126.493,3.269
criminals back on the streets.,129.762,2.47
"We all remember the tragic case of Kate Steinle, the",132.232,3.803
32-year-old woman who was shot and killed two years,136.035,3.27
ago in San Francisco as she walked along a pier,139.305,3.437
with her father.,142.742,1.301
"The shooter, Francisco Sanchez, was an illegal",144.043,3.103
immigrant who had already been deported five times,147.146,3.804
and had seven felony convictions.,150.95,3.003
"Just 11 weeks before the shooting, San Francisco",153.953,3.971
"had released Sanchez from its custody, even though",157.924,4.404
Immigration and Customs Enforcement officers had,162.328,3.17
filed a detainer requesting that he be held,165.498,3.937
in custody until immigration authorities,169.435,2.703
could pick him up for removal.,172.138,2.603
"Even worse, Sanchez admitted the only reason",174.741,2.302
he came to San Francisco was because it was,177.043,3.136
a sanctuary city.,180.179,1.869
"A similar story unfolded just last week, when Ever",182.048,3.103
"Valles, an illegal immigrant and a Mexican",185.151,3.337
national was charged with murder and robbery of,188.488,4.037
a man at a light rail station.,192.525,2.569
Valles was released from a Denver jail in late,195.094,2.903
"December, despite the fact that ICE has lodged a",197.997,3.504
detainer for his removal.,201.501,2.536
The American people are not happy with these results.,204.037,3.603
They know that when cities and states refuse to help,207.64,3.304
"enforce immigration laws, our nation is less safe.",210.944,4.437
Failure to deport aliens who are convicted of,215.381,2.903
"criminal offenses puts whole communities at risk,",218.284,3.871
especially immigrant communities in the very,222.155,2.536
sanctuary jurisdictions that seek to protect,224.691,4.471
the perpetrators.,229.162,1.067
"DUIs, assaults, burglaries, drug crimes,",230.229,3.137
"gang rapes, crimes against children, and murderers --",233.366,4.538
countless Americans would be alive today and,237.904,2.502
countless loved ones would not be grieving today if,240.406,3.47
these policies of sanctuary cities were ended.,243.876,3.971
Not only do these policies endanger lives of every,247.847,3.17
"American -- just last May, the Department of Justice",251.017,3.837
inspector general found that these policies also,254.854,3.57
violate federal law.,258.424,2.069
"The President has rightly said, disregard for",260.493,3.871
the law must end.,264.364,2.469
"In his executive order, he stated that it is the",266.833,3.103
policy of the executive branch to ensure that,269.936,3.704
"states and cities comply with all federal laws,",273.64,3.803
including all immigration laws.,277.443,3.137
"Today, I&amp;#39;m urging states and local jurisdictions to",280.58,5.172
"comply with these federal laws, including 8",285.752,3.703
U.S.C. Section 1373.,289.455,3.504
"Moreover, the Department of Justice will require",292.959,2.869
that jurisdictions seeking or applying for Department,295.828,3.737
of Justice grants to certify compliance with,299.565,3.671
1373 as a condition of receiving those awards.,303.236,5.739
This policy is entirely consistent with the,308.975,3.036
Department of Justice&amp;#39;s Office of Justice,312.011,2.569
Program&amp;#39;s guidance that was issued just last,314.58,3.404
summer under the previous administration.,317.984,3.537
This guidance requires state and local,321.521,2.536
jurisdictions to comply and certify compliance,324.057,4.204
with Section 1373 in order to be eligible for OJP grants.,328.261,6.072
It also made clear that failure to remedy,334.333,2.336
"violations could result in withholding grants,",336.669,4.071
"termination of grants, and disbarment or",340.74,2.903
ineligibility for future grants.,343.643,2.302
The Department of Justice will also take all lawful,345.945,4.037
steps to claw back any funds awarded to a,349.982,3.104
jurisdiction that willfully violates 1373.,353.086,4.671
"In the current fiscal year, the Department of",357.757,2.135
Justice&amp;#39;s Office of Justice Program and,359.892,2.77
Community Oriented Policing services,362.662,2.536
anticipates awarding more than $4.1 billion in grants.,365.198,4.304
I strongly urge our nation&amp;#39;s states and cities,369.502,5.305
and counties to consider carefully the harm they,374.807,3.637
are doing to their citizens by refusing to,378.444,3.37
"enforce our immigration laws, and to",381.814,2.536
rethink these policies.,384.35,2.469
Such policies make their cities and states less,386.819,3.237
"safe -- public safety, as well as national security,",390.056,3.737
are at stake -- and put them at risk of losing,393.793,3.57
federal dollars.,397.363,1.402
The American people want and deserve a lawful,398.765,3.136
"system of immigration that keeps us safe, and one",401.901,3.57
that serves the national interest.,405.471,2.503
"This expectation is reasonable, just, and our",407.974,3.904
"government has the duty to meet it, and we will meet it.",411.878,4.571
Thank you.,416.449,3.904
"The Press: In Montgomery County, right up the road,",420.353,2.502
there was a rape in Maryland at,422.855,2.836
Rockville High School.,425.691,1.068
Has anyone from the Department of Justice had,426.759,2.503
any conversations with anyone in Montgomery,429.262,2.168
"County or Rockville, as they describe themselves",431.43,3.037
as a sanctuary county and city?,434.467,1.401
And there&amp;#39;s also a boatload of federal,435.868,2.069
government in Montgomery County.,437.937,2.836
"Attorney General Sessions: Well, you know, Maryland",440.773,0.734
is talking about a state law to make the state,441.507,2.77
a sanctuary state.,444.277,2.102
"The governor is opposed to that, I&amp;#39;m glad to hear.",446.379,3.503
That would be such a mistake.,449.882,2.269
I would plead with the people of Maryland to,452.151,2.269
understand that this makes the state of Maryland more,454.42,4.037
at risk for violence and crime.,458.457,2.703
It is not good policy.,461.16,1.869
And as a former prosecutor for many years in state,463.029,3.503
"and federal law in jurisdictions, I just know",466.532,4.371
the historic relationship different federal agencies,470.903,3.57
have with regard to honoring detainers.,474.473,3.304
It&amp;#39;s just a fundamental principle of law,477.777,2.269
"enforcement that if you have a person arrested,",480.046,3.17
"and another jurisdiction has a charge, then",483.216,3.203
they file a detainer.,486.419,2.035
"And when you finish with the prisoner, you turn",488.454,2.269
them over to the next jurisdiction for,490.723,2.402
their adjudication.,493.125,2.503
That is why it should be done --,495.628,4.705
Mr. Spicer: Major.,500.333,1.301
"The Press: Mr. Attorney General, so listening to",501.634,1.368
"you carefully, it sounds like you&amp;#39;re applying the",503.002,2.769
standards and the policy that the Obama,505.771,2.436
administration put forward on compliance with,508.207,4.271
underlying Justice Department rules.,512.478,1.902
Are you taking any additional steps?,514.38,1.535
And have you asked the President to maybe talk,515.915,2.703
about other federal funds that are not necessarily,518.618,2.269
under your control as a way to punish sanctuary,520.887,2.602
cities or states?,523.489,1.301
"Attorney General Sessions: Well, that&amp;#39;s a good question.",524.79,1.268
What I&amp;#39;m saying today is that essentially the,526.058,2.77
policies of the Obama administration that were,528.828,2.736
issued last July make clear that you should not,531.564,3.637
be receiving certain federal funds if you&amp;#39;re,535.201,2.936
not in compliance with 1373.,538.137,2.603
We believe that grants in the future could be issued,540.74,3.403
"that have additional requirements, as every",544.143,2.402
grant that&amp;#39;s being issued in America today usually,546.545,2.737
has a requirement that if you qualify for this,549.282,3.236
"grant, you have to meet certain requirements.",552.518,2.936
"So we&amp;#39;ll be looking at that in the future, and",555.454,2.169
we&amp;#39;ll continue to pursue it.,557.623,1.869
But fundamentally we intend to use all the,559.492,2.769
lawful authority we have to make sure that our,562.261,4.838
"state and local officials, who are so important to",567.099,3.971
"law enforcement, are in sync with the",571.07,2.069
federal government.,573.139,6.54
"The Press: Some officials in cities, for example --",579.679,0.834
"bigger cities -- have said, despite the lack of",580.513,1.935
"federal funding, they will continue to be sanctuary",582.448,1.802
cities; that they don&amp;#39;t care that they&amp;#39;re losing,584.25,1.768
"money, essentially.",586.018,1.168
What recourse does the Department of Justice have,587.186,1.668
in those cities that look at what you&amp;#39;re doing and,588.854,2.937
"say, we don&amp;#39;t care, we&amp;#39;re going to continue to",591.791,1.601
implement this policy?,593.392,1.035
"Attorney General Sessions: Well, that&amp;#39;s very",594.427,1.234
"disheartening, but I hope that the American people",595.661,3.037
and their constituents in their own cities will,598.698,2.736
communicate with them.,601.434,1.768
"And as we continue a dialogue and a discussion,",603.202,3.237
and as we continue to ensure that monies that go,606.439,3.703
for law enforcement only go to cities who are,610.142,2.837
"participating in an effective, collegial,",612.979,3.036
"cooperative way with the federal government,",616.015,2.669
that that would also send a message.,618.684,2.202
We have simply got to end this policy.,620.886,4.205
Thank you all.,625.091,0.834
Mr. Spicer: Okay.,633.699,0.434
You guys ready to continue?,634.5,0.868
The Press: Yes.,635.368,0.5
Mr. Spicer: Good.,635.868,1.201
"Before I get into today&amp;#39;s schedule, I wanted to read",637.069,2.336
-- I know there&amp;#39;s been some interest in the State,639.405,1.501
Department&amp;#39;s statement regarding the arrest of,640.906,2.97
hundreds of protestors -- peaceful protestors --,643.876,2.769
that occurred in Russia.,646.645,1.569
The statement that the State Department put out,648.214,1.601
says: &amp;quot;The United States strongly condemns the,649.815,2.603
detention of hundreds of peaceful protestors,652.418,2.436
throughout Russia on Sunday.,654.854,1.601
"The detention of peaceful protestors, human rights",656.455,2.269
"observers, and journalists is an affront to essential",658.724,2.736
democratic values.,661.46,1.335
We are troubled to hear of the arrest of the,662.795,1.501
opposition leader upon arrival at the,664.296,3.204
"demonstration, as well as the police raids on the",667.5,3.169
anti-corruption organization he heads.,670.669,2.169
"The United States will monitor the situation, and",672.838,2.403
we call on the government of Russia to immediately,675.241,2.302
release all peaceful protestors.,677.543,2.236
"The Russian people, like people everywhere, deserve",679.779,2.936
a government that supports an open marketplace of,682.715,2.369
"ideas, transparent and accountable governance,",685.084,4.004
"equal treatment under the law, and the ability to",689.088,2.903
exercise their rights without fear of,691.991,2.035
"retribution.&amp;quot; Now, with respect to events for the",694.026,2.936
"day, this morning, after receiving his daily",696.962,2.837
"intelligence briefing, the President participated in",699.799,2.068
a roundtable with women small business owners.,701.867,3.37
The President is hosting a group of women business,705.237,2.036
owners as part of the White House&amp;#39;s full,707.273,1.735
calendar of Women&amp;#39;s History Month events.,709.008,2.869
"At the roundtable this morning, Vice President",711.877,2.036
"Pence, SBA Administrator McMahon joined with other",713.913,3.069
senior administration officials to hear from,716.982,2.203
these amazing female entrepreneurs and small,719.185,2.736
business leaders about their firsthand,721.921,1.735
"experiences, successes, and challenges.",723.656,3.17
"As the President said, &amp;quot;Empowering and promoting",726.826,2.569
women in business is an absolute priority in the,729.395,2.669
Trump administration because I know how crucial,732.064,2.503
"women are as job-creators, role models, and leaders",734.567,3.303
all throughout our communities.,737.87,2.202
The women in attendance this morning have,740.072,1.935
"incredible stories, including many who have",742.007,2.236
started businesses from scratch with very limited,744.243,2.736
"resources, and, through hard work and",746.979,1.702
"determination, turned their dreams into reality.",748.681,3.203
"Between them, they provide hundreds of jobs to",751.884,2.469
Americans across the country.,754.353,1.835
The President is dedicated to continuing to remove,756.188,2.569
"the unique barriers that women face in our economy,",758.757,2.87
"including access to capital, markets,",761.627,2.402
and networks.,764.029,1.302
This administration will continue to advocate for,765.331,2.335
"policies that support working family, including",767.666,2.47
a national initiative to promote women business,770.136,2.736
"leaders and entrepreneurs that his daughter, Ivanka,",772.872,3.003
is helping to lead.,775.875,1.368
"In honor of Women&amp;#39;s History Month, the White",777.243,1.968
House has been hosting events all throughout March.,779.211,2.169
"Just to name a few, the Centers for Medicaid and",781.38,2.636
Medicare Systems Administrator Verma held a,784.016,2.703
"roundtable with Women in Healthcare, which the",786.719,2.235
President attended.,788.954,1.302
The First Lady held a Women&amp;#39;s Empowerment lunch,790.256,2.335
on International Women&amp;#39;s Day.,792.591,1.802
"Earlier this month, Second Lady Karen Pence joined",794.393,4.138
women from all five military branches for,798.531,2.736
"lunch at Fort Meade, and last week hosted military",801.267,2.936
women at the Vice President&amp;#39;s residence to,804.203,2.302
thank them for their service.,806.505,1.802
"Under President Trump, the American economy is a",808.307,2.002
"place for everyone, regardless of their",810.309,2.035
"gender, to thrive.",812.344,1.836
"Following the roundtable, the President had lunch",814.18,2.369
with the Vice President and Secretary,816.549,1.334
of State Tillerson.,817.883,1.135
"And at three o&amp;#39;clock, the President will sign House",819.018,2.035
"Joint Resolutions 37, 44, 57, and 58 -- all of which",821.053,6.106
use the powers of the Congressional Review Act,827.159,1.802
to roll back job-killing rules.,828.961,2.436
"Before this administration, only one",831.397,2.035
time in the nation&amp;#39;s history had a President,833.432,2.102
ever signed a bill that used the Congressional,835.534,2.469
Review Act to cancel a federal regulation.,838.003,2.87
"In just his first 66 days as President, he will have",840.873,4.671
signed six resolutions to eliminate unnecessary,845.544,3.704
and burdensome rules.,849.248,1.501
House Joint Resolution 37 rolls back the so-called,850.749,2.703
"&amp;quot;blacklisting&amp;quot; rule, which manufacturers identified",853.452,3.203
during their meeting with the President as one of,856.655,1.569
the most significant threats to growing,858.224,2.535
American businesses and hiring more American workers.,860.759,4.405
The rule simply made it too easy for trial lawyers,865.164,2.402
to go after American companies and American,867.566,1.869
workers who contract with the federal government.,869.435,2.769
"The President saw that workers, taxpayers, and",872.204,2.269
businesses were the ones who truly suffered under,874.473,3.07
"this rule, and he is glad to be signing legislation",877.543,2.069
to eliminate it.,879.612,1.601
"House Joint Resolution 45* [44], 57, and 58 cancel",881.213,4.338
federal power grabs that took decision-making away,885.551,3.303
from the states and local governments who know the,888.854,2.269
unique challenges of their own populations.,891.123,2.503
The President firmly believes that Washington,893.626,1.801
"is not always the solution to these problems, and",895.427,2.236
that these bills return the power to the people,897.663,2.402
by putting more decision-making in,900.065,2.036
the hands of states.,902.101,1.401
House Joint Resolution 44 removes a Bureau of Land,903.502,2.97
"Management rule, known as &amp;quot;Planning 2.0,&amp;quot; that would",906.472,3.403
have centralized federal and land management in,909.875,2.636
"Washington, diluting the concerns of local citizens",912.511,2.97
who have a right that is protected by law to be,915.481,2.836
involved in this decision-making process. H.J. Res.,918.317,3.37
57 and 58 eliminate the Department of Education,921.687,3.303
regulations which limits states&amp;#39; flexibility in how,924.99,3.27
they assess the performance of schools and,928.26,2.403
teacher preparation and programs.,930.663,2.302
Removing these additional layers of bureaucracy will,932.965,2.235
"make it easier for parents, teachers and",935.2,2.203
"communities, and state leaders to address the",937.403,2.569
needs of their students.,939.972,1.601
The President will continue to work with,941.573,1.402
Congress and the rest of the federal government,942.975,1.868
until every unnecessary regulation that stands in,944.843,2.47
the way of success for American business and,947.313,2.602
American people is taken off the books.,949.915,2.87
"Additionally, the President spoke with",952.785,1.401
German Chancellor Merkel and Indian Prime Minister,954.186,2.436
Modi earlier today to congratulate them on their,956.622,2.736
parties&amp;#39; success in recent elections.,959.358,2.502
We&amp;#39;ll have readouts on those calls a little,961.86,1.635
later for you both.,963.495,1.402
The President also will announce the establishment,964.897,3.236
of the Office of American Innovation.,968.133,3.037
The Office of American Innovation will apply the,971.17,2.002
President&amp;#39;s &amp;quot;ahead of schedule and under budget&amp;quot;,973.172,1.935
mentality to a wide number of government operations,975.107,2.869
"and service, enhancing the quality of life",977.976,2.37
for all Americans.,980.346,1.434
The office will have a particular focus on,981.78,1.702
"technology and data, hearing back from leaders",983.482,2.669
in the industry.,986.151,0.668
"As some of its first priorities, the office",986.819,2.702
will focus on modernizing the technology of every,989.521,3.27
"federal department, identifying",992.791,2.603
"transformational infrastructure projects,",995.394,2.636
and reimagining the VA system so that it can,998.03,2.569
better serve our nation&amp;#39;s heroes.,1000.599,2.469
The effort will be led by Assistant to the President,1003.068,2.069
and Senior Adviser Jared Kushner.,1005.137,2.202
"Tomorrow, the President will sign an executive",1007.339,1.902
order to strengthen the nation&amp;#39;s energy security,1009.241,2.669
by reducing unnecessary regulatory obstacles that,1011.91,3.671
restrict the responsible use of domestic,1015.581,2.636
energy resources.,1018.217,1.468
This order will help keep energy and electricity,1019.685,2.269
"affordable, reliable and clean in order to boost",1021.954,3.637
economic growth and job creation.,1025.591,2.636
"And finally, before I came out today, Senate",1028.227,1.935
Democrats continued their obstruction to the,1030.162,2.236
President&amp;#39;s nomination of Judge Neil Gorsuch to the,1032.398,3.303
Supreme Court with the Judiciary Committee,1035.701,2.369
seeking a one-week postponement,1038.07,1.635
on its decision.,1039.705,1.334
"Over the weekend, Senate Minority Leader Chuck",1041.039,2.002
Schumer defended his decision to mount a,1043.041,2.336
filibuster against the President&amp;#39;s unquestionably,1045.377,2.836
qualified nominee.,1048.213,1.602
"If Senator Schumer gets his way, this would be the",1049.815,1.868
first successful filibuster against a,1051.683,2.57
Supreme Court nominee in American history.,1054.253,3.203
"He argued, quite misleadingly, that the",1057.456,3.37
Senate has &amp;quot;required&amp;quot; a 60-vote threshold of,1060.826,3.971
&amp;quot;every&amp;quot; Supreme Court nominee.,1064.797,2.102
That&amp;#39;s simply not true.,1066.899,1.902
"And as I&amp;#39;ve said before, only three Supreme Court",1068.801,2.035
Justices have faced a filibuster in the last,1070.836,2.936
half of the century.,1073.772,1.201
Senator Schumer cited four justices confirmed under,1074.973,2.837
"President Bush and Obama, but in fact, among those",1077.81,3.336
"four, only one faced an attempted filibuster --",1081.146,3.103
that was Justice Samuel Alito.,1084.249,1.368
"And it was President Obama who, then as a senator,",1085.617,3.237
"voted to filibuster Justice Alito, and later",1088.854,3.37
publicly expressed his regret for that.,1092.224,2.302
"The fact is, an attempted filibuster of a Supreme",1094.526,2.469
"Court nominee is rare, and to do so in this context,",1096.995,3.471
with such an eminently qualified and brilliant,1100.466,2.769
"judge, is nothing short of obstructionism.",1103.235,3.403
"That&amp;#39;s why Senator Pat Leahy, the former",1106.638,2.236
"Democratic Chairman of the Senate Judiciary, said he",1108.874,2.202
"is &amp;quot;not inclined to filibuster,&amp;quot; even if he",1111.076,3.904
ultimately may not vote to confirm the Judge.,1114.98,3.003
The fact that the former Chairman of the Judiciary,1117.983,2.402
Committee won&amp;#39;t stand by the Minority Leader,1120.385,2.103
exposes the Leader&amp;#39;s efforts as nothing but,1122.488,2.002
obstructionism that undermines decades,1124.49,3.169
of Senate tradition.,1127.659,1.468
"Through four days of extensive hearings, Judge",1129.127,2.536
"Gorsuch demonstrated his judicial philosophy, his",1131.663,3.404
"sterling academic credentials, and a",1135.067,1.968
brilliant legal mind.,1137.035,1.569
He deserves a fair up or down vote.,1138.604,2.535
"And with that, I&amp;#39;d be glad to take a few",1141.139,1.969
of your questions.,1143.108,0.768
Jonathan.,1143.876,2.502
The Press: Is the President serious about,1146.378,1.602
working with Democrats going forward after what,1147.98,2.235
happened with healthcare?,1150.215,2.002
Mr. Spicer: Absolutely.,1152.217,0.768
"In fact, starting Friday afternoon through late",1152.985,4.437
"yesterday, he&amp;#39;s received a number of calls, as well",1157.422,2.47
as other members of the senior staff that had been,1159.892,2.869
"working on healthcare, from members of both",1162.761,3.27
"sides, saying that they would like to work",1166.031,2.469
"together, offer up ideas, and had suggestions about",1168.5,3.337
how to come to resolution on this and get to a,1171.837,3.97
House vote on this.,1175.807,1.302
The Press: But --,1177.109,1.668
The Press: But wouldn&amp;#39;t this require a --,1178.777,0.968
"Mr. Spicer: I&amp;#39;m sorry, John, this isn&amp;#39;t a free-for-all.",1179.745,2.369
Jonathan is asking the question.,1182.114,1.435
The Press: But wouldn&amp;#39;t this require a serious,1183.549,1.234
course correction for the White House?,1184.783,2.136
"I mean, the President branded Chuck Schumer a",1186.919,2.102
"&amp;quot;clown,&amp;quot; worked entirely with Republicans",1189.021,4.905
on this bill.,1193.926,1.134
Wouldn&amp;#39;t this require a serious change of course,1195.06,2.236
for the President?,1197.296,1.334
"Mr. Spicer: To some degree, sure.",1198.63,1.135
And I think the President talked about that.,1199.765,1.134
