text,start,duration
to look into where he got the information from or,2128.926,2.736
who gave him the information until his,2131.662,3.537
investigation is complete?,2135.199,0.668
Mr. Spicer: I think that -- I&amp;#39;m not aware of where,2135.867,1.301
he got it from.,2137.168,1.234
I know in his public statements he&amp;#39;s talked,2138.402,1.569
about having multiple sources.,2139.971,1.868
And so I don&amp;#39;t know how he derived the,2141.839,1.935
conclusion that he did.,2143.774,3.938
"And I think that at this point, the goal would be to",2147.712,1.401
wait until the review that he is undertaking,2149.113,3.637
is completed.,2152.75,1.769
Kaitlan.,2154.519,1.134
The Press: Why would Nunes need to brief the,2155.653,1.368
President on documents he viewed on,2157.021,1.969
White House grounds?,2158.99,1.067
Mr. Spicer: Because that&amp;#39;s a big assumption that,2160.057,1.001
you&amp;#39;re making that that&amp;#39;s the only thing.,2161.058,2.236
"As I said just a second ago, he had multiple",2163.294,2.936
sources on multiple topics.,2166.23,2.036
We don&amp;#39;t know what he briefed him on,2168.266,1.701
in its totality.,2169.967,0.768
"And so to jump to that conclusion is, frankly,",2170.735,2.969
irresponsible.,2173.704,1.202
The Press: One more question.,2174.906,0.734
When will the White House,2175.64,0.767
resume releasing visitor logs?,2176.407,2.469
Mr. Spicer: We&amp;#39;re reviewing that now.,2178.876,1.001
Alexis.,2179.877,1.835
The Press: Just to follow up -- I,2181.712,1.402
have two questions.,2183.114,0.6
One is on taxes.,2183.714,0.935
But last week you were advising the press corps,2184.649,3.637
that it didn&amp;#39;t make sense for Nunes to come to the,2188.286,2.902
White House to brief the President on something,2191.188,2.169
"that he had obtained from the White House,",2193.357,2.269
from the administration.,2195.626,1.635
So my question to you is -- I know what you just,2197.261,2.069
"said, but can you say factually, absolutely",2199.33,5.138
"flatly, that it is not possible that Chairman",2204.468,2.736
Nunes came to brief the President on something,2207.204,2.703
that he obtained from the White House,2209.907,2.236
or the administration?,2212.143,1.601
Mr. Spicer: I can&amp;#39;t say 100 percent that I know,2213.744,2.536
anything what he briefed him on.,2216.28,1.435
What I can tell you through his public,2217.715,1.702
comments is that he has said that he had multiple,2219.417,2.969
sources that he came to a conclusion on.,2222.386,2.002
So to the degree to which any of those sources,2224.388,3.003
weighed on the ultimate outcome of what he came to,2227.391,2.77
"a decision on, I don&amp;#39;t know.",2230.161,1.802
"And that&amp;#39;s something that, frankly, I don&amp;#39;t even know",2231.963,2.135
that he discussed with the President.,2234.098,1.802
The Press: So it&amp;#39;s possible?,2235.9,0.801
"As far as you know right now, it&amp;#39;s possible?",2236.701,1.401
Mr. Spicer: Anything is possible.,2238.102,0.934
The Press: Okay.,2239.036,0.668
Here&amp;#39;s my question on taxes.,2239.704,2.502
The President has said in the past that he thought,2242.206,2.569
maybe tax reform would flow over into 2018 --,2244.775,3.871
calendar year 2018.,2248.646,2.035
And we know from the President&amp;#39;s admiration of,2250.681,2.703
"the 1986 tax reform, that took more than two years.",2253.384,3.303
Can you answer two questions about,2256.687,1.602
tax reform?,2258.289,0.801
Does the President anticipate that it will,2259.09,1.568
"take that long, going into 2018 or beyond?",2260.658,3.603
And who is going to write the tax legislation?,2264.261,2.236
Who is going to devise the plan that the President,2266.497,2.236
wants to put his name on?,2268.733,2.535
"Mr. Spicer: Well, so on the first one, I know that",2271.268,1.268
Secretary Mnuchin has talked about August,2272.536,1.702
as a target date.,2274.238,1.468
And I think it depends.,2275.706,1.468
"I mean, as you point out, these are big things.",2277.174,3.137
There&amp;#39;s a lot of groups that are going to want a,2280.311,1.768
ton of input because of the very nature that,2282.079,2.803
it&amp;#39;s been 30 years.,2284.882,2.202
But I think part of this is going to be dependent,2287.084,1.835
on whether -- the degree to which we can come to,2288.919,4.371
consensus on a lot of big issues.,2293.29,3.07
But I know that we have a goal and it will depend on,2296.36,3.671
"a lot of these issues, both on the corporate side",2300.031,2.502
"and on the individual side, how that",2302.533,2.903
process evolves.,2305.436,0.701
So to predict it -- I know the Secretary would,2306.137,2.369
like to have it done.,2308.506,0.667
He&amp;#39;ll play a huge role in this.,2309.173,1.869
Gary Cohn will play a big role in it.,2311.042,1.534
I think our legislative affairs team will play,2312.576,1.602
a role in it.,2314.178,0.968
There&amp;#39;s a lot of folks on the team -- Secretary Ross,2315.146,2.636
on the Commerce side.,2317.782,1.368
There&amp;#39;s a lot of individuals -- he&amp;#39;s,2319.15,2.102
assembled a world-class Cabinet that has a lot of,2321.252,3.303
interest in helping to grow the economy to,2324.555,3.203
"attract jobs, create a more favorable tax climate",2327.758,2.236
"here in the country, but also provide tax relief",2329.994,2.369
for middle-class Americans.,2332.363,1.668
So we&amp;#39;re not there yet.,2334.031,3.07
The Press: So will it would be the Trump plan?,2337.101,1.602
Mr. Spicer: What?,2338.703,0.8
The Press: Will it be the President&amp;#39;s plan?,2339.503,1.769
"Mr. Spicer: I mean, obviously we&amp;#39;re driving",2341.272,0.967
the train on this.,2342.239,0.935
"So, I mean, we&amp;#39;re going to work with",2343.174,2.569
Congress on this.,2345.743,0.667
"But I think the President, as you&amp;#39;ve heard multiple",2346.41,4.838
times the President be very clear -- this is a,2351.248,1.368
huge priority for him and something that he feels,2352.616,2.47
very passionately about.,2355.086,1.368
And so we&amp;#39;ll have more on that later.,2356.454,2.102
John.,2358.556,1.134
"The Press: Sean, the documents that Chairman",2359.69,2.002
Nunes saw here at the White House complex are,2361.692,2.236
described by his office as being executive,2363.928,2.569
branch documents.,2366.497,1.201
In the early days after the President sent out,2367.698,1.902
"that tweet, the White House was digging around",2369.6,1.969
for anything to corroborate what the,2371.569,1.935
President had tweeted out.,2373.504,1.768
Why did it take the Intelligence Committee,2375.272,2.336
Chairman coming here to the White House to view,2377.608,2.736
executive branch documents to uncover,2380.344,1.769
this information?,2382.113,1.167
Why couldn&amp;#39;t the White House?,2383.28,0.634
"Mr. Spicer: Well, as I mentioned I think to",2383.914,3.537
"Margaret, I&amp;#39;m not going to -- I will stick to what",2387.451,1.869
the Chairman has said publicly.,2389.32,1.301
And my understanding from his public comments are,2390.621,2.503
that there are certain systems that he doesn&amp;#39;t,2393.124,1.735
have access to.,2394.859,1.902
"That was his explanation, and I&amp;#39;m going to -- I",2396.761,1.935
think you should follow up with him on that.,2398.696,1.668
The Press: Did the White House ever search the same,2400.364,1.468
documents that the Chairman searched?,2401.832,1.602
"Mr. Spicer: I don&amp;#39;t know what he found, so",2403.434,1.134
therefore it would be hard to say -- to make an,2404.568,2.536
assessment of what he was briefed on or,2407.104,1.969
what we know.,2409.073,0.667
So that&amp;#39;s a really hard question to answer,2409.74,2.936
at this point.,2412.676,0.501
The Press: Is it possible that these documents were,2413.177,1.134
merely surveillance reports that were --,2414.311,3.737
"Mr. Spicer: I&amp;#39;m not going to get into hypotheticals,",2418.048,1.268
John.,2419.316,0.501
I don&amp;#39;t know what he found.,2419.817,0.934
"And to start to say what&amp;#39;s possible, what&amp;#39;s not,",2420.751,1.969
I don&amp;#39;t know.,2422.72,0.967
"The Press: Well, let me just finish, if I could.",2423.687,1.435
Is it possible that these were surveillance reports,2425.122,2.069
from security clearances that were collected after,2427.191,2.736
people had filled out Standard Form 86?,2429.927,0.968
Mr. Spicer: I don&amp;#39;t know.,2430.895,2.836
I don&amp;#39;t know what he -- I honestly don&amp;#39;t know what,2433.731,2.803
he&amp;#39;s got on his systems and what the intel,2436.534,3.737
community has on theirs that he wouldn&amp;#39;t,2440.271,3.904
have access to.,2444.175,1.134
So I don&amp;#39;t know what he would have had,2445.309,1.735
access to already.,2447.044,0.434
Eamon.,2447.478,0.3
"The Press: Thanks, Sean.",2447.778,0.634
"On tax cuts, it looks like you guys got a little bit",2448.746,0.567
of political cover from the House Freedom Caucus,2449.613,0.601
over the weekend to do this without paying for,2450.681,1.869
"all of it -- that is, adding to the deficit.",2452.817,2.335
What&amp;#39;s the right number from the White House&amp;#39;s,2455.586,2.169
perspective to add to the deficit in order,2457.755,1.535
to do tax cuts?,2459.29,0.934
How high are you willing to go in terms of deficit?,2460.224,2.936
Mr. Spicer: It&amp;#39;s a really early question to be,2463.16,2.703
asking at this point.,2465.863,0.834
"I think the question is, as we construct this both",2466.697,3.27
on the corporate side and then on the individual,2469.967,3.07
"side, I think part of it is it&amp;#39;s going to be an",2473.037,2.369
"equation that isn&amp;#39;t just driven by that, but more",2475.406,2.736
"what&amp;#39;s going to attract jobs, what&amp;#39;s going to help",2478.142,1.702
"us build, what&amp;#39;s going to grow the economy.",2479.844,3.103
"I think we&amp;#39;re growing around -- potentially,",2482.947,2.202
"growing around 2.6, and the President really would",2485.149,3.17
like to see that growth right up in the high,2488.319,1.201
"3s, 4s, and 5s.",2489.52,3.27
And so there&amp;#39;s a question about what part of tax,2492.79,1.334
"reform, especially on the corporate side, will help",2494.525,3.103
us spur the economy and grow jobs.,2497.628,2.97
And I think that&amp;#39;s an ongoing discussion.,2500.598,3.803
I think that&amp;#39;s more of the driver of this.,2504.401,2.837
And then I think as it evolves we&amp;#39;ll have the,2507.238,0.734
score and we&amp;#39;ll know more.,2507.972,0.567
The Press: Are you comfortable entirely,2508.539,0.901
adding to the deficit?,2509.44,0.634
"Or do you think something needs to be offset, maybe",2510.074,1.268
some other spending cuts somewhere else?,2511.342,2.369
Mr. Spicer: You&amp;#39;re asking really early in the,2514.178,1.101
process to make that kind of analysis before we have,2515.646,2.736
a policy set forth or have any kind of notion of what,2518.949,2.77
a score would look like.,2522.019,0.734
Olivier.,2522.753,0.567
"Mr. Spicer: Thanks, Sean.",2523.32,0.668
There&amp;#39;s been an escalation of the American role in,2523.988,2.435
the war against the Islamic State.,2526.423,1.936
You&amp;#39;ve seen Marines come ashore in Syria.,2528.359,1.968
There have been changes to rules of engagement.,2530.327,1.802
I&amp;#39;m trying to understand the relationship between,2532.129,1.702
that change and the President&amp;#39;s,2533.831,1.034
ISIS strategy review.,2534.865,1.935
Has he personally signed off on all the changes in,2536.8,2.036
America&amp;#39;s posture in the field since January 20th?,2538.836,4.471
Is that something that&amp;#39;s left up to the,2543.307,1.368
commanders in the field?,2544.675,1.268
I don&amp;#39;t understand the relationship between --,2545.943,0.968
"Mr. Spicer: Well, it depends on which mission",2546.911,2.769
"you&amp;#39;re talking about, specifically, or -- The",2549.68,1.468
"Press: Marines left in, I think, October.",2551.148,1.735
They obviously went ashore much more,2552.883,1.635
recently than that.,2554.518,2.102
So did he have to sign off on that?,2556.62,1.835
"Mr. Spicer: I think it depends on -- I mean, he",2558.455,1.702
"speaks with General Mattis, his national",2560.157,2.703
security team very regularly.,2562.86,1.902
I&amp;#39;m not going to get into some of the details of,2564.762,1.735
what comes up in those settings.,2566.497,1.968
"But I will say that, as I&amp;#39;ve noted in the past, I",2568.465,2.403
think philosophically the President has made it very,2570.868,2.402
clear that he wants to give the commanders on the,2573.27,3.103
ground much more flexibility to execute,2576.373,1.669
"their mission, especially when it comes",2578.342,1.201
to defeating ISIS.,2579.944,0.567
"That&amp;#39;s a very big change in philosophy, but I think",2580.911,2.002
"it also depends on the magnitude of the mission,",2583.18,3.036
the number of ground troops in particular.,2586.216,1.202
And so this is an ongoing discussion that he has,2587.985,3.403
"with Secretary Mattis, Chairman Dunford and others.",2591.722,2.402
"The Press: So, on the review, are you waiting --",2594.925,2.736
is the President waiting until the review is,2599.43,0.967
complete before you announce sort of a new,2601.031,1.502
posture and new strategy?,2603.033,0.701
Or is it as conclusions come in you&amp;#39;re,2604.101,1.802
adapting day to day?,2606.503,0.935
Mr. Spicer: I think some of it is an ongoing,2607.905,3.17
discussion that he&amp;#39;s having with both Chairman,2611.942,2.703
Dunford of the Joint Chiefs and Secretary,2614.645,1.168
Mattis of DOD.,2615.813,0.567
At certain times when they meet they&amp;#39;ll update him on,2616.38,1.935
certain things and give him an update on where,2618.315,3.203
they&amp;#39;re headed right now.,2621.518,1.969
"As the review is ongoing, there&amp;#39;s certain events",2623.487,3.003
that are part of -- will be part and parcel of the,2626.49,3.303
"review in terms of where we&amp;#39;re going, and so",2630.361,1.501
they&amp;#39;ll update him on that and talk to him,2632.262,1.235
about the tweaks.,2633.497,0.634
Gabi.,2634.131,0.667
"The Press: Thank you, Sean.",2634.798,0.668
President Trump has sent out two tweets now,2635.933,1.902
criticizing members of the House Freedom Caucus for,2638.402,1.768
preventing Planned Parenthood from being,2640.671,2.402
defunded by opposing the AHCA.,2643.44,2.97
Is that something that he would want to see tacked,2646.41,2.836
on as a rider to next month&amp;#39;s spending bill?,2649.246,2.202
"Mr. Spicer: Well, I think that he&amp;#39;s made very clear",2651.448,4.204
"what his position is on Planned Parenthood, and",2655.652,3.371
obviously this was an opportunity to defund it.,2659.023,2.802
But I don&amp;#39;t want to get ahead of our,2661.825,4.572
legislative strategy.,2666.397,0.934
We&amp;#39;ll look at other opportunities.,2667.331,2.502
But this is definitely one that was a way to,2669.833,2.836
make that happen.,2672.669,0.601
Steve.,2673.27,0.701
The Press: On that legislative strategy and,2673.971,2.402
"the idea of working with Democrats, there&amp;#39;s a",2676.373,0.934
school of thought in this town that last week proved,2677.307,2.369
that the President is lacking in,2679.676,2.103
political capital.,2681.779,0.934
So I have two questions.,2682.713,1.068
"One is, what&amp;#39;s in it for Democrats to work with",2683.781,2.802
the President now?,2686.583,1.335
"And two, if fully pursued and to get things through",2687.918,3.303
"the House, Democrats and Republicans work together,",2691.221,4.138
wouldn&amp;#39;t that tend to undermine the job security,2695.359,1.635
of Speaker Ryan if the House Freedom Caucus,2696.994,1.902
is frozen out?,2698.896,1.801
"Mr. Spicer: Well, so two things.",2700.697,0.968
"Number one, I think the message that sends to the",2701.665,2.202
"American -- as I mentioned to, I think it was",2704.134,2.67
"Jonathan, at the beginning, it&amp;#39;s a",2707.071,0.867
two-way street.,2708.172,0.967
We heard -- when you see whether it&amp;#39;s Judge,2709.139,2.102
"Gorsuch, which they&amp;#39;re throwing down decades of",2711.508,2.403
Senate tradition by saying we&amp;#39;re just going to,2714.378,2.035
filibuster this guy -- I don&amp;#39;t think there&amp;#39;s anyone,2716.847,2.169
in America that can honestly look at his,2719.249,1.769
qualifications and suggest that he&amp;#39;s not qualified as,2721.018,3.837
a jurist on the Supreme Court.,2724.855,1.368
"I mean, there&amp;#39;s nothing that anyone has seen or",2726.223,2.502
laid a glove on him through these four days,2728.725,1.902
that suggests that he&amp;#39;s not qualified to serve.,2730.627,3.537
"And I think that it&amp;#39;s a -- and again, with Obamacare,",2734.164,3.871
"repealing and replacing it, several of the leading",2738.035,2.402
"Democrats came out from the get-go and said, we",2740.437,1.769
have no interest in doing that.,2742.206,1.368
So I think there&amp;#39;s a point at which both parties can,2743.574,2.969
look back and figure out whether or not,2746.543,1.735
it&amp;#39;s worth engaging.,2748.278,1.168
"I think the President, as I mentioned, is eager to",2749.446,3.27
"get to 218 on a lot of his initiatives, whether it&amp;#39;s",2752.716,3.604
"tax reform, infrastructure.",2756.954,2.002
There are a lot of things.,2758.956,1.635
And I think that he is going to be willing to,2760.591,0.4
listen to other voices on the other side to figure,2762.192,3.604
out if people want to work with him to get these big,2766.13,1.768
"things done, to make Washington work, to",2768.198,2.436
"enhance the lives of the American people, then he&amp;#39;s",2771.368,1.368
going to work with them.,2773.003,1.068
I think he had a great meeting with the CBC the,2774.071,1.835
"other day, for example, where he talked",2775.906,1.268
about infrastructure.,2777.174,1.702
"He talked about loans and small business lending,",2778.876,3.536
education.,2782.412,1.335
There are things that he is willing to engage,2783.747,3.437
individuals with -- or groups or caucuses -- to,2787.184,3.07
get to 218 and further advance his agenda.,2790.254,5.338
So it&amp;#39;s not about undermining anybody.,2795.592,2.369
It&amp;#39;s about moving the agenda forward and,2797.961,2.203
getting things done.,2800.164,1.001
The Press: It&amp;#39;s Speaker Ryan who puts bills on the,2801.165,2.202
"floor, not the President.",2803.367,1.134
So what&amp;#39;s in it for Speaker Ryan?,2804.501,1.402
Mr. Spicer: Getting things done.,2805.903,0.9
I think there is still a sense of doing what&amp;#39;s in,2806.803,1.769
the best interest of this country that exists.,2808.572,2.636
"So I mean, let&amp;#39;s just make sure that we understand --",2811.208,2.602
I think that his goal -- he came here to,2813.81,1.869
get things done.,2815.679,1.235
"And I think as was pointed out, there was a level of",2816.914,3.236
disappointment that he expressed on Friday.,2820.15,1.969
He wants to get things done.,2822.119,1.535
If people want to work together -- and I think,2823.654,0.901
"what this event on Friday did was, frankly, draw",2824.555,2.502
"more people into the process, to saying, okay,",2827.491,2.769
let&amp;#39;s figure out if we can actually come together,2830.26,1.435
"with some consensus ideas to get to 218, whether or",2832.095,2.47
not they come from one side of the aisle or the,2835.265,1.468
"other, to pass this bill and make a better system.",2837.1,2.77
"He understands -- and frankly, I think a lot of",2840.37,1.769
Democrats do -- that there&amp;#39;s an opportunity here.,2842.139,1.268
"With healthcare being such a big issue, with",2844.041,1.935
"Obamacare being such a looming disaster, that we",2847.277,4.138
have an opportunity to do some stuff.,2851.415,1.601
"And if Democrats want to join in, then that&amp;#39;s",2853.016,1.368
great and we&amp;#39;ll do that.,2854.384,0.968
Mike.,2855.352,0.434
The Press: You&amp;#39;ve talked quite a bit up there about,2855.786,4.137
the wide latitude that Secretary Price has to,2859.923,2.403
dismantle Obamacare from this spot.,2862.326,3.303
Is that still the case?,2865.629,1.234
Will he continue to try to dismantle Obamacare while,2866.863,2.603
you&amp;#39;re trying to work with moderate Democrats,2869.466,2.669
on healthcare reform?,2872.135,1.569
"And also, the healthcare bill would have repealed",2873.704,4.004
almost all those Obamacare taxes.,2877.708,1.935
Do you want to see those repealed as part of the,2879.643,2.569
tax reform bill?,2882.212,1.301
Mr. Spicer: I think Secretary Price,2883.513,1.235
is up here today.,2884.748,0.934
There&amp;#39;s a lot of meetings that are already taking,2885.682,2.269
place internally with the team.,2887.951,1.802
There&amp;#39;s a lot of options that are on the table in,2889.753,2.135
terms of -- especially when it comes to what we,2891.888,1.969
"call phase one and phase two, trying to get some of",2893.857,2.636
that stuff out the door.,2896.493,1.001
And as we look back on -- talking about lessons,2897.494,3.604
"learned, I think one of them is to try to get some",2901.098,1.801
of the phase one and phase two meshed together,2902.899,2.47
and pushed out.,2905.369,0.901
"How we do that, whether we wait for the revival of",2906.27,3.47
"legislation before we put it up -- remember, I think",2909.74,2.903
"-- just so we&amp;#39;re clear, and I mentioned earlier on",2912.643,3.069
this -- Obamacare had a ton of fits and starts,2915.712,2.937
during its process.,2918.649,1.434
"It was left for dead multiple times, but",2920.083,2.603
they pressed forward.,2922.686,1.835
I don&amp;#39;t think that that&amp;#39;s necessarily a model to,2924.521,0.634
"look for in terms of how they jammed it down, but I",2925.155,2.836
"do think that we have to recognize that we were 17,",2927.991,3.537
18 days into this process.,2931.528,1.468
I think the President has made very clear it&amp;#39;s not,2932.996,3.137
"over, there are people coming to the table, but",2936.133,1.835
he&amp;#39;s going to listen to all good ideas across the,2937.968,1.702
spectrum to figure out what it takes,2939.67,1.568
to get to 218.,2941.238,1.468
And we&amp;#39;ll see where we go from there.,2942.706,1.201
John.,2943.907,1.335
"The Press: The tax question, to follow up on",2945.242,1.601
the -- the healthcare bill would have repealed those,2946.843,2.937
Obamacare taxes?,2949.78,0.901
Mr. Spicer: And I think that&amp;#39;s part and parcel of,2950.681,1.635
"that discussion, is how we look at both the taxes",2952.316,3.203
and some of the phase one stuff.,2955.519,1.401
But we&amp;#39;re not ready to announce anything now.,2956.92,2.202
Jon Decker.,2959.122,0.935
"The Press: Yeah, as far as Jared Kushner&amp;#39;s offer to",2960.057,2.269
meet with Chairman Burr and talk with the Senate,2962.326,4.204
"Intelligence Committee, is there any particular",2966.53,3.37
reason why the White House would not be opposed to,2969.9,2.769
"the idea of Jared Kushner testifying, under oath,",2972.669,3.637
before that committee?,2976.306,1.301
"Mr. Spicer: Again, Jared volunteered to meet",2977.607,0.501
with the committee.,2978.108,3.604
They haven&amp;#39;t even confirmed having a meeting,2981.712,2.235
"yet, so to get ahead of what they&amp;#39;ve even asked",2983.947,2.002
for would be a little silly.,2985.949,1.335
"The Press: But does it set, in the White House&amp;#39;s",2987.284,2.002
"view, a dangerous precedent in having a",2989.286,2.869
senior aide to the President going up?,2992.155,2.469
"Ordinarily, we see, sometimes, the White House",2994.624,2.336
invoking executive privilege.,2996.96,2.503
Why haven&amp;#39;t you done this in this particular case?,2999.463,2.369
Mr. Spicer: Because I think Jared did a job,3001.832,1.935
during the transition in the campaign where he was,3003.767,3.57
"a conduit to leaders, and that&amp;#39;s until we had a",3007.337,5.005
State Department -- a functioning place for,3012.342,3.037
people to go.,3015.379,1.234
"Remember, we had a delay in some of these things,",3016.613,3.237
and that was his role.,3019.85,0.8
And he wants to make sure that he&amp;#39;s very clear about,3020.65,1.702
"the role that he played, who he talked to,",3022.352,0.901
and that&amp;#39;s it.,3023.253,2.87
Jim.,3026.123,0.8
The Press: Is Obamacare repeal dead?,3026.923,2.837
Mr. Spicer: I don&amp;#39;t think it&amp;#39;s dead in the sense --,3029.76,3.103
The Press: Or it would have to be dead if you&amp;#39;re,3032.863,1.268
going to have Democrats working with you to,3034.131,1.101
address the Affordable Care Act.,3035.232,0.867
Mr. Spicer: Why?,3036.099,0.534
"No, no, no, I don&amp;#39;t know that that&amp;#39;s true because",3036.633,0.934
I think it&amp;#39;s --,3037.567,0.668
The Press: Why would they work with you if --,3038.235,0.8
Mr. Spicer: Because it&amp;#39;s dying.,3039.035,0.768
"Mr. Spicer: Because I think part of it is, is",3039.803,2.736
there&amp;#39;s a recognition that it is failing.,3042.539,1.768
It&amp;#39;s dying on its own.,3044.307,0.801
It will be dead soon.,3045.108,2.303
The Press: A lot of Democrats say,3047.411,0.734
it&amp;#39;s not dying.,3048.145,0.5
"Mr. Spicer: Okay, well, then a lot of Democrats",3048.645,1.034
"need to get more money, because -- The Press:",3049.679,1.268
"There are repairs that need to be made, they say,",3050.947,2.102
but to kill the whole thing might not be the,3053.049,2.069
route they want to go.,3055.118,0.801
"Mr. Spicer: I understand what they want, but I",3055.919,1.134
think there&amp;#39;s a difference.,3057.053,0.568
I think that we recognize that premiums continue to,3057.621,2.803
"go sky-high, deductibles are going sky-high,",3060.424,2.535
choices are going down.,3062.959,1.502
"By Leader Pelosi&amp;#39;s own metric, this is dying.",3064.461,2.569
She&amp;#39;s the one who crafted the metric.,3067.03,4.238
She said that there was a three-pronged system to,3071.268,2.469
determining its success.,3073.737,1.001
It is an abysmal failure.,3074.738,1.735
