text,start,duration
sure that that promise would be kept as far,2008.773,2.502
as the payment of it.,2011.275,1.535
The Press: And just a real quick follow-up.,2012.81,1.302
If border crossings are down -- and that&amp;#39;s,2014.112,1.901
a talking point that the White House uses time,2016.013,1.702
and again -- is the wall even necessary?,2017.715,2.069
Mr. Spicer: Absolutely.,2019.784,1.101
The wall does several things.,2020.885,1.802
The Press: How can the border crossings be down,2022.687,1.735
"when the President is saying, well, we&amp;#39;re going",2024.422,1.335
to have all these drugs flowing in if we don&amp;#39;t,2025.757,1.768
have a wall?,2027.525,1.001
Mr. Spicer: Because you can&amp;#39;t -- just because,2028.526,1.168
"you have a couple good months in a year, I think you want",2029.694,2.369
to make sure that you take prudent long-term steps.,2032.063,3.203
"So, the President is going to fulfill it,",2035.266,1.468
"and frankly, it&amp;#39;s a promise that he made",2036.734,1.402
to the American people.,2038.136,1.301
"I think if you are coming in from our southern border,",2039.437,3.136
he has taken a lot of steps so far that has deterred,2042.573,3.27
border crossing.,2045.843,1.168
But this is a permanent step that will extend,2047.011,1.702
beyond his presidency.,2048.713,1.935
"Eight years from now, the next President will have",2050.648,2.77
that wall in place to make sure that it doesn&amp;#39;t continue.,2053.418,4.237
"The Press: So, Mexico is going to pay for it?",2057.655,1.368
Mr. Spicer: That&amp;#39;s right.,2059.023,0.667
Thank you.,2059.69,0.668
Alexis.,2060.358,1.168
"The Press: Sean, this might relate to Jim&amp;#39;s",2061.526,1.668
"question, too, but on Wednesday -- I have two questions.",2063.194,2.903
"On Wednesday, when we see the outline that Secretary Mnuchin",2066.097,3.47
"was just describing, will the President help aim Congress",2069.567,4.071
toward his decision about whether the border,2073.638,2.736
"adjustment tax is the right idea, and also, related to that,",2076.374,4.704
whether the pay-fors for the wall that might be of interest,2081.078,4.605
to lawmakers will become evident as part of the outline,2085.683,3.303
of what he&amp;#39;d like to do in terms of taxes?,2088.986,1.936
Mr. Spicer: Right.,2090.922,1.268
"Well, I don&amp;#39;t mean to evade that, but I think",2092.19,2.369
there&amp;#39;s a reason he chose -- we&amp;#39;re waiting until,2094.559,1.768
Wednesday to have the details that he wants to share out.,2096.327,3.003
"We got a couple days before that happens,",2099.33,3.437
so I&amp;#39;m going to have to ask you to wait 48 hours.,2102.767,3.87
The Press: Can you say whether we will have,2106.637,1.402
a generally better idea?,2108.039,1.935
Will we have a generally better idea of where his thinking is?,2109.974,2.936
Mr. Spicer: I think you will have a better idea,2112.91,1.468
of where the President stands on tax reform and what,2114.378,1.769
he wants to accomplish.,2116.147,1.134
Yes.,2117.281,1.368
John.,2118.649,1.168
"The Press: Wait, wait, I have one follow-up.",2119.817,1.802
"When you were just describing, and Secretary Mnuchin",2121.619,2.135
"was describing, achieving economic growth",2123.754,2.67
"of 3 percent or higher, which is slightly lower",2126.424,3.003
"than what the President talked about in the campaign,",2129.427,2.102
which was a very ambitious goal,2131.529,2.502
"of 4 percent -- I&amp;#39;m just trying to figure out,",2134.031,2.269
what is the timeline for that?,2136.3,1.468
Is the President thinking he would like to achieve,2137.768,2.67
3 percent or higher in his first term because,2140.438,3.236
"of the headwinds that obviously, the United States",2143.674,3.537
is facing abroad?,2147.211,1.235
"I mean, that&amp;#39;s a very ambitious goal still --",2148.446,1.468
3 percent.,2149.914,1.034
"Mr. Spicer: Well, and I think that he has taken",2150.948,1.368
"a lot of steps not just on the tax side, but on the",2152.316,1.869
"regulatory side, as well, that I think are clearly",2154.185,3.437
already paying dividends in terms of what you&amp;#39;re,2157.622,2.636
seeing -- we&amp;#39;ve talked about this before --,2160.258,2.602
manufacturing come back and jobs come back.,2162.86,1.335
And I think there&amp;#39;s going to be a renewed commitment,2164.195,1.368
"of manufacturers, American companies to bring back jobs,",2165.563,3.57
"to grow, to hire, to expand here in the United States.",2169.133,3.67
And so I think that that growth will proceed,2172.803,2.603
"the President&amp;#39;s actions, both on the tax front and on",2175.406,2.302
the regulatory side.,2177.708,1.135
John.,2178.843,1.168
"The Press: Thanks so much, Sean.",2180.011,1.201
"As you know, the first go-around at replacing",2181.212,1.268
Obamacare was not successful.,2182.48,2.269
"Since then, are you any closer to getting 218 votes",2184.749,3.87
in the House to pass or replace the Affordable Care Act?,2188.619,3.771
Mr. Spicer: Yes.,2192.39,1.535
(Laughter.),2193.925,2.802
The Press: Got a number?,2196.727,1.635
"The Press: Yeah, elaborate a little more than &amp;quot;yes&amp;quot;?",2198.362,1.869
"Mr. Spicer: Well, first of all, we only need 216.",2200.231,2.669
You&amp;#39;re making it a little tougher on us right now.,2202.9,2.936
But I do think that we have seen progress with,2205.836,2.002
members in terms of some of the changes that have,2207.838,4.705
been made to make it a stronger bill.,2212.543,3.203
But we&amp;#39;re getting close.,2215.746,1.402
"And as I mentioned at the outset, when I think",2217.148,2.836
the President feels confident that -- or when the leadership,2219.984,4.071
of the House tells him that they feel confident that they have,2224.055,3.003
"the votes, then I&amp;#39;m sure they&amp;#39;ll call a vote.",2227.058,2.002
But that&amp;#39;s up to them to decide.,2229.06,1.968
"The Press: And a separate one, obviously,",2231.028,2.236
"a different topic, and that&amp;#39;s the election",2233.264,3.136
over the weekend in France.,2236.4,2.102
Any comment on the results that came out of France,2238.502,4.004
over the weekend?,2242.506,1.268
Would the President be satisfied with either,2243.774,2.77
"alternative, Macron or Le Pen?",2246.544,2.469
"Mr. Spicer: Yeah, obviously, it&amp;#39;s up to",2249.013,1.535
the people of France to decide who their next leader is.,2250.548,2.302
And we respect the decision that they make in May.,2252.85,4.571
"So, let&amp;#39;s -- our job is to work with whomever",2257.421,3.37
the French people choose.,2260.791,2.002
Anita.,2262.793,1.302
The Press: Two questions.,2264.095,1.401
"One, on the budget, the spending plan,",2265.496,1.902
what is the President doing?,2267.398,1.468
I understand Mick Mulvaney and others are doing things.,2268.866,2.169
Is he calling members?,2271.035,1.602
I don&amp;#39;t see anything on his schedule for this week.,2272.637,2.002
Are members coming over?,2274.639,0.967
"Mr. Spicer: As needed, he&amp;#39;ll be involved.",2275.606,2.736
I think the legislative team has been giving him,2278.342,2.503
"updates, and as he needed --",2280.845,3.737
The Press: Has he been calling members?,2284.582,1.068
Mr. Spicer: He&amp;#39;s talked to members.,2285.65,1.401
I just mentioned he&amp;#39;s having dinner tonight,2287.051,1.802
with Senator McCain and Senator Graham.,2288.853,2.169
He&amp;#39;s had lots of discussion with members,2291.022,2.736
at various times.,2293.758,1.001
This is not -- we&amp;#39;re not at a position now where he,2294.759,3.737
"is actively engaging the way he was at,",2298.496,3.003
say the end of healthcare.,2301.499,1.201
"I think as his team tells him that he needs phone calls,",2302.7,3.236
but he is actively monitoring and been given,2305.936,1.869
updates by the senior team that is working with the Hill.,2307.805,2.87
"The Press: When he calls, is he talking about",2310.675,1.134
his priorities?,2311.809,1.134
I would like you to include --,2312.943,1.435
Mr. Spicer: I think his priority have been crystal-clear.,2314.378,1.835
"I mean, remember, starting in the first week of March,",2316.213,2.77
Director Mulvaney engaged with appropriators,2318.983,2.402
on the House side.,2321.385,0.668
And I&amp;#39;m not sure when he started.,2322.053,1.668
"So this has been an ongoing discussion now,",2323.721,1.735
"almost for eight weeks, with the senior team here",2325.456,4.004
and appropriators in the House in particular.,2329.46,2.769
The Press: Okay.,2332.229,1.068
"And then on the second issue, on the 100 days,",2333.297,1.902
someone mentioned the President tweeted,2335.199,2.636
that it was a ridiculous timetable or whatever.,2337.835,2.536
Why is the White House doing so much this week?,2340.371,2.769
You have indicated that all these activities this,2343.14,3.47
"week, from hearing from different people,",2346.61,2.703
are because of the 100 days.,2349.313,1.301
Why do this 100-day push if it&amp;#39;s a ridiculous,2350.614,2.403
amount of time?,2353.017,1.435
Mr. Spicer: I think we&amp;#39;ve gotten a fairly decent,2354.452,1.268
amount of inquiries from you and your colleagues.,2355.72,2.435
"And so, in order to answer those inquiries --",2358.155,2.77
"The Press: So, you&amp;#39;re doing something for us?",2360.925,1.301
"Mr. Spicer: Yeah, well, you know, we&amp;#39;re givers.",2362.226,1.368
(Laughter.),2363.594,2.569
But I don&amp;#39;t think there&amp;#39;s anyone in this room that hasn&amp;#39;t,2366.163,3.07
"lodged a request to say, &amp;quot;We&amp;#39;re writing a story on the 100-day",2369.233,4.538
"mark, we&amp;#39;re doing this on the 100-day mark.&amp;quot;",2373.771,2.135
"And so, we want to make sure that we answer your questions",2375.906,3.07
as truthfully as possible and as thoroughly and comprehensively.,2378.976,3.103
"So, we will have to fulfill all of these",2382.079,2.77
requests that are coming in from you and your,2384.849,1.368
"colleagues, but I also think that we are very",2386.217,2.669
"proud, and the President is very proud, of what",2388.886,2.202
he&amp;#39;s been able to accomplish in the first 100 days.,2391.088,2.336
"And as we sprint towards these final 100 days,",2393.424,3.77
there&amp;#39;s two things.,2397.194,1.001
"One, I think because of the inquiries we&amp;#39;ve had,",2398.195,1.435
we want to make sure we take an opportunity,2399.63,1.768
to make sure that people understand how much he&amp;#39;s,2401.398,2.436
"done in all the different areas, but we also want",2403.834,1.802
to start talking about the next 100 days and what,2405.636,2.136
"else is left to be done, and how we&amp;#39;re going",2407.772,1.935
to continue to work hard to get all of that done.,2409.707,3.27
"But there&amp;#39;s a lot that has been accomplished, and I think",2412.977,4.538
it&amp;#39;s appropriate to comment and to share,2417.515,2.902
with the American people all the things that he has done,2420.417,3.404
to fulfill the pledges that he made,2423.821,1.401
to the American people.,2425.222,1.302
"The Press: And just to clarify, are we going",2426.524,1.568
"to hear, prior to the rally on Saturday, are we going",2428.092,2.936
to hear directly from him?,2431.028,1.535
There was some talk of a press conference.,2432.563,1.535
Mr. Spicer: I&amp;#39;ll have further updates,2434.098,1.368
on the schedule going forward.,2435.466,3.437
"The Press: So, there will be one, or maybe not?",2438.903,1.034
Mr. Spicer: Huh?,2439.937,1.068
The Press: The press conference --,2441.005,1.234
Mr. Spicer: We&amp;#39;re working on some scheduling issues,2442.239,2.002
"for the rest of the week, and I&amp;#39;ll make sure I give you",2444.241,1.902
an update as we move forward.,2446.143,1.235
Kristen.,2447.378,1.134
"The Press: Thanks, Sean.",2448.512,1.402
"I just want to circle back on healthcare, because at the top",2449.914,2.235
of the President&amp;#39;s listed agenda items for the first 100 days,2452.149,2.67
was repealing and replacing Obamacare.,2454.819,1.668
"So, does the President want to, expect to see,",2456.487,2.903
a vote on healthcare this week?,2459.39,2.102
"Mr. Spicer: Look, he&amp;#39;d love to do it.",2461.492,1.968
If the Speaker and the Majority Leader,2463.46,2.303
"and the Whip come and tell him that they&amp;#39;ve got the votes,",2465.763,3.57
then we&amp;#39;d love to do it.,2469.333,0.868
I think his goal isn&amp;#39;t to fit it into,2470.201,2.802
"a finite timetable, as he mentioned on Friday.",2473.003,2.303
"If it happens this week, that&amp;#39;s great.",2475.306,1.868
"If it happens next week, that&amp;#39;s great too.",2477.174,2.136
"The goal is to get it done, and get it done right.",2479.31,2.636
"And so, we&amp;#39;re not going to jam it through just",2481.946,3.436
for the sake of it.,2485.382,1.035
"The Press: So, he&amp;#39;s concerned about",2486.417,1.401
potentially rushing it through.,2487.818,1.402
"Mr. Spicer: No, no, he --",2489.22,1.134
The Press: I hear what you&amp;#39;re saying is he doesn&amp;#39;t want it,2490.354,1.335
"to happen this week, just to meet that.",2491.689,1.334
Mr. Spicer: Exactly.,2493.023,1.202
The Press: Okay.,2494.225,1.001
Let me ask you about tax reform.,2495.226,1.167
I know you don&amp;#39;t want to get ahead of the announcement,2496.393,0.968
on Wednesday.,2497.361,0.968
Mr. Spicer: Thank you.,2498.329,1.034
The Press: But there&amp;#39;s a sense that it is more,2499.363,1.201
realistic to pursue targeted tax cuts,2500.564,1.935
as opposed to broad tax reform.,2502.499,2.103
"Will we, on Wednesday, see a proposal for targeted tax cuts?",2504.602,3.436
"Mr. Spicer: As you stated in your question, I&amp;#39;ll let",2508.038,3.604
the President and the team speak on Wednesday with,2511.642,2.803
"respect to what they&amp;#39;re going to outline,",2514.445,1.401
but I&amp;#39;m not going to get --,2515.846,1.502
The Press: But does the President think that,2517.348,1.401
it&amp;#39;s realistic to do broad tax reform without having,2518.749,2.569
to repeal or replace Obamacare?,2521.318,1.669
Mr. Spicer: I think that the President said that,2522.987,1.601
he&amp;#39;s going to --,2524.588,1.268
"The Press: Is it possible, mathematically?",2525.856,1.402
Mr. Spicer: There&amp;#39;s a lot of things that are,2527.258,1.134
"possible, but let&amp;#39;s let the President -- he made",2528.392,1.535
"a commitment to get it out on Wednesday, so let&amp;#39;s be",2529.927,3.27
patient and wait until Wednesday.,2533.197,3.203
The Press: And just one more.,2536.4,1.001
Mr. Spicer: Of course.,2537.401,1.401
(Laughter.),2538.802,1.302
The Press: Is there a plan for infrastructure reform,2540.104,1.234
in the works?,2541.338,1.168
Will we get that before --,2542.506,1.368
"Mr. Spicer: That&amp;#39;s another thing that&amp;#39;s on the list, but I think",2543.874,1.468
we seem to have our hands full right now with healthcare,2545.342,3.103
and tax reform.,2548.445,1.335
He&amp;#39;s obviously still committed to seeing,2549.78,1.468
"infrastructure, something he&amp;#39;s talked about a lot in terms",2551.248,1.502
of roads and bridges and rebuilding things.,2552.75,1.735
But let&amp;#39;s get these first two things moving.,2554.485,4.271
But I think you&amp;#39;re going to see a continued commitment,2558.756,2.068
to infrastructure as well.,2560.824,1.435
The Press: It&amp;#39;s one of the things that could,2562.259,1.168
potentially have bipartisan support.,2563.427,1.702
Is there urgency to get infrastructure reform passed?,2565.129,1.835
Mr. Spicer: (Laughter.),2566.964,1.335
"So, either we&amp;#39;re doing too much or we&amp;#39;re not doing enough.",2568.299,1.334
"But I think -- look, he has made it very clear",2569.633,2.403
that that is a priority of his.,2572.036,1.301
"As you point out, it&amp;#39;s something that I think",2573.337,2.97
"both sides of the aisle, of both chambers, probably agree on.",2576.307,4.004
There&amp;#39;s a public-private partnership that could,2580.311,3.269
really benefit our infrastructure in terms,2583.58,2.536
of the financing piece of this.,2586.116,1.635
"We&amp;#39;ll have further details on that moving forward, though.",2587.751,1.936
"Thank you, guys, very much.",2589.687,1.301
I&amp;#39;ll see you tomorrow.,2590.988,0.767
Have a great Monday.,2591.755,2.169
