text,start,duration
"by the regime in Pyongyang, does this make it more difficult",1100.666,3.303
for the President to negotiate through China to try,1103.969,2.803
to denuclearize North Korea?,1106.772,1.835
Mr. Spicer: No.,1108.607,1.301
"I think China -- and we noted it before,",1109.908,1.502
Ambassador Haley noted it in several interviews this,1111.41,2.335
"morning -- but China has been very, very helpful",1113.745,3.37
in this process and continues to be.,1117.115,1.602
And I think we hope to see a change in behavior.,1118.717,3.237
"But it is a very positive sign, the level of",1121.954,2.769
engagement that China has been -- has enacted.,1124.723,3.771
The Press: Is the Trump administration calling for,1128.494,2.569
the release of this U.S. citizen currently being detained?,1131.063,4.704
"Mr. Spicer: Well, absolutely.",1135.767,1.202
"I mean, we want to make sure that all of our",1136.969,1.668
citizens are protected and returned home.,1138.637,1.568
But the State Department is playing the lead on that.,1140.205,1.902
Eamon.,1142.107,1.268
"The Press: Thanks, Sean.",1143.375,1.368
You know there&amp;#39;s quite a bit of concern among,1144.743,1.602
Republicans on Capitol Hill about the federal deficit.,1146.345,1.801
"When you roll out the tax plan on Wednesday,",1148.146,1.769
"are you also going to include pay-fors in there, that",1149.915,2.269
is those things that raise revenue as well as those,1152.184,2.235
"things that are tax cuts, so that conservatives can",1154.419,2.603
be confident that this won&amp;#39;t blow a hole in the deficit?,1157.022,1.502
Mr. Spicer: I think we will have further details.,1158.524,2.469
"I&amp;#39;m not going to get ahead of the President&amp;#39;s rollout,",1160.993,2.202
but I&amp;#39;m not going to -- the level of specificity,1163.195,4.504
"in terms of the pay-fors and the cost, we&amp;#39;ll have to see how",1167.699,2.77
comfortable the President is.,1170.469,1.068
Jennifer.,1171.537,1.368
"The Press: Sean, can you tell us if the President",1172.905,1.401
is aware of the American pastor jailed in Turkey?,1174.306,3.437
And did he raise that with President Erdogan,1177.743,2.002
in the call he made to congratulate him?,1179.745,1.301
Mr. Spicer: I&amp;#39;m not going to get into the specifics,1181.046,3.203
of the President&amp;#39;s conversation.,1184.249,1.335
"We&amp;#39;re obviously aware of that action, and we&amp;#39;re going",1185.584,3.804
to continue to work through,1189.388,1.568
the State Department on that.,1190.956,1.501
Jordan.,1192.457,1.368
"The Press: Sean, can you explain why President Trump",1193.825,2.403
didn&amp;#39;t use the word &amp;quot;genocide&amp;quot; to refer to the killing,1196.228,3.27
of 1.5 million Armenians in his statement today?,1199.498,3.103
Mr. Spicer: Yes.,1202.601,1.134
The statement that was put out is consistent with,1203.735,1.569
the statements that have been put out for at least several,1205.304,2.769
of the past administrations.,1208.073,1.935
"So, I think if you look back to the language that",1210.008,2.236
"President Obama, President Bush have used,",1212.244,2.869
the language the President used is consistent,1215.113,2.303
with all of that.,1217.416,1.268
Katie,1218.684,1.501
The Press: I have two questions on two different topics.,1220.185,1.969
"First, the border wall, the logistics of that.",1222.154,1.635
Secretary Kelly said he still expects construction,1223.789,2.402
to start this summer.,1226.191,1.602
There are still a few ranchers in Texas and Arizona,1227.793,2.102
who welcome the security but are skeptical of giving up,1229.895,2.903
family-owned land that&amp;#39;s been in their families for generations.,1232.798,2.669
"So, what is the White House message to them directly?",1235.467,2.836
And what -- can you guarantee that,1238.303,2.369
they will be compensated?,1240.672,1.735
Mr. Spicer: We&amp;#39;re going to -- we will do everything,1242.407,2.57
in accordance with the law.,1244.977,1.468
This has been an issue that has gone on several,1246.445,1.902
times as that issue has been raised over the last,1248.347,2.702
several decades -- excuse me -- several years.,1251.049,2.97
"And so, we will do everything in accordance",1254.019,3.503
with the law with respect to the land that&amp;#39;s needed for that.,1257.522,4.038
"But again, the Homeland Security Secretary",1261.56,2.736
understands what&amp;#39;s going to be needed and will,1264.296,2.736
do surveys and the appropriate planning,1267.032,1.902
to make sure that we minimize that to the extent possible.,1268.934,3.704
The Press: And on the next question on a different,1272.638,2.235
topic -- the FBI and Justice Department,1274.873,1.769
last week arrested two doctors in Michigan for allegedly,1276.642,3.903
performing genital mutilation on little,1280.545,2.303
"girls, as young as six years old.",1282.848,1.668
It&amp;#39;s the first case in the United States.,1284.516,2.136
What is the White House reaction to that case?,1286.652,2.335
Mr. Spicer: We&amp;#39;ve talked before about pending,1288.987,2.67
investigations and we don&amp;#39;t comment on any pending,1291.657,2.902
investigations or actions by the Justice Department.,1294.559,3.904
Major.,1298.463,1.402
"The Press: Is 100 days, as the President said",1299.865,1.268
"on Twitter, a ridiculous benchmark, or an important one?",1301.133,3.169
"Mr. Spicer: Well, I think obviously in the context",1304.302,2.303
"of an entire administration, there is a lot that I think",1306.605,4.204
we feel very proud of what we&amp;#39;ve gotten done and taken care of.,1310.809,4.338
You look at the immigration piece,1315.147,1.768
"in particular, border crossings way down.",1316.915,2.069
The number of executive orders and pieces,1318.984,2.235
of legislation the President has signed -- I think we,1321.219,1.502
feel very proud of what we&amp;#39;ve been able to,1322.721,1.935
accomplish and fulfill the promises that he&amp;#39;s made,1324.656,2.503
to the American people.,1327.159,0.8
But I think it&amp;#39;s got to be kept in context.,1327.959,2.069
And I think that&amp;#39;s -- there is sort of this,1330.028,2.269
artificial number that gets thrown out.,1332.297,3.103
"So, on --",1335.4,1.201
The Press: What is the context?,1336.601,1.168
"Mr. Spicer: Well, I mean, the context is it&amp;#39;s 100 days,",1337.769,1.268
and four years in your first term and eight years,1339.037,4.672
for two terms -- that I think --,1343.709,2.302
"The Press: As a candidate, Mr. Trump introduced a contract",1346.011,2.636
with the American voter over 100 days --,1348.647,1.068
Mr. Spicer: Right.,1349.715,0.667
"And so, again, I think when you look at",1350.382,1.601
"the number of pieces of legislation,",1351.983,1.702
"the executive orders, business confidence, the U.S.&amp;#39;s role",1353.685,2.903
in the world -- there&amp;#39;s a lot that we feel --,1356.588,4.705
a lot of accomplishments that have occurred.,1361.293,2.235
And we feel very good about what we&amp;#39;ve done,1363.528,1.635
as we head up to this first 100 days.,1365.163,2.303
But I think you&amp;#39;re going to continue to see a lot,1367.466,2.068
"of action, a lot of results going into the",1369.534,1.702
"second 100 days, the third 100 days, all the way through.",1371.236,3.403
The Press: If in that 100 days there is no funding,1374.639,1.969
"-- explicit funding for the wall, and there&amp;#39;s",1376.608,1.768
no healthcare reform or repeal of Obamacare --,1378.376,2.436
"would the President consider that, and would",1380.812,1.902
he invite his supporters to consider that a conspicuous,1382.714,3.103
"failure, based on the promises",1385.817,1.869
he made during the campaign?,1387.686,1.368
Mr. Spicer: I think when you look at the totality,1389.054,1.535
"of what we&amp;#39;ve accomplished on job creation,",1390.589,3.27
"on immigration, on trade, it is unbelievable what",1393.859,6.439
he has been able to do.,1400.298,1.669
And so it&amp;#39;s not -- you can cherry-pick any couple of,1401.967,3.436
"things and say, okay, well, what about this and that.",1405.403,1.702
But I think when you look at it overall in terms,1407.105,2.136
"of the drop-in border crossings, if you look",1409.241,2.636
"at consumer confidence, and the relationships that",1411.877,2.502
"we&amp;#39;ve developed around the globe, and the accomplishments",1414.379,2.603
"this President has had in protecting the country,",1416.982,2.202
in bringing back jobs and starting -- those have been,1419.184,2.669
unbelievably significant.,1421.853,1.335
"And so to minimize that, or to look and pick out",1423.188,3.837
"two or three things -- but I think, look, we&amp;#39;re going",1427.025,2.402
to continue to push for healthcare reform.,1429.427,1.535
We feel very good about the direction that it&amp;#39;s going in.,1430.962,2.403
It&amp;#39;s been very positive.,1433.365,1.334
And I think the construction of a wall,1434.699,2.236
is going to continue to be an area that moves forward.,1436.935,3.203
But all of that stuff is happening just,1440.138,2.136
as the President asked for and committed to doing.,1442.274,3.37
"Some of it has been a little slower, but mostly",1445.644,2.669
because of working through Congress and getting,1448.313,1.869
things done.,1450.182,0.9
But when you think about what he started --,1451.082,2.036
"he&amp;#39;ll move forward on tax reform, healthcare,",1453.118,2.803
"on immigration, on trade -- it&amp;#39;s been a hugely",1455.921,3.169
successful first 100 days.,1459.09,1.702
The Press: And without the President necessarily,1460.792,1.935
"describing it as a failure or not, would he say that",1462.727,2.436
he&amp;#39;s learned something about the process and how,1465.163,2.803
long things take that he perhaps didn&amp;#39;t appreciate,1467.966,2.569
as a candidate?,1470.535,1.135
Maybe he over-promised on the speed with which,1471.67,1.635
he&amp;#39;d achieve these things?,1473.305,1.334
"Mr. Spicer: Look, with all due respect, I think that",1474.639,1.435
when you look at the list of things in each of the,1476.074,2.069
"various areas that he&amp;#39;s been able to do, I think",1478.143,2.736
he&amp;#39;s very pleased --,1480.879,0.934
The Press: I&amp;#39;m talking about some conspicuous campaign,1481.813,2.102
"promises that, at rally after rally, he made and said,",1483.915,2.469
&amp;quot;Don&amp;#39;t worry it&amp;#39;s going to happen.&amp;quot;,1486.384,1.268
Mr. Spicer: Right.,1487.652,1.135
And I think on healthcare --,1488.787,1.201
"The Press: All I&amp;#39;m asking is, does he have a different",1489.988,1.835
awareness of how difficult those things are than he did,1491.823,1.935
as a candidate?,1493.758,1.368
Mr. Spicer: I&amp;#39;m sure that there are things that you,1495.126,2.036
"learn on the job, but I think that he is very",1497.162,1.702
proud of what he has set out to do and the progress,1498.864,2.035
that we&amp;#39;ve made.,1500.899,1.168
And I think you&amp;#39;re going to see healthcare,1502.067,1.601
"get done, but it&amp;#39;s going to get done right, and that",1503.668,1.735
in particular is something that we&amp;#39;re continuing to work at.,1505.403,3.804
"We can&amp;#39;t make people vote, but we&amp;#39;ve made significant",1509.207,2.569
progress and moved the legislation forward,1511.776,2.303
and improved it greatly.,1514.079,1.034
And I think that we are going to see progress on that.,1515.113,3.837
Zeke.,1518.95,1.335
"The Press: Thanks, Sean.",1520.285,1.068
Two questions on two different topics.,1521.353,1.268
"First, to follow up on Jordan, and the other",1522.621,2.569
question is on the budget.,1525.19,1.435
Is the President willing to sign a continuing,1526.625,1.601
resolution that is not deficit-neutral,1528.226,1.535
or deficit-reducing?,1529.761,1.602
For instance --,1531.363,1.334
Mr. Spicer: Sign a continuing resolution?,1532.697,1.202
The Press: Yeah.,1533.899,1.401
Continuing resolutions that would increase the deficit.,1535.3,3.17
Mr. Spicer: I have not seen a score on anything,1538.47,1.334
that&amp;#39;s come out.,1539.804,2.203
And I think we&amp;#39;ll have to wait and see what the final --,1542.007,1.968
The Press: You&amp;#39;re not ruling that,1543.975,3.604
out one way or --,1547.579,1.234
Mr. Spicer: I&amp;#39;m not -- not at this point.,1548.813,1.635
"The Press: And following up on Jordan&amp;#39;s question,",1550.448,1.735
the President talked a lot about -- he has not been,1552.183,1.702
shy about criticizing his predecessors for some,1553.885,1.502
"of their missteps from both parties, and also hasn&amp;#39;t --",1555.387,1.801
has made a point of often bucking conventions.,1557.188,2.203
So why not take this moment to label,1559.391,1.601
the killing of a million-and-a-half,1560.992,1.535
Armenians a genocide?,1562.527,0.834
"Mr. Spicer: I think, again, as I noted to",1563.361,2.236
"Jordan, the statement that the President put out",1565.597,2.135
is consistent with the last several administrations.,1567.732,2.803
The Press: (Inaudible.),1570.535,1.135
Mr. Spicer: I understand that.,1571.67,1.468
But it is perfectly in keeping with the language,1573.138,2.536
that&amp;#39;s been used over and over again.,1575.674,1.368
John.,1577.042,3.503
The Press: Would you agree with the assessment that,1580.545,3.003
some within the administration have,1583.548,1.869
"that a vote on healthcare this week is very, very unlikely?",1585.417,3.503
Mr. Spicer: I think the vote is going to get,1588.92,2.169
scheduled when Speaker Ryan and Leader McCarthy,1591.089,2.569
and Congressman Scalise determine that they have,1593.658,1.902
the votes and they feel confident.,1595.56,1.835
I think we&amp;#39;ve been very clear -- the President,1597.395,2.202
made it clear on Friday when he was walking back,1599.597,2.136
over from the Treasury Department -- that if it,1601.733,2.002
"happens and we have the votes this week, great;",1603.735,1.735
if it&amp;#39;s next week or the week after.,1605.47,1.668
But I think we want to make sure that we&amp;#39;ve got,1607.138,1.535
the votes and we&amp;#39;re headed in the right direction,1608.673,1.302
before putting some kind of artificial deadline.,1609.975,2.268
The Press: But would you think that this week is unlikely?,1612.243,2.303
Mr. Spicer: I think that whenever the Speaker,1614.546,2.235
and the Leadership over at the House tell us that they feel,1616.781,2.403
"confident that they have the votes,",1619.184,1.334
then we would encourage them to move forward.,1620.518,2.736
I hate to -- I&amp;#39;m not trying to not answer,1623.254,2.269
"the question, but I think that&amp;#39;s the answer.",1625.523,1.535
It comes down to when they feel as though they&amp;#39;ve,1627.058,1.936
got the commitments to push the bill forward.,1628.994,2.335
The Press: But there was a push to try to,1631.329,2.202
get something on the legislative scoreboard,1633.531,2.436
by the 100th day.,1635.967,1.869
Does it look like that now will not happen?,1637.836,1.468
"Mr. Spicer: As I said, we have been very clear from",1639.304,2.769
"here, and I think the President has been very",1642.073,1.335
clear in his comments that our goal is to get it done,1643.408,4.905
"and get it done right, and get it done to make sure",1648.313,1.735
that we have the votes.,1650.048,0.901
I think there have been some -- I&amp;#39;ve read some,1650.949,1.435
background quotes and sources about when it --,1652.384,2.702
but we&amp;#39;ve been very clear publicly about when we want,1655.086,1.969
to get that done.,1657.055,1.234
Kelly.,1658.289,1.268
The Press: The President has been very clear that,1659.557,1.435
"Judge Gorsuch, now Justice Gorsuch, is a big part",1660.992,2.636
of his first 100 days&amp;#39; accomplishments.,1663.628,1.902
"And the White House, in the rollout about the 100 days,",1665.53,2.469
said there would be a dinner with,1667.999,1.335
the President and all the justices of the Supreme Court.,1669.334,2.903
Now that is off the list.,1672.237,1.034
"Is the dinner not happening, or is not",1673.271,2.069
publicly being talked about because it&amp;#39;s wrapped,1675.34,2.002
up in the politics of the White House?,1677.342,2.102
Mr. Spicer: I think we&amp;#39;ve moved some things around,1679.444,1.168
"on the President&amp;#39;s schedule this week,",1680.612,1.501
but we hope to have something at some point.,1682.113,2.102
The Press: Was it unfortunate to sort,1684.215,1.435
of sweep the High Court into the politics of 100 days?,1685.65,2.369
Mr. Spicer: No.,1688.019,1.301
I think having a relationship and meeting,1689.32,3.738
with the Supreme Court at some point would be a,1693.058,1.468
great idea and something that we hope to have,1694.526,2.402
on the schedule some point soon.,1696.928,1.635
Kaitlan.,1698.563,1.168
The Press: Can you explain the President&amp;#39;s change,1699.731,1.668
of thought on DACA?,1701.399,1.568
Mr. Spicer: I think he&amp;#39;s been consistent about two things.,1702.967,5.239
"One, that he has a heart.",1708.206,1.802
He wants to make sure that he does what&amp;#39;s in the interest,1710.008,2.402
of children in particular.,1712.41,2.036
"But secondly, I think the President&amp;#39;s priorities",1714.446,2.469
since he took office have been very clear that,1716.915,2.435
the focus would be on folks who presented a danger,1719.35,2.47
to public safety.,1721.82,1.901
"And that&amp;#39;s what it&amp;#39;s been, and that&amp;#39;s where",1723.721,1.369
it continues to be.,1725.09,1.167
And I think he is someone who understands the issue,1726.257,3.504
and the priorities that need to get laid out,1729.761,1.768
by this country.,1731.529,1.235
"And so, everything that he has done has been",1732.764,1.134
consistent with what he said from the get-go.,1733.898,2.136
The Press: But I understand that he said,1736.034,1.668
"that the criminals would leave first, but last August,",1737.702,3.67
he said that DACA defied federal law and was illegal.,1741.372,3.671
"So, does he still think it&amp;#39;s illegal?",1745.043,1.435
Mr. Spicer: I understand.,1746.478,1.368
And I think that his comments that he made last,1747.846,1.801
"week, that he understands that in a lot of cases",1749.647,2.803
this involves families and small children who have,1752.45,1.935
"been here, and he has a heart, and we&amp;#39;re going to",1754.385,1.602
work through the immigration --,1755.987,2.269
The Press: But does he still think it&amp;#39;s illegal?,1758.256,2.135
Mr. Spicer: I understand.,1760.391,1.135
What I&amp;#39;m trying to do is answer the question.,1761.526,1.668
I think the President wants to make sure,1763.194,1.735
that he addresses the issue of illegal immigration and all,1764.929,1.602
"of its components in terms of visa reform,",1766.531,2.102
"border security, the wall, all of these things,",1768.633,3.971
in a system of priorities.,1772.604,1.434
"And right now, the priority is to make sure that folks",1774.038,2.403
who present a public-safety concern,1776.441,2.002
to the United States and to our citizens are dealt,1778.443,2.102
"with first, and that&amp;#39;s what&amp;#39;s happened.",1780.545,1.335
"He&amp;#39;s also very pleased that, through his action",1781.88,3.203
and his vision for how he wants to move forward,1785.083,3.937
"on this, sees a huge drop of illegal border crossing.",1789.02,4.771
That is a big accomplishment for this presidency,1793.791,2.703
and is something that we&amp;#39;re obviously very proud of.,1796.494,1.935
"The Press: Border crossing is a big thing,",1798.429,1.102
but amnesty is a big part.,1799.531,1.234
Does he --,1800.765,1.201
Mr. Spicer: I understand that.,1801.966,1.135
I&amp;#39;ve just walked through the question.,1803.101,1.134
Jonathan.,1804.235,1.101
"The Press: Sean, how confident are you that",1805.336,1.535
there will not be a shutdown?,1806.871,1.468
"Can you, from that podium, guarantee that there will",1808.339,1.535
not be a government shutdown?,1809.874,1.302
Mr. Spicer: I can&amp;#39;t guarantee anything.,1811.176,2.402
(Laughter.),1813.578,1.435
The Press: How close can you get to confidence --,1815.013,1.701
Mr. Spicer: But I think that the work that Director Mulvaney,1816.714,2.169
and others have made in these negotiations has been,1818.883,3.904
very positive.,1822.787,1.301
They feel very confident that that won&amp;#39;t happen.,1824.088,1.869
The Press: So he won&amp;#39;t insist that his priorities,1825.957,3.537
"get funded on the border, the wall, or increase security?",1829.494,3.203
Mr. Spicer: That&amp;#39;s not what I said.,1832.697,2.469
I said that I think that --,1835.166,1.769
The Press: Is he willing to shut down the government,1836.935,1.234
to accomplish that?,1838.169,1.568
"Mr. Spicer: No, it&amp;#39;s not -- look, they are",1839.737,1.535
currently negotiating.,1841.272,1.101
We feel very confident that they understand,1842.373,2.436
the President&amp;#39;s priorities and that we&amp;#39;ll come,1844.809,1.402
to an agreement by the end of Friday.,1846.211,1.568
"The Press: And on the 100 days, if I could just follow up.",1847.779,2.702
The contract with the American voter that,1850.481,3.104
the President signed included 10 pieces of legislation.,1853.585,2.636
"Right now, he&amp;#39;s 0 for 10, and only one of those",1856.221,2.602
has been introduced.,1858.823,1.402
Mr. Spicer: Right.,1860.225,1.234
And I think we&amp;#39;re going to continue to work with,1861.459,1.602
"Congress -- as he says in that document, I will work",1863.061,1.768
with Congress to achieve these things; we are going,1864.829,2.136
to continue to work with Congress to achieve those.,1866.965,1.701
The Press: But why have nine of them not even,1868.666,1.702
been introduced yet?,1870.368,1.468
Mr. Spicer: I think when you look at what he has,1871.836,1.568
"done in terms of the Supreme Court justice,",1873.404,1.902
"the executive orders, the number of legislation,",1875.306,2.569
there&amp;#39;s a lot that has gotten done.,1877.875,1.335
I don&amp;#39;t think anyone -- I remember very clearly,1879.21,2.669
"the first few weeks and still, to some extent, the comments",1881.879,3.738
that got made about the pace that,1885.617,1.334
we were keeping and we have kept.,1886.951,1.468
The President has been extremely busy.,1888.419,2.002
And I think when you recognize the amount,1890.421,1.802
of issues that he&amp;#39;s tackled and the amount of progress,1892.223,2.636
"that he&amp;#39;s made, it is very significant, and we will",1894.859,4.972
continue to present all that throughout the week.,1899.831,2.469
"But again, as I said to Major, I think you can",1902.3,1.935
look at a few of these areas and nitpick a couple,1904.235,3.17
"of them, but I think, overall, he has signed",1907.405,2.502
"a record number of executive orders, he has rolled back",1909.907,2.77
regulatory reforms --,1912.677,1.368
The Press: But this isn&amp;#39;t nitpicking.,1914.045,1.268
These are 10 pieces of legislation --,1915.313,1.301
"Mr. Spicer: No, I understand that, but --",1916.614,1.201
The Press: -- he promised to take action on in his 100 days.,1917.815,1.135
Mr. Spicer: But I don&amp;#39;t think there&amp;#39;s any question,1918.95,1.535
that the President has done a significant amount,1920.485,1.668
for the American people on the issues that he has put,1922.153,2.569
forward during the campaign.,1924.722,1.302
"The Press: And just to be clear, you&amp;#39;re not",1926.024,0.934
"describing the wall and healthcare as nitpicking,",1926.958,1.802
are you?,1928.76,2.135
"Mr. Spicer: No, I&amp;#39;m not -- those pieces are not small.",1930.895,4.805
"But I&amp;#39;m saying in terms of overall, what he has",1935.7,2.035
"accomplished, has been unbelievably significant",1937.735,2.102
when you talk about all of the other areas --,1939.837,2.136
"the regulatory relief, the efforts that he&amp;#39;s made",1941.973,2.202
"on immigration, on trade.",1944.175,1.869
All of those issues.,1946.044,1.134
"And again, what I&amp;#39;m trying to say is, when you look",1947.178,2.069
at everything that he&amp;#39;s done and the amount that,1949.247,2.102
"he&amp;#39;s accomplished in these first 100 days, I think",1951.349,2.302
"you can go back and find an area, one or two,",1953.651,2.569
"and say, okay, well, he didn&amp;#39;t do this.",1956.22,2.002
But I think you have to look at it in totality,1958.222,1.402
of what he actually did get done.,1959.624,2.335
Jim.,1961.959,1.369
"The Press: Sean, on the wall, why is there even",1963.328,1.334
a discussion about shutting down the government over,1964.662,1.335
paying for the wall?,1965.997,1.168
Isn&amp;#39;t Mexico supposed to pay for the wall?,1967.165,1.768
"Mr. Spicer: Well, I think, Jim, the President has",1968.933,1.335
made very clear that initially we needed,1970.268,1.368
"to get the funding going, and there&amp;#39;s several mechanisms",1971.636,3.437
to make sure that that happens.,1975.073,1.501
That funding piece will happen in due time.,1976.574,1.769
The Press: But that is a promise that the President,1978.343,2.469
made during the campaign time and again --,1980.812,1.835
Mr. Spicer: I understand that.,1982.647,1.535
The Press: -- that Mexico would pay for the wall.,1984.182,1.301
And now we&amp;#39;re having a discussion that the,1985.483,1.168
government might shut down over the wall,1986.651,1.768
and who&amp;#39;s going to pay for it.,1988.419,1.468
Mr. Spicer: Right.,1989.887,1.068
"So, a couple things.",1990.955,1.135
"One, as I pointed out to Jonathan, we feel very",1992.09,1.301
confident the government is not going to shut down.,1993.391,1.535
"Number two is, I think the President has been very",1994.926,1.802
clear in the past about the fact that -- and this,1996.728,3.036
is not a new thing; he talked about this --,1999.764,2.436
that in order to get the ball rolling on border security,2002.2,2.369
"and the wall, that he was going to have to use the",2004.569,2.002
current appropriations process but he would make,2006.571,2.202
